,KEYWORDS,SUMMARY,TEXT,TITLE,URL
74,"['dye', 'dyeing', 'claims', 'student', 'school', 'color', 'japan', 'students', 'sues', 'hair', 'forced', 'black']","A Japanese teenager is suing her local government after her public high school forced her to dye her hair black, the student alleges.
According to local media, the school has a policy that all students must have black hair to attend.
Though she ensured her daughter’s hair color was natural – some schools in Japan force lighter-haired students to prove their hair color by carrying photos of them as children – the school still forced her to dye her hair black to conform to the rules.
Now the teen is saying that the hair dye, which they forced her to do as often as every four days, left burns and rashes to her scalp.
He also said the school has a ban on bleached or lightened hair, but would not confirm if dyeing the hair black is allowed.","A Japanese teenager is suing her local government after her public high school forced her to dye her hair black, the student alleges.

The teenager, whose name has not been released, was a student at the Kaifukan School in Habikino City, Japan. According to local media, the school has a policy that all students must have black hair to attend.

GRANDMA OUTRAGED AT SCHOOL CALLING 11-YEAR-OLD'S DRESS 'DISTRACTING'

Unfortunately, the 18-year-old had naturally brown hair. The suit says that the student’s mom reached out to the school before her enrollment, informing them of her daughter’s lighter hair color. Though she ensured her daughter’s hair color was natural – some schools in Japan force lighter-haired students to prove their hair color by carrying photos of them as children – the school still forced her to dye her hair black to conform to the rules.

Now the teen is saying that the hair dye, which they forced her to do as often as every four days, left burns and rashes to her scalp.

“The dyeing damaged the health of the scalp and hair,” the plaintiff claims. “[Natural] physical features were negated and mental anguish resulted.”

The family is suing the Osaka Prefectural Government for 2.2 million yen (about $19,300) in damages she incurred from the hair dyeing and abuse.

This comes after they tried to file a complaint with the school once the incidents occurred. The complaint was dismissed and the student did not return to school beginning September 2016.

FOLLOW US ON FACEBOOK FOR MORE FOX LIFESTYLE NEWS

Masahiko Takahashi, the head of the school, declined to comment on the open case, but he did confirm that the school has strict rules about hair and dress code. He also said the school has a ban on bleached or lightened hair, but would not confirm if dyeing the hair black is allowed.

The Asahi Shimbun newspaper writes that the schools force the students to have dark hair to “protect” them from being berated by school officials, since light hair is seen as abnormal in Japan.","Student sues government after school forced her to dye her hair black, she claims",https://www.foxnews.com/lifestyle/2017/11/01/student-sues-government-after-school-forced-her-to-dye-her-hair-black-claims.html
75,"['base', 'trump', 'service', 'air', 'addresses', 'president', 'yokota', 'members']",,,President Trump addresses service members at Yokota air base,http://video.foxnews.com/v/5635685132001/
76,"['revamps', 'internal', 'taken', 'trumps', 'employee', 'media', 'twitter', 'social', 'rogue', 'account', 'security', 'deactivated']","Twitter says that it has revamped its internal security after a rogue employee briefly deactivated President Donald Trump’s Twitter account.
“My Twitter account was taken down for 11 minutes by a rogue employee.
Evan Blair, co-founder of social media security firm ZeroFox said that, while Trump's account was not hacked, the deactivation incident is still cause for concern.
In the hands of a bad actor, Trump’s Twitter account could even be used to target certain corporate valuations or market segments.""
The brief deactivation of Trump’s Twitter account on Thursday also sparked amusement on social media, with some people hailing the rogue employee as a “hero.” The employee has not been named.","Twitter says that it has revamped its internal security after a rogue employee briefly deactivated President Donald Trump’s Twitter account.

“We have implemented safeguards to prevent this from happening again,” Twitter tweeted Friday. “We won’t be able to share all details about our internal investigation or updates to our security measures, but we take this seriously and our teams are on it.”

TWITTER SECURITY SLAMMED AFTER ROGUE EMPLOYEE DEACTIVATES TRUMP’S ACCOUNT

Experts slammed Twitter’s internal security after the employee took down the President’s Twitter account for 11 minutes on Thursday. The social media site said that the account was taken down by a customer support employee during their last day with the company.

Trump, whose @realDonaldTrump account has 41.8 million followers, addressed the situation during a tweet early Friday. “My Twitter account was taken down for 11 minutes by a rogue employee. I guess the word must finally be getting out-and having an impact,” he tweeted.

TWITTER SUSPENSION: HERE ARE A FEW ACCOUNTS THAT HAVE BEEN DEACTIVATED

The President turned his Twitter account into a powerful political weapon during his run to the White House. Experts, however, have warned that hackers could potentially use the same account to wreak havoc.

Evan Blair, co-founder of social media security firm ZeroFox said that, while Trump's account was not hacked, the deactivation incident is still cause for concern. ""Trump’s personal Twitter account has become the official mouthpiece of the United States, making the national security or domestic safety implications of a compromised account far ranging,"" he explained, in an email to Fox News. ""If his account falls into the wrong hands, malicious actors could send out a fake tweet that could impact the stock market, threaten national security or possibly prompt foreign military action. In the hands of a bad actor, Trump’s Twitter account could even be used to target certain corporate valuations or market segments.""

The brief deactivation of Trump’s Twitter account on Thursday also sparked amusement on social media, with some people hailing the rogue employee as a “hero.” The employee has not been named.

Follow James Rogers on Twitter @jamesjrogers",Twitter revamps internal security after rogue employee deactivated Trump's account,https://www.foxnews.com/tech/2017/11/03/twitter-revamps-internal-security-after-rogue-employee-deactivated-trumps-account.html
77,"['disguised', 'jersey', 'teens', 'bushes', 'charges', 'njcom', 'pranksters', 'rahway', 'website', 'park', 'county', 'report', 'told', 'visitorswe', 'face']","It may be time for some teenage New Jersey pranksters to make like a tree and leaf.
Three teens known as the ""Rahway Bushmen"" have been pranking people in Rahway River Park, NJ.com reports.
Two of the high school students dress up as bushes while a third acts as lookout, according to the report.
""We were trying to be harmless,"" one of the teens told the website.
""It's great until the first person falls and sues the county,"" Union County Public Information Officer Sebastian D'Elia told NJ.com.","It may be time for some teenage New Jersey pranksters to make like a tree and leaf.

Three teens known as the ""Rahway Bushmen"" have been pranking people in Rahway River Park, NJ.com reports.

Two of the high school students dress up as bushes while a third acts as lookout, according to the report. They stand in the park and say ""hi"" to unsuspecting visitors.

""We were trying to be harmless,"" one of the teens told the website. ""It's more or less an idea to try to make people smile.""

The pranksters reportedly refused to identify themselves.

""It's great until the first person falls and sues the county,"" Union County Public Information Officer Sebastian D'Elia told NJ.com. ""We never advise anyone to do anything of this nature.""

The teens will be arrested if they're caught in the act, he said.

The Associated Press contributed to this report.",Teens disguised as bushes in New Jersey park may face charges,https://www.foxnews.com/us/2017/10/26/teens-disguised-as-bushes-in-new-jersey-park-may-face-charges.html
