,KEYWORDS,SUMMARY,TEXT,TITLE,URL
231,"['vessel', 'women', 'dogs', 'taiwanese', 'uss', 'ship', 'reaches', 'okinawa', 'sailors', 'sea', 'food', 'appel', 'rescued', 'fuiava', 'base']","A U.S. Navy ship carrying two sailors it rescued from their storm-battered sailboat in the Pacific docked Monday at an American naval base in Japan.
Appel and Fuiava had left Honolulu on May 3 aboard Appel's 50-foot vessel the Sea Nymph for what was supposed to be an 18-day trip to Tahiti.
They were thousands of miles in the wrong direction when a Taiwanese fishing vessel found them.
Towing the sailboat damaged it further, but Appel swam to the Taiwanese vessel to make a mayday call.
Appel credited their survival in part to the veteran sailors in Hawaii who had warned them to prepare well for their journey.","A U.S. Navy ship carrying two sailors it rescued from their storm-battered sailboat in the Pacific docked Monday at an American naval base in Japan.

Jennifer Appel and Tasha Fuiava were standing with the USS Ashland's commanding officer and others high on the bridgeway when the ship arrived at White Beach Naval Facility in Okinawa, five days after it picked up the women and their two dogs from their boat, 900 miles southeast of Japan.

Appel and Fuiava had left Honolulu on May 3 aboard Appel's 50-foot vessel the Sea Nymph for what was supposed to be an 18-day trip to Tahiti.

Storms flooded the engine and damaged the mast and sails so badly, they couldn't generate enough wind power to stay on course. They drifted aimlessly and sent unanswered distress calls for 98 consecutive days.

They were thousands of miles in the wrong direction when a Taiwanese fishing vessel found them. Towing the sailboat damaged it further, but Appel swam to the Taiwanese vessel to make a mayday call.

They'd run out of food for the dogs, and the woman began sharing their own, leaving their food supply 90 percent depleted by the time they were rescued.

The USS Ashland on Wednesday picked up the women, plus the dogs Zeus and Valentine, all four looking remarkably fit for having been lost at sea for nearly six months.

Appel told reporters on Friday that they were beginning to believe they were completely out of luck when they saw the U.S. Navy ship chugging toward them.

""When I saw the gray ship on the horizon, I was just shaking,"" she said then. ""I was ready to cry, I was so happy. I knew we were going to live.""

Although Appel has been sailing the Hawaiian islands for 10 years and spent two years preparing for this voyage, she acknowledged she and Fuiava, a novice sailor, may not have prepared as well as they could have.

Appel credited their survival in part to the veteran sailors in Hawaii who had warned them to prepare well for their journey.

""They said pack every square inch of your boat with food, and if you think you need a month, pack six months, because you have no idea what could possibly happen out there,"" Appel said. ""And the sailors in Honolulu really gave us good advice. We're here.""",Ship with sailors rescued at sea reaches US base in Okinawa,https://www.foxnews.com/world/2017/10/29/ship-with-sailors-rescued-at-sea-reaches-us-base-in-okinawa.html
232,"['women', 'japanese', 'trump', 'role', 'japan', 'icon', 'woman', 'ivanka', 'tokyo', 'fashion', 'times', 'model', 'post']","And it’s very surprising to Japanese women that she can also talk about things that are important to society.”The DailyMail added that Japan views Ivanka as ""a fashion icon"" who will attract onlookers during her stay.
Nevertheless, the women who heard Trump’s speech seemed to view her as a role model.
“Her fashion is great.”Another woman and former U.S. Senate staffer Mieko Nakabayashi, told the site that Ivanka’s “kind of celebrity” resonates with the Japanese people.
In a January article in the Independent, titled “Why Japan loves Ivanka Trump,” an Ivanka-admiring blogger — who reportedly writes about the first daughter’s fashion and lifestyle for the Japan Times — hinted that not everybody is as enamored of Donald.
“That is something that Japanese women want, but have a hard time doing in a still male-dominated society.”","If Japan’s media coverage of Ivanka Trump’s arrival in Tokyo is any indication, the country seems to be slightly obsessed with the first daughter’s high-ranking position and “great” sense of style.

Trump’s arrival at the Narita International Airport on Thursday evening was covered by four television stations and treated as “major news,” according to the New York Times. The same went for her subsequent dinner plans at a swanky Tokyo restaurant.

The city’s metropolitan police, too, have assigned Trump an all-female “riot squad” to protect her from overzealous admirers during the visit — and it’s the same security measure they plan to extend to first lady Melania Trump when she and President Donald Trump arrive in Japan on Nov. 5.

VICTORIA BECKHAM IS ONE DESIGNER NOT OPPOSED TO DRESSING MELANIA TRUMP

“Many people think she’s like a princess,” said Lully Miura, a political scientist at the University of Tokyo, in a statement to the Washington Post. “She’s well educated, beautiful, sophisticated and rich. And it’s very surprising to Japanese women that she can also talk about things that are important to society.”

The DailyMail added that Japan views Ivanka as ""a fashion icon"" who will attract onlookers during her stay.

トランプの娘〜 誕生日一緒やん🤗✨✨ #アメリカ大統領#トランプ#イヴァンカ #なんか嬉しい#向こうの誕生日パーティーは嘸かし盛大なんやろな… A post shared by Hirokazu Mizusawa (@hirokazumizusawa) on Feb 1, 2017 at 10:27pm PST

On Friday, Ivanka spoke at the World Assembly for Women Conference at Tokyo’s Prince Hotel, which reportedly held a lottery for attendees.

The event was not as well attended as one might expect considering her popularity — Trump delivered an 18-minute speech to a partially-empty auditorium — but White House spokesman Josh Raffel said the hotel’s strict security measures kept people from getting to their seats. (A Washington Post reporter in attendance denies this was the case.) Nevertheless, the women who heard Trump’s speech seemed to view her as a role model.

“She is a beautiful female leader,” Rena Hayakawa, a 21-year-old college student, told the Times. “Her fashion is great.”

Another woman and former U.S. Senate staffer Mieko Nakabayashi, told the site that Ivanka’s “kind of celebrity” resonates with the Japanese people.

However, it’s unclear if Ivanka’s father is looked at as favorably. In a January article in the Independent, titled “Why Japan loves Ivanka Trump,” an Ivanka-admiring blogger — who reportedly writes about the first daughter’s fashion and lifestyle for the Japan Times — hinted that not everybody is as enamored of Donald.

FOLLOW US ON FACEBOOK FOR MORE FOX LIFESTYLE NEWS

“She is a good example that a woman can do an outstanding job and handle a misogynist father like Trump, without pushing too much of a feminist agenda or confronting men too much,” said Yuriko Shinzato.

“That is something that Japanese women want, but have a hard time doing in a still male-dominated society.”",Why Ivanka Trump is a role model — and fashion icon — in Japan,https://www.foxnews.com/lifestyle/2017/11/03/why-ivanka-trump-is-role-model-and-fashion-icon-in-japan.html
233,"['interested', 'victory', 'secured', 'orleans', 'battle', 'americas', 'second', 'independence', 'war']",You May Be Interested In...,You May Be Interested In...,How Victory at the Battle of New Orleans Secured America’s Second War For Independence,https://radio.foxnews.com/2017/11/01/how-victory-at-the-battle-of-new-orleans-secured-americas-second-war-for-independence/
234,"['yeah', 'think', 'david', 'cheryl', 'hines', 'curb', 'real', 'life', 'enthusiasm', 'larry', 'far', 'return', 'davids']","When Cheryl Hines' phone started lighting up with messages congratulating her on the return of ""Curb Your Enthusiasm,"" she was confused.
""It was really easy to get back to Cheryl David and Larry David because it's a very well constructed universe that's not too far off from real life,"" Hines said.
The actress, who is married to Robert Kennedy Jr. in real life, is so convicing as David's wife, people think the two are actually married.
""Still to this day, I think people think that I might be Larry David's wife.""
Luckily, Hines doesn't have to put up with David's crazy shenanigans in real life.","When Cheryl Hines' phone started lighting up with messages congratulating her on the return of ""Curb Your Enthusiasm,"" she was confused.

The hit HBO series went off the air in 2011 and Hines had just had dinner with show creator and star Larry David the night before the return of the show was announced.



""I saw on my phone that people were texting me saying, 'Yay! ""Curb"" is coming back,'"" the actress recalled to Fox News.

She quickly texted David, ""So, is 'Curb' coming back?'""

Her on-screen ex-husband said yes so Hines followed up, ""Am I in it?""

""[Larry] said, 'Yeah, if you can arrange your schedule around it.' And I said, 'Yeah I think I can.'""

Even though it had been six years since Hines had played the beauty David somehow managed to woo -- and then lose -- on the series based on David's life, the 52-year-old had no trouble slipping back into character.

""It was really easy to get back to Cheryl David and Larry David because it's a very well constructed universe that's not too far off from real life,"" Hines said.

The actress, who is married to Robert Kennedy Jr. in real life, is so convicing as David's wife, people think the two are actually married.

""Still to this day, I think people think that I might be Larry David's wife.""

Luckily, Hines doesn't have to put up with David's crazy shenanigans in real life. Dealing with the ""Seinfeld"" creator's onscreen neuroses has helped her in her marriage to Kennedy.

""It does help to remind yourself to pick and choose your battles,"" she shared. ""[But] there's only one Larry. Larry gets himself into problems and situations that normal people don't.""

""Curb Your Enthusiasm"" return to HBO on Sunday night.",Cheryl Hines on 'Curb Your Enthusiasm': It's 'not too far off from real life',http://www.foxnews.com/entertainment/2017/09/29/cheryl-hines-on-curb-your-enthusiasm-its-not-too-far-off-from-real-life.html
235,"['kirk', 'whip', 'greg', 'w', 'updated', 'shannon', 'week', 'perino', 'stirewalt', 'start', 'stirewaltdana', 'cameron', 'revive']","Start the day with this quick news podcast!
· Perino & StirewaltDana Perino & Chris Stirewalt dishing on politics news every week.
· The One w/ Greg GutfeldYou know him.
Greg Gutfeld.
· Livin’ the BreamInspirational stories, personal anecdotes and an insider’s perspective from Shannon Bream.","More Podcasts…

· The Whip Around

In hurry? Start the day with this quick news podcast!

· Hourly Newscast

The news updated every hour!

· The Five

It’s the full primetime show. FREE!

· Perino & Stirewalt

Dana Perino & Chris Stirewalt dishing on politics news every week.

· The One w/ Greg Gutfeld

You know him. You love him. Greg Gutfeld.

· Livin’ the Bream

Inspirational stories, personal anecdotes and an insider’s perspective from Shannon Bream.

· HemmerTime

One on one with engaging personalities hosted by Bill Hemmer.",Kirk Cameron ‘Revive Us 2’,https://radio.foxnews.com/2017/11/03/kirk-cameron-revive-us-2/
236,"['eastern', 'fox', '1132017', 'mf', 'audio', 'clipthe', 'radio', 'hour', 'talk', 'kilmeade', 'listen']","Audio clip: Listen to audio clip.
The first hour of the Brian Kilmeade Radio Show on FOX News Talk 9am-Noon Eastern M-F.","Audio clip: Listen to audio clip.

The first hour of the Brian Kilmeade Radio Show on FOX News Talk 9am-Noon Eastern M-F.",11/3/2017 First Hour,https://radio.foxnews.com/2017/11/03/1132017-first-hour/
237,"['explains', 'victory', 'trumps', 'win', 'dilbert', 'creator', 'bigly']",,,Dilbert creator explains Trump's victory in 'Win Bigly',http://video.foxnews.com/v/5635733972001/
238,"['press', 'newspaper', 'charges', 'huck', '70', 'county', 'dead', 'daily', 'argus', 'michigan', 'cows', 'farm', 'livingston']","A Michigan man could face up to four years in prison if convicted of animal cruelty charges after about 70 cows were found dead on his farm.
Keith Edwin Huck Jr., 61, of Cohoctah Township, faces misdemeanor charges related to failing to bury animals and failure to license a dog, the Livingston Daily Press & Argus reported.
When authorities visited the farm, “Three pigs and five cows were recovered alive and approximately 70 cows were found dead,” Livingston County Prosecutor William Vailliencourt said.
Court records suggest that Livingston County Animal Control may have begun an investigation in May, the newspaper reported.
Click here for more from the Livingston Daily Press & Argus.","A Michigan man could face up to four years in prison if convicted of animal cruelty charges after about 70 cows were found dead on his farm.

Keith Edwin Huck Jr., 61, of Cohoctah Township, faces misdemeanor charges related to failing to bury animals and failure to license a dog, the Livingston Daily Press & Argus reported.

A warrant for Huck was issued Oct. 25, the newspaper said.

When authorities visited the farm, “Three pigs and five cows were recovered alive and approximately 70 cows were found dead,” Livingston County Prosecutor William Vailliencourt said.

Court records suggest that Livingston County Animal Control may have begun an investigation in May, the newspaper reported.

Click here for more from the Livingston Daily Press & Argus.",About 70 dead cows found on Michigan farm,http://www.foxnews.com/us/2017/11/05/about-70-dead-cows-found-on-michigan-farm.html
239,"['attack', 'pledge', 'allegiance']",,,Pledge of Allegiance under attack,http://video.foxnews.com/v/5636019276001/
240,"['friends', 'money', 'psycho', 'told', 'california', 'house', 'teen', 'britt', 'passed', 'fox5', 'cancer', 'raise', 'american', 'hosts', 'society', 'haunted']","A California teenager is keeping up his tradition of hosting a haunted house with his friends -- but this year he wanted to do it for a good cause.
Cameron Britt, 15, of the Tierrasanta area of San Diego, said he and his friends have transformed his family’s home into a haunted house for the past three years, FOX5 reported.
“I honestly don’t know what was in my mind,” he told FOX5.
She was always there for me.”Britt told FOX5 that this Saturday the house will be open for free to the public and donations are welcome.
All the money will be given to the American Cancer Society.","A California teenager is keeping up his tradition of hosting a haunted house with his friends -- but this year he wanted to do it for a good cause.

Cameron Britt, 15, of the Tierrasanta area of San Diego, said he and his friends have transformed his family’s home into a haunted house for the past three years, FOX5 reported. Britt said he came up with the idea as a way to tackle another hobby.

“I honestly don’t know what was in my mind,” he told FOX5. “I just decided I needed another hobby on top of my other hobbies.”

NEW DETAILS REVEALED IN CALIFORNIA MOMS DISAPPEARANCE

This year, Britt and his friends decided on the theme of ""Psycho Motel."" Britt said it was inspired by a number of horror movies.

“It’s kind of a mish-mash of horrors,"" he said. “Incorporating everything from different movies mixing it up to make like a psycho killer clown area.""

Britt explained this year was tough on his family after his grandmother passed away five months ago from sarcoma, a rare cancer that affects the bones and soft tissues, according to the American Cancer Society.

POLICE CATCH BEAR OUT FOR A STROLL IN CALIFORNIA TOWN

“It’s been hard for my family since my grandma passed away from cancer so we’re going to start doing charity nights,” Britt said. “I just took it really hard. She was always there for me.”

Britt told FOX5 that this Saturday the house will be open for free to the public and donations are welcome. All the money will be given to the American Cancer Society.

“She’s a huge supporter of everything I do, so this is for you, grandma,” Britt said.",California teen hosts haunted house to raise money for American Cancer Society,https://www.foxnews.com/us/2017/10/26/california-teen-hosts-haunted-house-to-raise-money-for-american-cancer-society.html
241,"['gingrich', 'immigration', 'work', 'united', 'trump', 'need', 'york', 'terrorists', 'diversity', 'lottery', 'system', 'smart', 'scrap', 'honest', 'newt']","By Newt Gingrich, Fox NewsPresident Trump is right: We should end the diversity lottery for immigration.
The lottery system should instead be replaced with a merit-based system that actively seeks people who will help grow the American economy.
However, in light of the terrorist attacks in New York, Orlando, San Bernardino, Boston and elsewhere, closing the lottery loophole isn’t enough.
We need to take far more decisive steps in improving and securing our immigration system.
They should be thoroughly interrogated and a new law should be developed so that captured terrorists are not able to benefit from Miranda rights.","By Newt Gingrich, Fox News

President Trump is right: We should end the diversity lottery for immigration. It is an absurd system for randomly selecting who should come to the United States. The lottery system should instead be replaced with a merit-based system that actively seeks people who will help grow the American economy.

Instead of continuing liberal, politically correct immigration rules that emphasize what the left calls “diversity,” we need a system that focuses on an individual’s merit, work and achievement. What a person can contribute to America should be more important when making immigration decisions than whether he or she fits some political science mantra of diversity.

However, in light of the terrorist attacks in New York, Orlando, San Bernardino, Boston and elsewhere, closing the lottery loophole isn’t enough. We need to take far more decisive steps in improving and securing our immigration system.

First, we need to identify terrorists as enemy combatants. They should be thoroughly interrogated and a new law should be developed so that captured terrorists are not able to benefit from Miranda rights.","Newt Gingrich: Get Smart -- Scrap The Diversity Lottery, Be Honest About Terrorists",http://nation.foxnews.com/2017/11/03/newt-gingrich-get-smart-scrap-diversity-lottery-be-honest-about-terrorists
242,"['judge', 'justice', 'jeanine']",,,"Justice With Judge Jeanine - Saturday, November 4",https://video.foxnews.com/v/5635235610001/?playlist_id=5556999982001
243,"['mainland', 'north', 'missile', 'working', 'usa', 'reach', 'korea', 'united', 'version', 'report', 'todaynorth', 'states']","Kim Hjelmgaard, USA TODAYNorth Korea is developing an advanced version of an intercontinental ballistic missile that could reach the mainland United States, according to a report.","Kim Hjelmgaard, USA TODAY

North Korea is developing an advanced version of an intercontinental ballistic missile that could reach the mainland United States, according to a report.",North Korea Working On Missile That Could Reach U.S. Mainland: Report,http://nation.foxnews.com/2017/11/02/north-korea-working-missile-could-reach-us-mainland-report#commenting
244,"['revelations', 'clintondnc', 'hannity', 'corruption', 'highest', 'level', 'seen', 'lifetime']",,,Hannity on Clinton-DNC Revelations: 'Highest Level of Corruption We Have Seen in Our Lifetime',http://insider.foxnews.com/2017/11/03/sean-hannity-monologue-donna-brazile-claims-about-hillary-clinton-dnc
245,"['worried', 'world', 'wartime', 'zucchini', 'work', 'germany', 'zucchinipolice', 'squashed', 'weighed', 'fears', 'zucchinithe', 'officers', 'bomb', 'mistaken', 'wwii']","A worried resident in Germany alerted police to what he thought was a World War II bomb in his garden.
Officers rushed over — and found a particularly large zucchini.
Police were summoned to the scene in Bretten, near the southwestern city of Karlsruhe, on Thursday morning by an 81-year-old man.
They said in a statement Friday that officers determined ""the object, which really did look very like a bomb"" was actually a nearly 16-inch zucchini.
Unexploded wartime bombs are unearthed frequently during construction work in Germany, often forcing authorities to evacuate tens of thousands of residents while they are defused.","A worried resident in Germany alerted police to what he thought was a World War II bomb in his garden. Officers rushed over — and found a particularly large zucchini.

Police were summoned to the scene in Bretten, near the southwestern city of Karlsruhe, on Thursday morning by an 81-year-old man.

They said in a statement Friday that officers determined ""the object, which really did look very like a bomb"" was actually a nearly 16-inch zucchini.

The offending vegetable, which was very dark in color, weighed about 11 pounds. Police believe someone threw it over a hedge into the garden.

Unexploded wartime bombs are unearthed frequently during construction work in Germany, often forcing authorities to evacuate tens of thousands of residents while they are defused.",Fears squashed: Zucchini mistaken for WWII bomb in Germany,https://www.foxnews.com/science/2017/11/03/fears-squashed-zucchini-mistaken-for-wwii-bomb-in-germany.html
246,"['essel', 'step', 'going', 'ashley', 'youre', 'twitter', 'letting', 'steps', 'stole', 'sorry', 'write', 'im', 'ex']","Four steps to take when deciding if you should let someone who betrayed you back into your life.
FOX's Ashley Papa has more:Betrayal by a loved one is one of the most painful experiences.
I went them to write down the specific things they did who they did them with and why.
With FOX on Love, I'm Ashley Papa.
Follow Ashley Papa on Twitter: @AshleyMPapaFollow David Essel on Twitter: @DavidEssel","Audio clip: Listen to audio clip.

Four steps to take when deciding if you should let someone who betrayed you back into your life.

FOX's Ashley Papa has more:

Betrayal by a loved one is one of the most painful experiences. If you're thinking of letting someone who betrayed you back into your life, counselor, David Essel says first you must forgive:

""If you don't do this you're going to mistrust them, you're going to look for problems when maybe there aren't any, the other big problem you run into is that if this relationship doesn't work out and you want to move on and you haven't forgiven them you're going to put the next person you date on the cross.""

Step two is to own your role in the dysfunction of the relationship. The third step is to have the betrayer write you an apology letter:

""So in other words if someone says i'm so sorry for cheating on you, i'm so sorry i stole money from you that's not enough. I went them to write down the specific things they did who they did them with and why. See, that means they're sincere about coming back in and earning back your trust.""

Fourth, Essel says if they stole something they must pay you back. If they don't do step three or four- let them go.

With FOX on Love, I'm Ashley Papa.

Follow Ashley Papa on Twitter: @AshleyMPapa

Follow David Essel on Twitter: @DavidEssel",Steps You Should Take When Letting Your Ex Back In,https://radio.foxnews.com/2017/11/05/steps-you-should-take-when-letting-your-ex-back-in/
247,"['game', 'eammonn', 'fox', 'maker', 'nintendo', 'latest', 'high', 'sneak', 'peak', 'games', 'switch', 'realistic', 'racing']","The first realistic racing game for the Nintendo Switch is on it's way.
FOX's Eammonn Dignam spoke to the head of maker Eden Games in the latest ""FOX Bits.""
'Gear.Club Unlimited' is the first realistic racing game that will appear exclusively on the Nintendo 'Switch.'
CEO of Eden Games David Nadal, let FOX Bits test drive the game prior to it's December first release.
16 official manufacturers have licensed 30 different vehicles from muscle cars like Dodge and Ford to high end BMW's and Mercedes.","Audio clip: Listen to audio clip.

The first realistic racing game for the Nintendo Switch is on it's way.

FOX's Eammonn Dignam spoke to the head of maker Eden Games in the latest ""FOX Bits.""

Your insiders cheat code to gaming, I'm Eammonn Dignam.

'Gear.Club Unlimited' is the first realistic racing game that will appear exclusively on the Nintendo 'Switch.' CEO of Eden Games David Nadal, let FOX Bits test drive the game prior to it's December first release.

16 official manufacturers have licensed 30 different vehicles from muscle cars like Dodge and Ford to high end BMW's and Mercedes. In addition to online competition, the game will also bring back competition on the couch....

And just like many other games, they will be making the jump to competitive gaming, joining high end sports car maker McLaren's World's Fastest Gamer Competition.

Fox News Meteorologist Adam Klotz even sat down and hit the gas.

That's FOX Bits for Fox News.

Follow Eammonn Dignam on Twitter: @FOXBits247 & on Facebook",A Sneak Peak at the Latest Realistic Racing Game for Nintendo ‘Switch’,https://radio.foxnews.com/2017/10/26/a-sneak-peak-at-the-latest-realistic-racing-game-for-nintendo-switch/
