,KEYWORDS,SUMMARY,TEXT,TITLE,URL
142,"['dry', 'ballot', 'allowing', 'alcohol', 'restaurant', 'mulls', 'city', 'blanding', 'say', 'visitors', 'town', 'utah', 'sales', 'residents', 'booze']","Opponents of alcohol sales, like longtime resident and health department inspector Rick Meyer, said the prohibition is key to the city's character and public safety.
Dallin Redd, owner of a hardware store and a supporter of allowing alcohol sales, said he worries broad opposition in town to the monument may persuade residents who would have otherwise voted for alcohol sales to decide to keep it dry.
Last year voters in the village of Ephraim, Wisconsin's last dry municipality, lifted its ban on alcohol sales.
If Blanding votes to allow alcohol sales they would likely start in summer 2018, according to city manager Jeremy Redd.
Lyman, the city councilman, said even if the town votes to stay dry, he thinks attitudes toward alcohol are relaxing and the town will eventually allow it.","The rural Utah city of Blanding, one of the last ""dry"" communities in the Mormon-majority state, will ask voters Tuesday whether to allow beer and wine sales in town for the first time in more than 80 years.

Even though most locals are Mormon and their faith teaches its members to avoid alcohol, some restaurant and hotel owners say the city of 3,500 people needs to accommodate drinkers and the influx of tourists.

""I think that we shouldn't be imposing our standards on other people,"" said Sharon Guymon, a restaurant owner pushing for the change after years of customer complaints, including tourists sometimes storming out of her steakhouse after being denied a glass of wine.

Opponents of alcohol sales, like longtime resident and health department inspector Rick Meyer, said the prohibition is key to the city's character and public safety.

""You don't see anybody drunk walking up and down the streets,"" Meyer said.

Blanding is a waypoint for visitors traveling between Denver, southern Utah's national parks and the Grand Canyon. It's a conservative community that bills itself as the ""Base Camp to Adventure,"" on vast desert landscapes nearby, much of which is controlled by the U.S. government. The town itself has been a hotspot in decades-old debates over who controls land in the West, including the newly declared Bears Ears National Monument.

Besides worries about public safety and health, residents opposed to alcohol sales say the prohibition may curb visitors flocking to the area to see the new monument and prevent Blanding from turning into Moab, the red rock outdoor recreation mecca about an hour north that many in Blanding see as an out-of-control tourist trap.

""We want to be able to control the tourism a little more,"" said pharmacist Dana Nielson. ""Once alcohol is available, that opens it up for all these huge motels and everything. Especially again, with the Bears Ears situation as it is.""

Dallin Redd, owner of a hardware store and a supporter of allowing alcohol sales, said he worries broad opposition in town to the monument may persuade residents who would have otherwise voted for alcohol sales to decide to keep it dry.

""People are pretty nervous about the monument coming in and they don't like to see a lot of change,"" he said.

City officials say the town has been dry since the 1930s. Talk of repealing the prohibition has bubbled up periodically since then, including a 1983 city-commissioned opinion poll of residents that found overwhelming support for keeping the ban.

""It's probably time to see if the opinion has changed,"" said Joe Lyman, a city councilman and the only candidate running for mayor in Tuesday's election.

Many residents appear to be keeping their opinions to themselves.

Robert Ogle, a city councilman who suggested the question on alcohol sales be put on the ballot this year, said he's shocked there's been almost no public debate.

""I thought this would be a tinderbox,"" Ogle said. ""No one has said anything.""

The debate follows similar ones in other dry communities. Last year voters in the village of Ephraim, Wisconsin's last dry municipality, lifted its ban on alcohol sales.

Around the country, nine states have entire counties that are dry, while at least a dozen states have some dry municipalities, according to the National Alcohol Beverage Control Association.

Utah doesn't have any dry counties and only has about half a dozen dry communities, mostly small towns, according to Utah's Department of Alcoholic Beverage Control spokesman Terry Wood.

If Blanding votes to allow alcohol sales they would likely start in summer 2018, according to city manager Jeremy Redd.

Redd notes that residents and visitors who drink can already work around the city's ban because a convenience store 3 miles outside of town sells beer and a state-run liquor store is about 20 miles away.

Still, locals say visitors are surprised and sometimes angry at their sober options in Blanding.

In her restaurant, Guymon offers several varieties of non-alcoholic beer just so she can offer visitors a taste of what they're used to.

And Guymon still may be prohibited from serving alcoholic drinks if the ban is lifted. A preschool sits across the street from her restaurant so she'd likely violate state rules about serving alcohol that close to schools.

Lyman, the city councilman, said even if the town votes to stay dry, he thinks attitudes toward alcohol are relaxing and the town will eventually allow it.

""If it's not now, then it will be 10 years from now,"" he said. ""And I think 10 years after it changes, we'll look back and say it wasn't that big of a deal.""

___

Follow Price on Twitter at https://twitter.com/michellelprice",Booze on the ballot: Utah dry town mulls allowing alcohol,https://www.foxnews.com/us/2017/11/05/booze-on-ballot-utah-dry-town-mulls-allowing-alcohol.html
143,"['world', 'characters', 'working', 'theatre', 'episode', 'producer', 'series', 'audio', 'jim', 'clown', 'know', 'dale', 'consummate']","The Tony-award winner Jim Dale is one of the most physically gifted comics of his generation, yet most people only know him as the voice behind the wonderful Harry Potter audio books.
In the popular J.K. Rowling series, he plays 147 distinct characters which is a Guinness Book world record.
Jim shares stories from his early days doing physical comedy in the English music halls across the U.K.
The former NY Times theatre critic Charles Isherwood hosts this entertaining episode, which is part of our Broadway series.
The series producer Brad Newman adds insight.","Audio clip: Listen to audio clip.

The Tony-award winner Jim Dale is one of the most physically gifted comics of his generation, yet most people only know him as the voice behind the wonderful Harry Potter audio books. In the popular J.K. Rowling series, he plays 147 distinct characters which is a Guinness Book world record. In this episode, we learn how Jim came up with the voices behind those quirky characters, some of whom he met on the street, and others he borrowed from his eccentric family.

Subscribe and download on your favorite podcast platform: Apple Podcasts, Google Play, Tune In, Stitcher.

Jim shares stories from his early days doing physical comedy in the English music halls across the U.K. He also talks about getting signed by the famous Beatles producer, George Martin and his short but productive stint as a pop star. We also hear about his rise in the theatre, first working with Laurence Olivier's company and then crossing the pond where he won a Tony for his turn as the title character in the musical, ""Barnum.""

The former NY Times theatre critic Charles Isherwood hosts this entertaining episode, which is part of our Broadway series. The series producer Brad Newman adds insight.

Like us on Facebook. Follow us on Twitter and Instagram. We want to know what you think. Pitch us an artist, or simply spread the word and find out more about the series. #childrenofsong",Jim Dale: The Consummate Clown,https://radio.foxnews.com/2017/10/27/jim-dale-the-consummate-showman/
144,"['minutes', 'kasperowicz', 'having', 'impact', 'making', 'outage', 'trump', 'reach', 'pete', 'washington', 'twitter', 'rogue', 'shows', 'im']","by Pete Kasperowicz, Washington ExaminerPresident Trump said Friday that the decision by a ""rogue"" Twitter employee to take down his account for 11 minutes shows his efforts to reach people directly are making a difference.","by Pete Kasperowicz, Washington Examiner

President Trump said Friday that the decision by a ""rogue"" Twitter employee to take down his account for 11 minutes shows his efforts to reach people directly are making a difference.",Trump: Twitter Outage Shows I'm 'Having An Impact',http://nation.foxnews.com/2017/11/03/trump-twitter-outage-shows-im-having-impact
145,"['dining', 'white', 'going', 'house', 'restaurant', 'beautiful', 'local', 'trump', 'hell', 'washington', 'restaurants', 'start', 'president', 'dc']","Though President Donald Trump is reportedly a picky eater, he’s announced that the time has come to branch out of his comfort zone.
In a Nov. 2 interview, the president said that he’ll start frequenting local Washington, D.C. restaurants, as other presidents have done, amidst criticisms that he only dines out at Trump International Hotel.
DC BAR OFFERING 'MOSCOW MUELLER' COCKTAIL SPECIALS FOR INDICTMENTS""I'll tell you, my favorite restaurant ... rather than insulting anyone, I will say: I love the food in the White House.
""That being said ... in Washington you do have some great restaurants, and I'm going to start going to them,"" Trump said.
And I never thought of it, and I'm going to start doing it,” he added.","Though President Donald Trump is reportedly a picky eater, he’s announced that the time has come to branch out of his comfort zone. In a Nov. 2 interview, the president said that he’ll start frequenting local Washington, D.C. restaurants, as other presidents have done, amidst criticisms that he only dines out at Trump International Hotel.

Further, POTUS cited 1600 Pennsylvania Avenue as the home of his favorite dining establishment in the District, according to Washington Examiner.

DC BAR OFFERING 'MOSCOW MUELLER' COCKTAIL SPECIALS FOR INDICTMENTS

""I'll tell you, my favorite restaurant ... rather than insulting anyone, I will say: I love the food in the White House. The White House is the greatest restaurant ... It's the most beautiful,"" he said on “The Larry O'Connor Show”, according to the outlet.

""They do such a beautiful job,"" he added. ""This is such a beautiful, incredible place. I love it ... Special people, they've worked here for many, many years. Special people and the food is very, very good.""

PRO-TRUMP ARIZONA RESTAURANT WILL REOPEN AFTER CLOSING OVER FACEBOOK BACKLASH

Nevertheless, POTUS said that he has recently been disparaged for not patronizing restaurants in the area.

""That being said ... in Washington you do have some great restaurants, and I'm going to start going to them,"" Trump said.

FOLLOW US ON FACEBOOK FOR MORE FOX LIFESTYLE NEWS

""I was accused the other day, well, when I leave the White House, which is seldom, I always go to my hotel on Pennsylvania Avenue, and they say, 'He should go to other places.' And I never thought of it, and I'm going to start doing it,” he added.

Well-done steak with a side of ketchup and a Coca-Cola, coming right up, Mr. President.",President Trump says he’ll start dining at local D.C. restaurants,https://www.foxnews.com/food-drink/2017/11/04/president-trump-says-ll-start-dining-at-local-d-c-restaurants.html
146,"['japanese', 'navy', 'battle', 'war', 'naval', 'fleet', 'youll', 'gulf', 'straight', 'pearl', 'leyte']","The Battle of Leyte Gulf in October, 1944, was a desperate gamble by the Japanese navy to stop in its tracks America's march straight toward Tokyo.
It also marked the moment when the attack on Pearl Harbor was truly avenged, as some of the ships resurrected from the bottom of Pearl Harbor took on the Japanese fleet with some devastating results.
You'll also meet some of the sailors who, when faced with unbelievable odds and the biggest and best of the Japanese navy, didn't turn and run.
Legendary Admiral James Holloway talks about wreaking havoc on part of the Japanese fleet at Suriago Strait, using a textbook maneuver taught at every naval school.
The Battle of Leyte Gulf was the last great naval battle of World War II, and laid to waste the once invincible Japanese navy.","Audio clip: Listen to audio clip.

The Battle of Leyte Gulf in October, 1944, was a desperate gamble by the Japanese navy to stop in its tracks America's march straight toward Tokyo. It also marked the moment when the attack on Pearl Harbor was truly avenged, as some of the ships resurrected from the bottom of Pearl Harbor took on the Japanese fleet with some devastating results.

In this exciting episode of ""War Stories with Oliver North,"" you'll meet some of the men who landed with General Douglas MacArthur on the beaches at Leyte, and engaged in brutal jungle fighting with crack Japanese troops. You'll also meet some of the sailors who, when faced with unbelievable odds and the biggest and best of the Japanese navy, didn't turn and run. Instead they headed straight for what the rules of modern warfare spelled as certain defeat.

Legendary Admiral James Holloway talks about wreaking havoc on part of the Japanese fleet at Suriago Strait, using a textbook maneuver taught at every naval school. And you'll find out if the man in charge of the Third Fleet, Admiral William ""Bull"" Halsey, really did fall for one of the oldest tricks in the book.

The Battle of Leyte Gulf was the last great naval battle of World War II, and laid to waste the once invincible Japanese navy.",The Battle For Leyte Gulf,https://radio.foxnews.com/2017/10/10/the-battle-for-leyte-gulf/
147,"['north', 'conflict', 'bleak', 'weapons', 'assessment', 'nuclear', 'ability', 'toll', 'military', 'korea', 'way', 'war', 'koreas', 'nukes', 'destroying']","A ground invasion of North Korea is the only way to locate and destroy, with complete certainty, all components of leader Kim Jong Un's nuclear weapons program, according to a Pentagon official.
""It is the most bleak assessment,"" Sen. Dianne Feinstein, a member of the Senate Intelligence Committee, said Sunday.
Two House Democrats, in a letter to the Pentagon, had asked about casualty assessments in a possible conflict with North Korea, and Rear Adm. Michael J. Dumont of the Joint Staff responded on behalf of the Defense Department.
Dumont noted that the United States is evaluating North Korea's ability to target heavily populated areas of South Korea with long-range artillery, rockets and ballistic missiles.
Feinstein said she was pleased that Secretary of State Rex Tillerson was accompanying President Donald Trump during his Asia trip, when North Korea is a main issue.","A ground invasion of North Korea is the only way to locate and destroy, with complete certainty, all components of leader Kim Jong Un's nuclear weapons program, according to a Pentagon official.

""It is the most bleak assessment,"" Sen. Dianne Feinstein, a member of the Senate Intelligence Committee, said Sunday.

Two House Democrats, in a letter to the Pentagon, had asked about casualty assessments in a possible conflict with North Korea, and Rear Adm. Michael J. Dumont of the Joint Staff responded on behalf of the Defense Department.

Dumont noted that the United States is evaluating North Korea's ability to target heavily populated areas of South Korea with long-range artillery, rockets and ballistic missiles. He pointed out that Seoul, the South's capital with a population of 25 million, is just 35 miles from the demilitarized zone that separates the two Koreas.

The amount of casualties would differ depending on the advance warning and the ability of U.S. and South Korea forces to counter these attacks, he told Reps. Ted Lieu, D-Calif., and Ruben Gallego, D-Ariz.

""A classified briefing would be the best place to discuss in detail the capability of the U.S. and its allies to discuss capabilities to counter North Korea's ability to respond with a nuclear weapon and eliminate North Korea's nuclear weapons located in deeply buried, underground facilities,"" Dumont said. He also mentioned the possibility that chemical and biological weapons might be used by the North in case of a conflict.

Feinstein said she was pleased that Secretary of State Rex Tillerson was accompanying President Donald Trump during his Asia trip, when North Korea is a main issue.

""I think if he will stay the course and use diplomacy the way diplomacy can be used, then it might be possible to work something out. The worst alternative is a war which could become nuclear,"" Feinstein told CNN's ""State of the Union.""

In a joint statement Saturday, 15 Democratic lawmakers and one Republican— all military veterans — called the assessment that a ground invasion would be required to destroy the North's nuclear arsenal ""deeply disturbing"" and that such an action ""could result in hundreds of thousands, or even millions of deaths in just the first few days of fighting.""

""It is our intent to have a full public accounting of the potential cost of war, so the American people understand the commitment we would be making as a nation if we were to pursue military action,"" the lawmakers said.

They also said the Trump administration ""has failed to articulate any plans to prevent the military conflict from expanding beyond the Korean Peninsula and to manage what happens after the conflict is over.""

""With that in mind, the thought of sending troops into harm's way and expending resources on another potentially unwinnable war is chilling. The President needs to stop making provocative statements that hinder diplomatic options and put American troops further at risk,"" they said.",'Bleak' assessment of toll of destroying North Korea nukes,http://www.foxnews.com/us/2017/11/05/grim-cost-predicted-in-effort-to-destroy-north-koreas-nukes.html
148,"['freight', 'wsvn', 'think', 'work', 'car', 'wasnt', 'survivor', 'god', 'holocaust', 'stuck', 'pulled', 'tracks', 'hits', 'told', 'definitely', 'train', '93yearold']","The quick actions of a group of good Samaritans in South Florida Tuesday helped save a 93-year-old Holocaust survivor whose vehicle became stuck on a train track.
Henry Flescher told WSVN he made a wrong turn, taking the curve too fast “because it’s very dark there"" and his wheels became stuck on a track.
Video captured on her phone shows the train approaching Flescher’s car and then the deafening sound of crunching metal is heard.
“I definitely think God was looking out.
“I definitely think God was looking out,” she told WSVN.","The quick actions of a group of good Samaritans in South Florida Tuesday helped save a 93-year-old Holocaust survivor whose vehicle became stuck on a train track.

Henry Flescher told WSVN he made a wrong turn, taking the curve too fast “because it’s very dark there"" and his wheels became stuck on a track.

The 93-year-old soon realized a freight train was barreling toward him.

“And then the train is coming, and I couldn’t get out,” Flescher said.

Natalie Grant told WSVN she was sitting in her car nearby and took out her iPhone to start recording as a group of people went to help Flescher.

Video captured on her phone shows the train approaching Flescher’s car and then the deafening sound of crunching metal is heard.

“I definitely think God was looking out. I just think it wasn't his time yet. He still has more work to do on Earth.” - Natalie Grant

“It was literally about one or two minutes before he was pulled out of the car that the train came,” Grant said. “It was definitely a miracle that he was pulled out in time, and definitely a miracle for me as well that I didn’t get my car damaged.”

Miami-Dade Fire Rescue transported the 93-year-old to an area hospital, where he was evaluated and released, according to WSVN.

Flescher, who survived internment at multiple concentration camps during World War II and shared his experience in 2016 in a heartbreaking Reddit AMA, thanked those who came to his rescue.

“I’m a survivor so far. I’ve survived a lot of things,” he said. “I’m very active, thank God. I’m doing things, and it pays back.”

Grant said the outcome of the close call was a sign from a higher power.

“I definitely think God was looking out,” she told WSVN. “I just think it wasn't his time yet. He still has more work to do on Earth.”",Holocaust survivor pulled from car stuck on tracks before freight train hits,https://www.foxnews.com/us/2017/11/02/holocaust-survivor-pulled-from-car-stuck-on-tracks-before-freight-train-hits.html
149,"['ketchum', 'state', 'prizewinning', 'hopes', 'skies', 'night', 'dark', 'sky', 'city', 'idsa', 'idaho', 'international', 'press', 'tourism', 'boost']","One Idaho city is hoping that its stunning night skies will put it on the map as a tourist hotspot - if it can win the approval of an elite conservation organization, that is.
After years of efforts to reduce excess light pollution, on Oct. 31, the International Dark-Sky Association (IDSA) named Ketchum, Idaho an International Dark Sky Community, the Associated Press reports.
In a larger sense, Idaho is “becoming one of the centers of interest in dark skies in the country,” said John Barentine, IDSA program manager.
Earlier this year, Idaho’s Craters of the Moon National Monument and Preserve became an official International Dark Sky Park earlier this year, one of just 40 in the nation.
Nevertheless, the most selective award of all could come in mid-December if the IDSA decides to designate 1,400 square miles in the central park of the state as an International Dark Sky Reserve.","One Idaho city is hoping that its stunning night skies will put it on the map as a tourist hotspot - if it can win the approval of an elite conservation organization, that is.

After years of efforts to reduce excess light pollution, on Oct. 31, the International Dark-Sky Association (IDSA) named Ketchum, Idaho an International Dark Sky Community, the Associated Press reports. Ketchum is only the 16th city worldwide to be awarded the designation.

In a larger sense, Idaho is “becoming one of the centers of interest in dark skies in the country,” said John Barentine, IDSA program manager. With a population of roughly 2,700, Ketchum joins other, more populous Gem State cities that are currently seeking the rare dark-sky titles, hoping to both attract stargazing tourists and boost real estate values.

Earlier this year, Idaho’s Craters of the Moon National Monument and Preserve became an official International Dark Sky Park earlier this year, one of just 40 in the nation. Nevertheless, the most selective award of all could come in mid-December if the IDSA decides to designate 1,400 square miles in the central park of the state as an International Dark Sky Reserve. It would be the first in the U.S.

Mayor Nina Jones said in a statement that the credit for Ketchum’s prize is due to the “work of so many who have devoted time and energy to reducing light pollution across our city and neighborhoods so that we can enjoy the truly amazing views we have of the night sky.”

Looks like the stars are aligning for Idaho, after all.

The Associated Press contributed to this story.",Idaho hopes to boost tourism with prizewinning night skies,https://www.foxnews.com/travel/2017/11/04/idaho-hopes-to-boost-tourism-with-prizewinning-night-skies.html
