,KEYWORDS,SUMMARY,TEXT,TITLE,URL
98,"['ivanka', 'role', 'japan', 'fashion', 'women', 'tokyo', 'post', 'model', 'woman', 'trump', 'japanese', 'times', 'icon']","And it’s very surprising to Japanese women that she can also talk about things that are important to society.”The DailyMail added that Japan views Ivanka as ""a fashion icon"" who will attract onlookers during her stay.
Nevertheless, the women who heard Trump’s speech seemed to view her as a role model.
“Her fashion is great.”Another woman and former U.S. Senate staffer Mieko Nakabayashi, told the site that Ivanka’s “kind of celebrity” resonates with the Japanese people.
In a January article in the Independent, titled “Why Japan loves Ivanka Trump,” an Ivanka-admiring blogger — who reportedly writes about the first daughter’s fashion and lifestyle for the Japan Times — hinted that not everybody is as enamored of Donald.
“That is something that Japanese women want, but have a hard time doing in a still male-dominated society.”","If Japan’s media coverage of Ivanka Trump’s arrival in Tokyo is any indication, the country seems to be slightly obsessed with the first daughter’s high-ranking position and “great” sense of style.

Trump’s arrival at the Narita International Airport on Thursday evening was covered by four television stations and treated as “major news,” according to the New York Times. The same went for her subsequent dinner plans at a swanky Tokyo restaurant.

The city’s metropolitan police, too, have assigned Trump an all-female “riot squad” to protect her from overzealous admirers during the visit — and it’s the same security measure they plan to extend to first lady Melania Trump when she and President Donald Trump arrive in Japan on Nov. 5.

VICTORIA BECKHAM IS ONE DESIGNER NOT OPPOSED TO DRESSING MELANIA TRUMP

“Many people think she’s like a princess,” said Lully Miura, a political scientist at the University of Tokyo, in a statement to the Washington Post. “She’s well educated, beautiful, sophisticated and rich. And it’s very surprising to Japanese women that she can also talk about things that are important to society.”

The DailyMail added that Japan views Ivanka as ""a fashion icon"" who will attract onlookers during her stay.

トランプの娘〜 誕生日一緒やん🤗✨✨ #アメリカ大統領#トランプ#イヴァンカ #なんか嬉しい#向こうの誕生日パーティーは嘸かし盛大なんやろな… A post shared by Hirokazu Mizusawa (@hirokazumizusawa) on Feb 1, 2017 at 10:27pm PST

On Friday, Ivanka spoke at the World Assembly for Women Conference at Tokyo’s Prince Hotel, which reportedly held a lottery for attendees.

The event was not as well attended as one might expect considering her popularity — Trump delivered an 18-minute speech to a partially-empty auditorium — but White House spokesman Josh Raffel said the hotel’s strict security measures kept people from getting to their seats. (A Washington Post reporter in attendance denies this was the case.) Nevertheless, the women who heard Trump’s speech seemed to view her as a role model.

“She is a beautiful female leader,” Rena Hayakawa, a 21-year-old college student, told the Times. “Her fashion is great.”

Another woman and former U.S. Senate staffer Mieko Nakabayashi, told the site that Ivanka’s “kind of celebrity” resonates with the Japanese people.

However, it’s unclear if Ivanka’s father is looked at as favorably. In a January article in the Independent, titled “Why Japan loves Ivanka Trump,” an Ivanka-admiring blogger — who reportedly writes about the first daughter’s fashion and lifestyle for the Japan Times — hinted that not everybody is as enamored of Donald.

FOLLOW US ON FACEBOOK FOR MORE FOX LIFESTYLE NEWS

“She is a good example that a woman can do an outstanding job and handle a misogynist father like Trump, without pushing too much of a feminist agenda or confronting men too much,” said Yuriko Shinzato.

“That is something that Japanese women want, but have a hard time doing in a still male-dominated society.”",Why Ivanka Trump is a role model — and fashion icon — in Japan,https://www.foxnews.com/lifestyle/2017/11/03/why-ivanka-trump-is-role-model-and-fashion-icon-in-japan.html
99,"['russian', 'postrepublican', 'clinton', 'special', 'counsel', 'schultz', 'lindsey', 'justice', 'graham', 'marisa', 'york', 'ties', 'calls', 'sen', 'russia', 'probe']","By Marisa Schultz, New York PostRepublican Sen. Lindsey Graham said Sunday the Justice Department should appoint another special counsel to investigate Hillary Clinton for her Russian ties.","By Marisa Schultz, New York Post

Republican Sen. Lindsey Graham said Sunday the Justice Department should appoint another special counsel to investigate Hillary Clinton for her Russian ties.",Graham Calls For Special Counsel To Probe Clinton On Russia Ties,http://nation.foxnews.com/2017/11/06/graham-calls-special-counsel-probe-clinton-russia-ties
100,"['students', 'school', 'claims', 'dye', 'black', 'sues', 'japan', 'forced', 'student', 'color', 'hair', 'dyeing']","A Japanese teenager is suing her local government after her public high school forced her to dye her hair black, the student alleges.
According to local media, the school has a policy that all students must have black hair to attend.
Though she ensured her daughter’s hair color was natural – some schools in Japan force lighter-haired students to prove their hair color by carrying photos of them as children – the school still forced her to dye her hair black to conform to the rules.
Now the teen is saying that the hair dye, which they forced her to do as often as every four days, left burns and rashes to her scalp.
He also said the school has a ban on bleached or lightened hair, but would not confirm if dyeing the hair black is allowed.","A Japanese teenager is suing her local government after her public high school forced her to dye her hair black, the student alleges.

The teenager, whose name has not been released, was a student at the Kaifukan School in Habikino City, Japan. According to local media, the school has a policy that all students must have black hair to attend.

GRANDMA OUTRAGED AT SCHOOL CALLING 11-YEAR-OLD'S DRESS 'DISTRACTING'

Unfortunately, the 18-year-old had naturally brown hair. The suit says that the student’s mom reached out to the school before her enrollment, informing them of her daughter’s lighter hair color. Though she ensured her daughter’s hair color was natural – some schools in Japan force lighter-haired students to prove their hair color by carrying photos of them as children – the school still forced her to dye her hair black to conform to the rules.

Now the teen is saying that the hair dye, which they forced her to do as often as every four days, left burns and rashes to her scalp.

“The dyeing damaged the health of the scalp and hair,” the plaintiff claims. “[Natural] physical features were negated and mental anguish resulted.”

The family is suing the Osaka Prefectural Government for 2.2 million yen (about $19,300) in damages she incurred from the hair dyeing and abuse.

This comes after they tried to file a complaint with the school once the incidents occurred. The complaint was dismissed and the student did not return to school beginning September 2016.

FOLLOW US ON FACEBOOK FOR MORE FOX LIFESTYLE NEWS

Masahiko Takahashi, the head of the school, declined to comment on the open case, but he did confirm that the school has strict rules about hair and dress code. He also said the school has a ban on bleached or lightened hair, but would not confirm if dyeing the hair black is allowed.

The Asahi Shimbun newspaper writes that the schools force the students to have dark hair to “protect” them from being berated by school officials, since light hair is seen as abnormal in Japan.","Student sues government after school forced her to dye her hair black, she claims",https://www.foxnews.com/lifestyle/2017/11/01/student-sues-government-after-school-forced-her-to-dye-her-hair-black-claims.html
101,"['politics', 'brazile', 'struggle', 'clintons', 'going', 'varney', 'fallout', 'democrats']",,,Varney on Brazile Fallout: 'The Clintons Are Done in Politics & the Democrats Are Going to Struggle',http://insider.foxnews.com/2017/11/06/stuart-varney-donna-brazile-dnc-hillary-clinton-campaign-claims-state-democrat-party
102,"['wasnt', 'flake', 'weekjared', 'look', 'flags', 'radios', 'feuds', 'capitol', 'week', 'audio', 'border', 'washington', 'producer', 'jared']","Audio clip: Listen to audio clip.
FOX News Radio's National Correspondent Jared Halpern along with a team of FOX News reporters & contributors look at the week that was inside the beltway.
THIS WEEK:Jared explains how a GOP unity lunch backfired when a Republican Senator announced he wasn't run for re-election.
FOX News Radio's Senior Capitol Hill producer, Chad Pergram, is knee deep in tax reform on Capitol Hill.
FOX News Radio's Jessica Rosenthal traveled to the U.S. - Mexico border this week to get a look at the prototypes for President Trump's border wall.","Audio clip: Listen to audio clip.

FOX News Radio's National Correspondent Jared Halpern along with a team of FOX News reporters & contributors look at the week that was inside the beltway.

THIS WEEK:

Jared explains how a GOP unity lunch backfired when a Republican Senator announced he wasn't run for re-election.

FOX News Radio's Senior Capitol Hill producer, Chad Pergram, is knee deep in tax reform on Capitol Hill.

With more questions than answers after the Niger attack, FOX's Pentagon and State Dept. Producer Lucas Tomlinson lays out what we know so far about the deaths of four Green Berets.

FOX News Radio's Jessica Rosenthal traveled to the U.S. - Mexico border this week to get a look at the prototypes for President Trump's border wall.

Listen to the latest ""From Washington"":

Follow Jared on Twitter: @JaredHalpern","From Washington: Feuds, Flags and Flake",https://radio.foxnews.com/2017/10/27/from-washington-feuds-flags-and-flake/
103,"['good', 'shooting', 'texas', 'overcome', 'witness', 'evil']",,,Texas Shooting Witness: We Have to Overcome Evil With Good,http://insider.foxnews.com/2017/11/05/texas-church-shooting-sutherland-springs-witness-we-have-overcome-evil-good
104,"['finds', 'service', 'mission', 'electric', 'bikes', 'veteran', 'life']",,,Life After Service: Veteran finds new mission in electric bikes,https://video.foxnews.com/v/5633606639001/
105,"['gunman', 'sheriff', 'texas', 'gunfire', 'escape', 'told', 'shooting', 'kelley', 'killed', 'saidthe', 'church', 'man', 'tackitt', 'helpless', 'congregants']","When a gunman opened fire in a small Texas church, congregants were helpless to get away from the attacker, who killed 26 people in a massacre that claimed multiple members of some families and tore apart a close-knit town of 400 people.
Once the shooting started Sunday at the First Baptist Church in Sutherland Springs, there was probably ""no way"" for congregants to escape, Wilson County Sheriff Joe D. Tackitt Jr. said.
The gunman's former in-laws attended services at the church ""from time to time"" but were not there Sunday, Tackitt told CNN on Monday.
Authorities said he lived in New Braunfels, about 35 miles north of the Sutherland Springs church.
Ryan Albers, 16, who lives across the road, said he heard intensifying gunfire coming from that direction in recent days.","When a gunman opened fire in a small Texas church, congregants were helpless to get away from the attacker, who killed 26 people in a massacre that claimed multiple members of some families and tore apart a close-knit town of 400 people.

Once the shooting started Sunday at the First Baptist Church in Sutherland Springs, there was probably ""no way"" for congregants to escape, Wilson County Sheriff Joe D. Tackitt Jr. said.

The gunman, dressed in black tactical gear, fired an assault rifle as he walked down the center aisle during worship services. He turned around and continued shooting on his way out of the building, Tackitt said.

The gunman also carried a handgun, but authorities he did not know if it was fired. Tackitt described the scene as ""terrible.""

""It's unbelievable to see children, men and women, laying there. Defenseless people,"" he said.

The dead ranged in age from 5 to 72 years old. About 20 other people were wounded.

The gunman's former in-laws attended services at the church ""from time to time"" but were not there Sunday, Tackitt told CNN on Monday.

The suspect was identified as Devin Patrick Kelley, 26. Authorities said he lived in New Braunfels, about 35 miles north of the Sutherland Springs church.

A U.S. official told The Associated Press that Kelley did not appear to be linked to organized terrorist groups. The official spoke on the condition of anonymity because the person wasn't authorized to discuss the investigation.

Investigators were looking at social media posts Kelley made in the days before the attack, including one that appeared to show an AR-15 semi-automatic weapon.

Kelley received a bad conduct discharge from the Air Force for assaulting his spouse and child and was sentenced to 12 months of confinement after a 2012 court-martial. Kelley served in Logistics Readiness at Holloman Air Force Base in New Mexico from 2010 until his 2014 discharge, Air Force spokeswoman Ann Stefanek said.

The attacker pulled into a gas station across from the church, about 30 miles (48.28 kilometers) southeast of San Antonio, around 11:20 a.m. Sunday. He crossed the street and started firing the rifle at the church, then continued firing after entering the white wood-frame building, said Freeman Martin, a regional director of the Texas Department of Safety.

As he left, the shooter was confronted by an armed resident who ""grabbed his rifle and engaged that suspect,"" Martin said. A short time later, the suspect was found dead in his vehicle at the county line. Authorities believe he shot himself following a car wreck.

Twenty-three of the dead were found in the church, two were found outside and one died after being taken to a hospital, Martin said.

The man who confronted Kelley had help from another local resident, Johnnie Langendorff, who told KSAT-TV that he was driving past the church as the shooting happened. He didn't identify the armed resident but said the man exchanged gunfire with the gunman, then asked to get in Langendorff's truck and the pair followed as the gunman drove away.

Langendorff said the gunman eventually lost control of his vehicle and crashed. He said the other man walked up to the vehicle with his gun drawn and the suspect did not move. He stayed there for at least five minutes, until police arrived.

""I was strictly just acting on what's the right thing to do,"" Langendorff said.

Among those killed was the church pastor's 14-year-old daughter, Annabelle Pomeroy. Pastor Frank Pomeroy and his wife, Sherri, were both out of town when the attack occurred, Sherri Pomeroy wrote in a text message.

""We lost our 14-year-old daughter today and many friends,"" she wrote. ""Neither of us has made it back into town yet to personally see the devastation.""

Church member Nick Uhlig, 34, who was not at Sunday's service, told the AP that his cousin, who was eight months' pregnant, and her in-laws were among those killed. He later told the Houston Chronicle that three of his cousin's children also were slain.

President Donald Trump, who was in Japan, called the shooting an ""act of evil,"" later calling the gunman ""a very deranged individual.""

On Sunday evening, two sheriff's vans were parked outside the gate of a cattle fence surrounding the address listed for Kelley on the rural outskirts of New Braunfels, north of San Antonio.

Ryan Albers, 16, who lives across the road, said he heard intensifying gunfire coming from that direction in recent days.

""It was definitely not just a shotgun or someone hunting,"" Albers said.

The church has posted videos of its Sunday services on a YouTube channel, raising the possibility that the shooting was captured on video.

In a video of its Oct. 8 service, a congregant who spoke and read Scripture pointed to the Oct. 1 Las Vegas shooting a week earlier as evidence of the ""wicked nature"" of man. That shooting left 58 dead and more than 500 injured.

Gov. Greg Abbott called Sunday's attack the worst mass shooting in Texas history. It came on the eighth anniversary of a shooting at Fort Hood, where 13 people were killed and 31 others wounded by a former Army major.

The previous deadliest mass shooting in Texas had been a 1991 attack in Killeen, when a mentally disturbed man crashed his pickup truck through a restaurant window at lunchtime and started shooting people, killing 23 and injuring more than 20 others.

The University of Texas was the site of one of the most infamous mass shootings in American history, when Marine sniper Charles Whitman climbed the Austin campus' clock tower in 1966 and began firing on stunned people below, killing 13 and wounding nearly three dozen others. He had killed his wife and mother before heading to the tower. One victim died a week later, and medical examiners eventually attributed a 17th death to Whitman in 2001.

___

Associated Press writers Sadie Gurman and Eric Tucker in Washington, Nomaan Merchant in Houston, Will Weissert in Austin, Diana Heidgerd in Dallas, Michael Balsamo in Los Angeles and Paul J. Weber in New Braunfels, Texas, contributed to this report.",Sheriff: Congregants were helpless to escape church gunfire,https://www.foxnews.com/us/2017/11/06/texas-church-attack-leaves-26-dead-small-community-reeling.html
106,"['gop', 'dem', 'react', 'texas', 'shooting', 'politicians', 'church']",,,Dem and GOP Politicians React to Texas Church Shooting,http://insider.foxnews.com/2017/11/05/dems-and-gop-react-texas-church-shooting
107,"['unit', 'anthony', 'week', 'heads', 'wheres', 'weiner', 'union', 'undergo', 'prison', 'umar', 'weiners', 'spent', 'york']","By R. Umar Abbasi and Bruce Golding, The New York PostPerverted ex-pol Anthony Weiner is headed to prison Monday for sexting with a 15-year-old girl — a crime he called his “rock bottom” after years of career-killing online antics.
The disgraced Democrat spent his Sunday holed up in his Union Square apartment, where a source in the building spotted Weiner’s dad, Morton, getting Starbucks at around 11 a.m.Father and son then spent about five hours together ahead of Weiner’s trip to the Federal Medical Center in Devens, Mass., where’s he’s under orders to arrive for his 21-month sentence no later than 2 p.m.
The lockup — on a former Army base about 40 miles northwest of Boston — is just one of two sites that offer residential treatment for sex offenders, who share a common housing unit and undergo therapy five days a week.","By R. Umar Abbasi and Bruce Golding, The New York Post

Perverted ex-pol Anthony Weiner is headed to prison Monday for sexting with a 15-year-old girl — a crime he called his “rock bottom” after years of career-killing online antics.

The disgraced Democrat spent his Sunday holed up in his Union Square apartment, where a source in the building spotted Weiner’s dad, Morton, getting Starbucks at around 11 a.m.

Father and son then spent about five hours together ahead of Weiner’s trip to the Federal Medical Center in Devens, Mass., where’s he’s under orders to arrive for his 21-month sentence no later than 2 p.m.

The lockup — on a former Army base about 40 miles northwest of Boston — is just one of two sites that offer residential treatment for sex offenders, who share a common housing unit and undergo therapy five days a week.",Anthony Weiner Heads to Prison,http://nation.foxnews.com/2017/11/06/anthony-weiner-heads-prison
108,"['recovering', 'ribs', 'pain', 'kentucky', 'warrant', 'severe', 'stafford', 'neighbor', 'paul', 'attack', 'tackled', 'senator', 'rand', 'broken', 'sen', 'type', 'injury']","FOX NEWS - Rand Paul was recovering Sunday from five broken ribs, including three displaced fractures, after he was assaulted by a neighbor who tackled him from behind at the senator’s Kentucky home, officials said.
Stafford said this type of injury is marked by severe pain that can last for weeks to months.
“This type of injury is caused by high velocity severe force,” Stafford said a statement to Fox News.
He had trouble breathing because of the rib injury, the warrant said.
A Warren County official did not immediately respond to a request from The Associated Press for a copy of the arrest warrant.","

FOX NEWS - Rand Paul was recovering Sunday from five broken ribs, including three displaced fractures, after he was assaulted by a neighbor who tackled him from behind at the senator’s Kentucky home, officials said.

Senior Adviser Doug Stafford said it is unclear when the Republican senator will return to work since he is in “considerable pain” and has difficulty getting around, including flying. Stafford said this type of injury is marked by severe pain that can last for weeks to months.

“This type of injury is caused by high velocity severe force,” Stafford said a statement to Fox News.

The Bowling Green Daily News reported that an arrest warrant said Paul told police his neighbor came on his property and tackled him from behind Friday, forcing him to the ground, all while the senator had been mowing his lawn. He had trouble breathing because of the rib injury, the warrant said.

A Warren County official did not immediately respond to a request from The Associated Press for a copy of the arrest warrant.",Sen. Rand Paul Recovering from Five Broken Ribs After Attack at Kentucky Home,http://nation.foxnews.com/2017/11/06/sen-rand-paul-recovering-five-broken-ribs-after-attack-kentucky-home#commenting
109,"['hope', 'gene', 'run', 'joseph', 'cant', 'batten', 'fatal', 'sees', 'neurodegenerative', 'matt', 'family', 'fast', 'diagnosed', 'disease', 'hann', 'son', 'therapy', 'josephs', 'fox']","An Arizona family has relocated to Texas in hopes of saving their 5-year-old son Joseph, who was diagnosed with a rare and fatal neurodegenerative disorder called Batten disease.
“2018 is our goal, and we are moving very quickly because of course, Joseph is deteriorating every day,” Gina Hann, Joseph’s mother, told Fox 4 News.
“He takes everything from one moment to the next, if he can’t see here, then he puts the book here,” Matt Hann said.
“If he can’t run fast, then he’ll run slow.
So far, they’ve surpassed $800,000 of their goal, and are keeping supporters updated through the Joseph Hann's Foundation for Batten Hope blog.","An Arizona family has relocated to Texas in hopes of saving their 5-year-old son Joseph, who was diagnosed with a rare and fatal neurodegenerative disorder called Batten disease. Matt and Gina Hann, who have three other children, are frantically raising money for a critical gene therapy trial at UT Southwestern, which may help transport a missing gene back to Joseph’s brain, Fox 4 News reported.

“2018 is our goal, and we are moving very quickly because of course, Joseph is deteriorating every day,” Gina Hann, Joseph’s mother, told Fox 4 News. “But if we move fast enough, then Joseph actually has a chance to be one of the first people to survive this disease.”

There are 14 different forms of Batten disease that resemble other progressive neurodegenerative diseases, such as Parkinson’s, Alzheimer’s and Huntington’s. In March 2017, Joseph was diagnosed with CLN7.

PARENTS SHARE HEARTBREAKING PHOTOS OF BABY SET TO LOSE LIMBS TO MENINGITIS

Onset of symptoms for CLN7 typically begin between ages 2 and 7, with patients experiencing seizures, developmental regression, muscle twitches, difficulty coordinating movements, speech impairment and loss of mental functioning and motor skills. Patients typically do not survive pass their teen years.

“Without a doubt, whenever we realized what we were up against the decision was instantaneous and getting here, and getting here quickly was first and foremost,” Matt Hann, Joseph’s dad, told Fox 4 News.

Joseph has already suffered severe vision loss, and can only see about six inches in front of him. Despite the setbacks, his dad said rather than ask questions, Joseph adapts to his new way of doing things.

“He takes everything from one moment to the next, if he can’t see here, then he puts the book here,” Matt Hann said. “If he can’t run fast, then he’ll run slow. He doesn’t ask why he can’t run fast, he just does what he can and he’s happy doing it.”

The Hanns are working to raise $1.2 million for the manufacturing of the doses needed to begin the gene therapy. So far, they’ve surpassed $800,000 of their goal, and are keeping supporters updated through the Joseph Hann's Foundation for Batten Hope blog.",Family sees hope in gene therapy for son diagnosed with fatal neurodegenerative disease,https://www.foxnews.com/health/2017/11/06/family-sees-hope-in-gene-therapy-for-son-diagnosed-with-fatal-neurodegenerative-disease.html
110,"['control', 'texas', 'renew', 'dems', 'massacre', 'calls', 'gun']",,,Dems renew calls for gun control after Texas massacre,http://video.foxnews.com/v/5636647508001/
