,KEYWORDS,SUMMARY,TEXT,TITLE,URL
251,"['act', 'world', 'senseless', 'good', 'shooting', 'texas', 'shocking', 'understand', 'better', 'god', 'church', 'using', 'evil', 'judas', 'acts']","It is the question that challenges all of us during times of unexplained evil acts.
Which brings me to the next question, ""Why didn't God make better creatures?”No one seems to want to recognize the existence of an evil being, only evil acts.
No one seems to want to recognize the existence of an evil being, only evil acts.
Does God permit evil in this world as a way to produce the best in us?
Had it been denied me, I would have invented it for myself.”As a pastor, I struggle to explain the ""why"" behind the senseless evil acts that we witness as human beings.","What are we to think when the sacred things of society are disregarded and become the site of evil? Evil seems unavoidable -- even in church.

On Sunday, November 5, 2017, America witnessed the deadliest church shooting in her history. The gunman walked into a house of worship outside San Antonio, Texas and opened fire on members of the congregation.

Is God the author of evil? It is the question that challenges all of us during times of unexplained evil acts. If not God, how then do we explain evil?

Without debate, it was a gunman who perpetrated the evil in San Antonio. So it's man and not God? Which brings me to the next question, ""Why didn't God make better creatures?”

No one seems to want to recognize the existence of an evil being, only evil acts.

The act didn't just happen; the law of causality teaches us that every event has a cause.

Investigators will spend countless hours trying to understand the motive behind the murder. In the end, the conclusion will be similar to other investigations. The shooter will be found to be unstable, using anti-depressants or inconclusive.

No one seems to want to recognize the existence of an evil being, only evil acts.

The reason that immoral acts bother us and get our attention is that we are moral creatures who know the difference between good and evil.

Jesus made a shocking statement about Judas, the one who betrayed him, ""it would be better for him if he had not been born.""

It's shocking on to think Jesus would make such a statement and equally shocking that Jesus, knowing the world would be better without Judas, allowed Judas to remain.

What is there about good and evil that we don't understand? Is it necessary for both to co-exist, at least for a season? Does evil cause us to strive for good and in our striving permit us to find good? Does God permit evil in this world as a way to produce the best in us? That seems like God is using an illegitimate ""end justifies the means"" ethic.

There is something about evil that drives us to God. Atheist Jean-Paul Sartre said, ""I needed God...I reached out for religion; I longed for it, it was the remedy. Had it been denied me, I would have invented it for myself.”

As a pastor, I struggle to explain the ""why"" behind the senseless evil acts that we witness as human beings. Simple answers to complex questions are bound to be wrong.

So what am I to do? I can give the pat answers that weary all of us, or I can admit my struggle, confront evil and seek to extend the love of God in both good and bad times.","Texas church shooting: God, evil and a senseless act",https://www.foxnews.com/opinion/2017/11/05/texas-church-shooting-god-evil-and-senseless-act.html
252,"['wall', 'state', 'street', 'jihad', 'opinion', 'raqqa', '30', 'reminder', 'wont', 'prepare', 'york', 'recent', 'terrorist', 'uzbekistan']","By Husain Haqqani, The Wall Street JournalTuesday’s terrorist attack in New York City, committed by an immigrant from Uzbekistan, is a reminder that radical political Islam won’t end with the recent defeat of Islamic State in Raqqa.","By Husain Haqqani, The Wall Street Journal

Tuesday’s terrorist attack in New York City, committed by an immigrant from Uzbekistan, is a reminder that radical political Islam won’t end with the recent defeat of Islamic State in Raqqa.",OPINION: Prepare Yourself for Jihad 3.0,http://nation.foxnews.com/2017/11/03/opinion-prepare-yourself-jihad-30#commenting
253,"['united', 'morning', 'member', 'initiates', 'turns', 'confirmed', 'passenger', 'post', 'crew', 'fox', 'beijing', 'airline', 'altercation', 'flight']","A United Airlines flight was forced to turn back after an unruly passenger “initiated an altercation” with the flight’s crew, an airline representative confirmed to Fox News.
POPULAR AIRLINE REMOVING FIRST-CLASS SEATING“Flight 808 from Beijing to Washington Dulles returned to Beijing after a customer initiated an altercation with a member of the flight crew, causing a safety concern,” a spokesman for United confirmed to Fox News.
United could not confirm the cause of the altercation, but The Beijing News wrote (via the Morning Post) that the passenger had initially gotten into an argument with another flyer before turning his anger on a flight attendant who tried to intervene.
They further reported that the unruly passenger appeared to be under the influence of alcohol.
The Morning Post stated that the flight crew sent out an emergency call about two hours into the flight before turning around near the border of China and Russia, over the Heilongjiang province.","A United Airlines flight was forced to turn back after an unruly passenger “initiated an altercation” with the flight’s crew, an airline representative confirmed to Fox News.

The South China Morning Post originally reported that the aircraft — which was heading from Beijing to Washington, D.C., on Friday evening — had landed back at the Beijing airport at 10:30 p.m., or only 3½ hours after takeoff.

POPULAR AIRLINE REMOVING FIRST-CLASS SEATING

“Flight 808 from Beijing to Washington Dulles returned to Beijing after a customer initiated an altercation with a member of the flight crew, causing a safety concern,” a spokesman for United confirmed to Fox News.

United could not confirm the cause of the altercation, but The Beijing News wrote (via the Morning Post) that the passenger had initially gotten into an argument with another flyer before turning his anger on a flight attendant who tried to intervene. They further reported that the unruly passenger appeared to be under the influence of alcohol.

The Morning Post stated that the flight crew sent out an emergency call about two hours into the flight before turning around near the border of China and Russia, over the Heilongjiang province.

WATCH: MAN RIDES BAGGAGE CAROUSEL AT AIRPORT, ESCAPES ONTO TARMAC

United also confirmed that law enforcement officials met the aircraft at the gate, where the offending passenger “deplaned without incident.”

“Our remaining customers were provided with hotel accommodations, meal vouchers, and were rebooked on a flight departing the following day,” the airline added.

FOLLOW US ON FACEBOOK FOR MORE FOX LIFESTYLE NEWS

The Associated Press contributed to this report.",United flight turns around after passenger initiates 'altercation' with crew member,https://www.foxnews.com/travel/2017/11/06/united-flight-turns-around-after-passenger-initiates-altercation-with-crew-member.html
254,"['gunman', 'chasing', 'track', 'hero', 'antonio', 'texas', 'kelley', 'massacre', 'told', 'man', 'church', 'san', 'unfolded', 'wounded', 'hailed', 'fox']","FOX NEWSOne of the men who said he helped run the Texas church gunman off the road Sunday is being hailed as a hero for potentially preventing more bloodshed after the deadly shooting.
Johnnie Langendorff told Fox San Antonio he decided to track down the killer after seeing the gunman, Devin Kelley, exchanging fire with another member of the community.
That person, who hasn't been identified, reportedly shot Kelley during the encounter.
The mass shooting unfolded around 11:30 a.m. at First Baptist Church of Sutherland Springs, which is about 30 miles southeast of San Antonio.
At least 26 people were killed and 20 wounded.","FOX NEWS

One of the men who said he helped run the Texas church gunman off the road Sunday is being hailed as a hero for potentially preventing more bloodshed after the deadly shooting.

Johnnie Langendorff told Fox San Antonio he decided to track down the killer after seeing the gunman, Devin Kelley, exchanging fire with another member of the community. That person, who hasn't been identified, reportedly shot Kelley during the encounter.

The mass shooting unfolded around 11:30 a.m. at First Baptist Church of Sutherland Springs, which is about 30 miles southeast of San Antonio. At least 26 people were killed and 20 wounded.",Man Hailed A Hero For Chasing Gunman After Texas Church Massacre,http://nation.foxnews.com/2017/11/06/man-hailed-hero-chasing-gunman-after-texas-church-massacre#commenting
255,"['trip', 'meeting', 'likely', 'asia', 'trump', 'putin']",,,Trump says Putin meeting is likely during Asia trip,http://video.foxnews.com/v/5636837041001/
256,"['dogs', 'ship', 'okinawa', 'uss', 'rescued', 'sea', 'appel', 'women', 'sailors', 'vessel', 'reaches', 'taiwanese', 'food', 'base', 'fuiava']","A U.S. Navy ship carrying two sailors it rescued from their storm-battered sailboat in the Pacific docked Monday at an American naval base in Japan.
Appel and Fuiava had left Honolulu on May 3 aboard Appel's 50-foot vessel the Sea Nymph for what was supposed to be an 18-day trip to Tahiti.
They were thousands of miles in the wrong direction when a Taiwanese fishing vessel found them.
Towing the sailboat damaged it further, but Appel swam to the Taiwanese vessel to make a mayday call.
Appel credited their survival in part to the veteran sailors in Hawaii who had warned them to prepare well for their journey.","A U.S. Navy ship carrying two sailors it rescued from their storm-battered sailboat in the Pacific docked Monday at an American naval base in Japan.

Jennifer Appel and Tasha Fuiava were standing with the USS Ashland's commanding officer and others high on the bridgeway when the ship arrived at White Beach Naval Facility in Okinawa, five days after it picked up the women and their two dogs from their boat, 900 miles southeast of Japan.

Appel and Fuiava had left Honolulu on May 3 aboard Appel's 50-foot vessel the Sea Nymph for what was supposed to be an 18-day trip to Tahiti.

Storms flooded the engine and damaged the mast and sails so badly, they couldn't generate enough wind power to stay on course. They drifted aimlessly and sent unanswered distress calls for 98 consecutive days.

They were thousands of miles in the wrong direction when a Taiwanese fishing vessel found them. Towing the sailboat damaged it further, but Appel swam to the Taiwanese vessel to make a mayday call.

They'd run out of food for the dogs, and the woman began sharing their own, leaving their food supply 90 percent depleted by the time they were rescued.

The USS Ashland on Wednesday picked up the women, plus the dogs Zeus and Valentine, all four looking remarkably fit for having been lost at sea for nearly six months.

Appel told reporters on Friday that they were beginning to believe they were completely out of luck when they saw the U.S. Navy ship chugging toward them.

""When I saw the gray ship on the horizon, I was just shaking,"" she said then. ""I was ready to cry, I was so happy. I knew we were going to live.""

Although Appel has been sailing the Hawaiian islands for 10 years and spent two years preparing for this voyage, she acknowledged she and Fuiava, a novice sailor, may not have prepared as well as they could have.

Appel credited their survival in part to the veteran sailors in Hawaii who had warned them to prepare well for their journey.

""They said pack every square inch of your boat with food, and if you think you need a month, pack six months, because you have no idea what could possibly happen out there,"" Appel said. ""And the sailors in Honolulu really gave us good advice. We're here.""",Ship with sailors rescued at sea reaches US base in Okinawa,https://www.foxnews.com/world/2017/10/29/ship-with-sailors-rescued-at-sea-reaches-us-base-in-okinawa.html
257,"['bible', 'book', 'explores', 'impact', 'dangerous']",,,'This Dangerous Book' explores the impact of the Bible,http://video.foxnews.com/v/5636754159001/
258,"['kellyanne', 'shooting', 'texas', 'lefts', 'conway', 'politicization']",,,Kellyanne Conway on left's politicization of Texas shooting,https://video.foxnews.com/v/5636770458001/?playlist_id=2114913880001
259,"['choosing', 'kitchen', 'light', 'pro', 'important', 'best', 'illumination', 'prep', 'features', 'lights', 'tips', 'lighting', 'styles']","Why is kitchen lighting so important?
For that reason, it’s best to plan kitchen lighting during the design stage.
Light layering involves creating different shades of light, playing with shadows and using colors to highlight a room’s best features.
The first priority of kitchen lighting is to provide sufficient illumination for safe and efficient meal prep, cooking and cleaning.
When it comes to choosing kitchen lights, take your cues from your home’s architecture and the lighting styles in the rest of the home.","next

prev next

prev

Pendants, uplights, downlights, LEDs — are you confused by all the options out there in kitchen lighting when it comes to creating the illumination you need to prep, cook and dine? We’ve asked expert Ben Mills to explain the different lighting types and the main things to consider in planning an effective design.

Why is kitchen lighting so important? For most of us, the kitchen is the workhorse of the home and a busy spot from morning till night. Good lighting is essential, as it allows you to perform tasks such as prepping food and cleaning up safely, says Mills, executive general manager at Australia’s Crompton Lighting. Plus, it adds character to a space and can quickly take the mood from functional to cozy, perfect for an eat-in kitchen.

Plan lighting as early as possible. Moving light fixtures after a kitchen has been installed can be expensive: Rewiring and repainting mean costs can add up quickly. For that reason, it’s best to plan kitchen lighting during the design stage.

What is a layered lighting design? Light layering involves creating different shades of light, playing with shadows and using colors to highlight a room’s best features. In the kitchen, it generally incorporates task lighting for food prep and cooking, ambient lighting for general illumination and character, and accent lighting to highlight specific features such as a gorgeous backsplash or a piece of art.

Consider safety first. The first priority of kitchen lighting is to provide sufficient illumination for safe and efficient meal prep, cooking and cleaning. This is achieved with task lighting — think LED strip lights under an upper cabinet (these create a lovely, even light with no shadows or heat) or a track system over the island.

Make sure there are no shadows in your prep zones. The best way to do is this is to install task lighting in front of or above you, rather than behind you.

Add ambient lighting for character. Soft, ambient lighting will wash your kitchen with light and create a warm, welcoming glow. It could be in the form of a pendant above a counter or dining table, downlights around the perimeter of the room or a central ceiling light.

Highlight your best features with accent light. Use accent lighting to draw attention to special features such as a backsplash or a dramatic island facade. Installing strip lighting under cabinets or counters is a great way to achieve this. You could also add accent lighting to glass cabinets or open shelving to highlight your displays.

Choose the right style. When it comes to choosing kitchen lights, take your cues from your home’s architecture and the lighting styles in the rest of the home. Choosing similar styles (or at least having a unifying theme such as shape or finish) will create a sense of flow among the spaces. This is particularly important in an open-plan kitchen that flows directly into a living or dining area.

When it comes to decorative lighting trends, the Scandi look is still popular, as well as simple styles in natural wood and black, white and industrial metallics.

Get the proportions right. With pendant lights and other decorative styles, size is also important: too large and the fixture will overwhelm a small kitchen; too small and it may get lost in a large space.

It’s also important to hang the pendant at an appropriate height to reduce the risk of people bumping their heads. Generally speaking, it should be about 32 inches above a table or counter.

Take control. Lighting control systems allow you to alter the illumination as needed and change the mood of the space. With dimmers, for example, you can go from bright lighting for precision cooking to a warm glow for dining. Having controls on separate switch plates lets you control lights in different areas separately.

Don’t be tempted to do the job yourself — unless you’re a trained electrician, always hire a professional to do electrical work in your home.",9 pro tips for choosing kitchen lighting,https://www.foxnews.com/real-estate/2017/11/03/9-pro-tips-for-choosing-kitchen-lighting.html
260,"['updated', 'misconduct', 'stirewaltdana', 'box', 'start', 'stranger', 'greg', 'w', 'perino', 'whip', 'week', 'continue', 'sexual', 'shannon', 'office', 'stirewalt', 'things', 'allegations', 'numbers']","Start the day with this quick news podcast!
· Perino & StirewaltDana Perino & Chris Stirewalt dishing on politics news every week.
· The One w/ Greg GutfeldYou know him.
Greg Gutfeld.
· Livin’ the BreamInspirational stories, personal anecdotes and an insider’s perspective from Shannon Bream.","More Podcasts

· The Whip Around

In hurry? Start the day with this quick news podcast!

· Hourly Newscast

The news updated every hour!

· The Five

It’s the full primetime show. FREE!

· Perino & Stirewalt

Dana Perino & Chris Stirewalt dishing on politics news every week.

· The One w/ Greg Gutfeld

You know him. You love him. Greg Gutfeld.

· Livin’ the Bream

Inspirational stories, personal anecdotes and an insider’s perspective from Shannon Bream.

· HemmerTime

One on one with engaging personalities hosted by Bill Hemmer.",Sexual Misconduct Allegations Continue; Stranger Things 2; and Box Office Numbers,https://radio.foxnews.com/2017/11/02/sexual-misconduct-allegations-continue-stranger-things-2-and-box-office-numbers/
261,"['kellyanne', 'shooting', 'texas', 'lefts', 'conway', 'politicization']",,,Kellyanne Conway on left's politicization of Texas shooting,http://video.foxnews.com/v/5636770458001/
262,"['drones', 'force', 'worldherald', 'number', 'expands', 'million', 'protection', 'nebraska', 'air', 'venture', 'violates', 'base', 'omaha']","Officials say an Air Force base south of Omaha has expanded its defenses against drones and can stop any that venture within its boundaries of airspace.
The Omaha World-Herald reports that a news release from the Offutt Air Force Base says it now has ""a number of unique defense systems"" to protect against drones while not going into specifics.
Drones are entirely off-limits within 3 miles of the base's airfield.
The Federal Aviation Administration estimated last year that there are about 1.1 million drones in use.
___Information from: Omaha World-Herald, http://www.omaha.com","Officials say an Air Force base south of Omaha has expanded its defenses against drones and can stop any that venture within its boundaries of airspace.

The Omaha World-Herald reports that a news release from the Offutt Air Force Base says it now has ""a number of unique defense systems"" to protect against drones while not going into specifics.

Drones are entirely off-limits within 3 miles of the base's airfield.

The message follows recent guidance from the Pentagon that lays out the military's authority to disable or shoot down any drone that violates airspace restrictions over a U.S. base.

The Federal Aviation Administration estimated last year that there are about 1.1 million drones in use. The agency predicted the number could grow to 4.5 million in 2021.

___

Information from: Omaha World-Herald, http://www.omaha.com",Nebraska Air Force base expands protection against drones,http://www.foxnews.com/us/2017/11/06/nebraska-air-force-base-expands-protection-against-drones.html
263,"['letting', 'stole', 'ex', 'sorry', 'steps', 'step', 'ashley', 'im', 'essel', 'write', 'going', 'youre', 'twitter']","Four steps to take when deciding if you should let someone who betrayed you back into your life.
FOX's Ashley Papa has more:Betrayal by a loved one is one of the most painful experiences.
I went them to write down the specific things they did who they did them with and why.
With FOX on Love, I'm Ashley Papa.
Follow Ashley Papa on Twitter: @AshleyMPapaFollow David Essel on Twitter: @DavidEssel","Audio clip: Listen to audio clip.

Four steps to take when deciding if you should let someone who betrayed you back into your life.

FOX's Ashley Papa has more:

Betrayal by a loved one is one of the most painful experiences. If you're thinking of letting someone who betrayed you back into your life, counselor, David Essel says first you must forgive:

""If you don't do this you're going to mistrust them, you're going to look for problems when maybe there aren't any, the other big problem you run into is that if this relationship doesn't work out and you want to move on and you haven't forgiven them you're going to put the next person you date on the cross.""

Step two is to own your role in the dysfunction of the relationship. The third step is to have the betrayer write you an apology letter:

""So in other words if someone says i'm so sorry for cheating on you, i'm so sorry i stole money from you that's not enough. I went them to write down the specific things they did who they did them with and why. See, that means they're sincere about coming back in and earning back your trust.""

Fourth, Essel says if they stole something they must pay you back. If they don't do step three or four- let them go.

With FOX on Love, I'm Ashley Papa.

Follow Ashley Papa on Twitter: @AshleyMPapa

Follow David Essel on Twitter: @DavidEssel",Steps You Should Take When Letting Your Ex Back In,https://radio.foxnews.com/2017/11/05/steps-you-should-take-when-letting-your-ex-back-in/
264,"['26', 'greg', 'shooting', 'lives', 'gov', 'lost', 'church', 'abbott']",,,Gov. Greg Abbott: 26 lives lost in church shooting,http://video.foxnews.com/v/5636283715001/
265,"['investigation', 'fbi', 'isnt', 'clinton', 'tarnishes', 'used', 'shillue', 'audio', 'campaign', 'washington', 'bombshell', 'byron', 'york', 'clintondossier']","On Wednesday, Fox News contributor Byron York join Tom Shillue to give his take on the Washington Post bombshell that the Clinton campaign funded the infamous Trump-Russia dossier.
Byron York said while the news isn't surprising, the confirmation of Clinton's connection with salacious report isn't just a black eye for the Democrats, but also for the FBI.
Because the clearly partisan dossier was used to justify an investigation in the Trump campaign, the Feds have a lot of explaining to do.
York also says the FBI needs to explain why they stonewalled Republicans' request for more information about the Dossier.
Tom Shillue also asked Byron York about how this would impact the ongoing Russian investigation, Robert Mueller's job status and the growing Clinton foundation uranium scandal.","Audio clip: Listen to audio clip.

On Wednesday, Fox News contributor Byron York join Tom Shillue to give his take on the Washington Post bombshell that the Clinton campaign funded the infamous Trump-Russia dossier.

Byron York said while the news isn't surprising, the confirmation of Clinton's connection with salacious report isn't just a black eye for the Democrats, but also for the FBI.

Because the clearly partisan dossier was used to justify an investigation in the Trump campaign, the Feds have a lot of explaining to do. York also says the FBI needs to explain why they stonewalled Republicans' request for more information about the Dossier.

Tom Shillue also asked Byron York about how this would impact the ongoing Russian investigation, Robert Mueller's job status and the growing Clinton foundation uranium scandal.",Byron York: How The Clinton-Dossier Bombshell Tarnishes The FBI …,https://radio.foxnews.com/2017/10/25/byron-york-how-the-clinton-dossier-bombshell-tarnishes-the-fbi/
