,KEYWORDS,SUMMARY,TEXT,TITLE,URL
177,"['barth', 'star', 'claims', 'wrap', 'jessica', 'drugged', 'exmanager', 'told', 'sexually', 'ted', 'charges', 'woman', 'sexual', 'dinner', 'guillod', 'manager', 'assaulted']","“Ted” actress Jessica Barth alleged her former manager David Guillod drugged her in 2012 while they were having dinner together and then sexually assaulted her.
Barth, 37, told The Wrap she decided to come forward with her accusations after another woman contacted her stating she was also drugged and assaulted by Guillod.
However, Guillod’s attorney, Thomas M. Ferlauto, told The Wrap the case was dropped due to lack of evidence.
Barth said that after her blog post was published, another woman contacted her and named Guillod as a person who sexually assaulted her.
I immediately had shivers from head to toe,” Barth told The Wrap.","“Ted” actress Jessica Barth alleged her former manager David Guillod drugged her in 2012 while they were having dinner together and then sexually assaulted her.

Barth, 37, told The Wrap she decided to come forward with her accusations after another woman contacted her stating she was also drugged and assaulted by Guillod.

Barth said she went to the Los Angeles Police Department with the allegations for a second time, after attempting to press charges in 2012. Barth said she chose not to press charges after Guillod threatened to sue her.

However, Guillod’s attorney, Thomas M. Ferlauto, told The Wrap the case was dropped due to lack of evidence.

“Witnesses were interviewed whose version of events belied and completely contradicted Ms. Barth’s and LAPD determined the charges to be unfounded. No criminal or civil case was ever brought against Mr. Guillod,” Ferlauto said.

The Los Angeles Police Department declined to comment.

‘HOUSE OF CARDS’ CREW CLAIM KEVIN SPACEY ROUTINELY SEXUALLY HARASSED PEOPLE ON SET

Barth said she was not aware of witnesses who may have contradicted her allegations and said her boyfriend at the time and now-husband Danny Cusumano, confirmed her statements.

Last week, Barth wrote in a blog post for The Wrap that she blacked out while having dinner with “Atomic Blonde” producer Guillod.

“The next thing I remember is waking up at home with six hickeys on my neck,” she wrote.

“I was horrified. I was completely and utterly confused and I was sick to my stomach. Through email, he tried to play it off as a silly make-out session between friends. He sent me message after message begging that we talk and letting me know how upset he was and that he couldn’t sleep because of the pit in his stomach,” Barth wrote.

The actress said she dropped Guillod as a manager immediately.

Barth claimed Guillod made sexual advances toward her on previous occasions and only went to the noted dinner because actress Felisha Terrell was going.

DOLLY PARTON, KID ROCK AND OTHER COUNTRY STARS FIRE PUBLICIST KIRT WEBSTER AFTER SEXUAL ABUSE ALLEGATIONS

Terrell, whose manager is still Guillod, told The Wrap Barth’s recount of the dinner seemed to be inaccurate.

“There were some inaccuracies in the story as I recall it. If I felt these accusations were 100 percent true I would not have remained a client. As a woman in this business, I am both supportive and inspired by women speaking their truth,” Terrell said.

Barth said that after her blog post was published, another woman contacted her and named Guillod as a person who sexually assaulted her.

“She titled the email with his name. I immediately had shivers from head to toe,” Barth told The Wrap. “The woman said that she had a similar experience, which was horrific … She said it was about three years ago.” The woman asked not to be identified.

Barth said she inspired co-star Seth MacFarlane’s jokes at the 2013 Oscars about Harvey Weinstein after she told him the disgraced producer made sexual advances toward her in 2011.",'Ted' star Jessica Barth claims ex-manager drugged and sexually assaulted her,http://www.foxnews.com/entertainment/2017/11/03/ted-star-jessica-barth-claims-ex-manager-drugged-and-sexually-assaulted-her.html
178,"['price', 'million', 'dollar', 'wwe', 'faith', 'dibiase', 'ted', 'man', 'finding', 'explores', 'im', 'wrestling', 'life', 'fame']","Fox News spoke with the Million Dollar Man, as well as several WWE Superstars, about DiBiase’s religious journey:Fox News: Who was the Million Dollar Man?
Ted DiBiase: The Million Dollar Man was to professional wrestling what Ebenezer Scrooge is to Christmas.
The Million Dollar Man thought he could buy anybody or anything and that was the essence of the character.
Christian: He optimized what the Million Dollar Man was and should have been and that’s why it worked.
...Because of his character the Million Dollar Man, he had to actually pay for things and be the Million Dollar Man 24/7.","Ted DiBiase’s career as a wrestler skyrocketed when he became the villainous Million Dollar Man in 1987 for the World Wrestling Federation – except he was hiding a secret.

When cameras stopped rolling and millions of viewers weren’t watching, the former football player was at war with himself. While his character personified “sex, drugs and professional wrestling,” DiBiase was a devoted family man of faith.

DiBiase ended his wrestling career in 1999 after 25 years in the industry.

Today, the 63-year-old married father of three is a full-time evangelist who has been officially ordained into the ministry. He is sharing his story in a new documentary, “The Price of Fame,” which premieres in select theaters November 7.

Fox News spoke with the Million Dollar Man, as well as several WWE Superstars, about DiBiase’s religious journey:

Fox News: Who was the Million Dollar Man?

Ted DiBiase: The Million Dollar Man was to professional wrestling what Ebenezer Scrooge is to Christmas. He was like a rich bully. He bullied everybody with his money, and his motto was ""Everybody’s got a price."" The Million Dollar Man thought he could buy anybody or anything and that was the essence of the character. About as evil as you can get!

Fox News: What were some of your memories of the Million Dollar Man?

Christian (Former WWE Superstar): I don’t think that character would have worked with anybody playing it besides Ted DiBiase. I think he just played it to a T, he had the look, the voice, the laugh.

Tommy Dreamer (Former WWE Superstar): I told him [he was] always great. He did everything how you’re supposed to do it. He should have been Mr. Perfect because he did it perfectly.

A post shared by Ted DiBiase (@mdmteddibiase) on Nov 22, 2015 at 3:21pm PST

Jake The Snake Roberts (WWE Hall of Famer): I remember WrestleMania with Ted, we were on an even field, so we just went in there and had a real good time and really entertained the people... Those are magic moments man, you don’t see it anymore.

Christian: He optimized what the Million Dollar Man was and should have been and that’s why it worked.

Fox News: How did this movie come together?

Peter Ferriero (Director): When I started making the movie “The Price of Fame” I initially thought I wanted to find out where all my childhood heroes were. ...Because of his character the Million Dollar Man, he had to actually pay for things and be the Million Dollar Man 24/7.

A post shared by stashpages (@stashpages) on Nov 2, 2017 at 3:51pm PDT

I’ve talked to a lot of guys that he rode with, they all saw his life and the adultery and everything he was doing on the road and that was the beginning of the downfall of Ted DiBiase or the Million Dollar Man, but it was also the start of the rise and the redemption of who he would become.

Fox News: Who is Ted DiBiase today?

DiBiase: Today I am Ted DiBiase, not the wrestler, but now I am a minister. I travel all over the United States basically in evangelism, speaking in churches, speaking in prisons, speaking in rehab centers wherever I can basically sharing my story of redemption and the turnaround in my life.

That’s why this film was titled “The Price of Fame."" Now I want to be careful with saying the price of fame is whatever you make it. We all make individual decisions, but it’s like a lot of the things that come a long with being famous. You got to build accountability into your life or it’s very easy for it to take you down.

A post shared by Ted DiBiase (@mdmteddibiase) on Aug 14, 2017 at 3:32pm PDT

Fox News: What do you hope people will take away from this movie?

Ferriero: I think one of the biggest takeaways I would like for people to have watching the movie is that you can really change your life in a flash. And sometimes forgiveness can not only benefit the person but yourself as well.

DiBiase: The really important things in life, and I found out the hard way because I found all those things at the end of the day to be empty. Because if I don’t have a wife and a family who loves and respects me, if I don’t have their respect and if I’m not living my life in such a way that I’m being open and honest with them than what do I really have.

I’ve been traveling and speaking in churches and all these other places for 17 years now and I’m still going. I tell people all day who say ""When you going to retire?"" I said I never found the word retirement in the bible, so I’m going to keep going till I’m not here.

",Million Dollar Man Ted DiBiase explores finding faith in 'The Price of Fame',http://www.foxnews.com/entertainment/2017/11/06/million-dollar-man-ted-dibiase-explores-finding-faith-in-price-fame.html
179,"['plane', 'rides', 'airport', 'obtained', 'tarmac', 'security', 'access', 'source', 'man', 'officials', 'baggage', 'international', 'miami', 'carousel', 'escapes']","A man at Miami International Airport successfully evaded airport security — for a few moments — by hopping on the baggage carousel and riding out to the tarmac.
In footage the Herald obtained from an anonymous source, the man can be seen walking behind the ticketing desk and diving onto the conveyor belt.
Subsequent footage shows the unidentified man sprinting across the tarmac as airport workers gave chase.
“Had there been a plane at that gate, this individual could have entered the plane or had access to the aircraft.
A representative for the Miami International Airport was not immediately available for comment.","A man at Miami International Airport successfully evaded airport security — for a few moments — by hopping on the baggage carousel and riding out to the tarmac.

ARIZ. AIRPORT FORCED TO REMOVE SEATING OVER BEDBUG INFESTATION

According to The Miami Herald, officials are currently investigating Saturday’s incident, which reportedly took place near a security checkpoint behind an American Airlines ticket counter. In footage the Herald obtained from an anonymous source, the man can be seen walking behind the ticketing desk and diving onto the conveyor belt.

Subsequent footage shows the unidentified man sprinting across the tarmac as airport workers gave chase. He was quickly apprehended by airport staff, and later handcuffed by a police officer who arrived on the scene.

It is currently unknown whether the man was carrying a weapon, but the Herald’s source finds the incident “very concerning” either way.

“Had there been a plane at that gate, this individual could have entered the plane or had access to the aircraft. This is a very restricted area, only accessible to some with very limited access, and he was able to gain access,” said the source.

PASSENGERS HELD AT AIRPORT BECAUSE CUSTOMS OFFICIALS WERE LATE TO WORK

In a statement obtained by Fox News, American Airlines has commended the ""quick actions of our colleagues in Miami who helped alleviate this security issue,"" though they directed any further inquiries to the Miami police.

Miami-Dade Police have yet to confirm the man’s identity, or whether he was a passenger or employee.

A representative for the Miami International Airport was not immediately available for comment.","Man rides baggage carousel at Miami International Airport, escapes to tarmac",http://www.foxnews.com/travel/2017/11/06/man-rides-baggage-carousel-at-miami-international-airport-escapes-to-tarmac.html
180,"['permit', 'shooter', 'texas', 'gov', 'denied', 'church', 'carry', 'abbott']",,,Gov. Abbott: Texas church shooter was denied carry permit,https://video.foxnews.com/v/5636798799001/?playlist_id=2114913880001
181,"['dont', 'jimmy', 'theres', 'listen', 'tomshillueshowcom', 'tuesdays', 'shillue', 'audio', 'jill', 'nyc', 'politicizing', 'movies', 'wont', 'failla', 'tom', 'attack', 'dobson', 'terror']","Audio clip: Listen to audio clip.
The third hour of the Tom Shillue Radio Show on FOX News Talk!
Jimmy Failla returns and reacts to Tuesday's terror attack in NYC.
Tom, Jimmy and callers debate if there's anything government can do prevent these attacks: Then, entertainment correspondent Jill Dobson joins the show and give hers take on why Hollywood's struggling and people won't pay to see their movies anymore.
And remember to listen to The Show Shillue Show LIVE Monday through Friday 3-6 pm Eastern!","Audio clip: Listen to audio clip.

The third hour of the Tom Shillue Radio Show on FOX News Talk!

Jimmy Failla returns and reacts to Tuesday's terror attack in NYC. Tom, Jimmy and callers debate if there's anything government can do prevent these attacks: Then, entertainment correspondent Jill Dobson joins the show and give hers take on why Hollywood's struggling and people won't pay to see their movies anymore. Dobson also reveals she's also a big Eminem fan.

Download, enjoy and please give us a review! And remember to listen to The Show Shillue Show LIVE Monday through Friday 3-6 pm Eastern! Find out more at TomShillueShow.com","Jimmy Failla, Jill Dobson: Politicizing The NYC Terror Attack, Why People Don’t Like Movies Anymore",https://radio.foxnews.com/2017/11/01/1112017-third-hour/
182,"['weekpresident', 'latest', 'political', 'zig', 'wilson', 'audio', 'correspondent', 'anderson', 'washington', 'zagging', 'jared', 'senate', 'weigh', 'fox']","Audio clip: Listen to audio clip.
FOX News Radio's National Correspondent Jared Halpern along with a team of FOX News reporters & contributors look at the week that was inside the beltway.
THIS WEEK:President Trump, Congresswoman Frederica Wilson and a firestorm over a call to a Gold Star family.
Our Rachel Sutherland and Chief Intelligence Correspondent Catherine Herridge weigh in on the hours-long Senate Judiciary Committee hearing earlier this week.
Chris Anderson, with Anderson Robbins Research, joined Jared to discuss the latest Fox News poll of Alabama's Senate race.","Audio clip: Listen to audio clip.

FOX News Radio's National Correspondent Jared Halpern along with a team of FOX News reporters & contributors look at the week that was inside the beltway.

THIS WEEK:

President Trump, Congresswoman Frederica Wilson and a firestorm over a call to a Gold Star family.

A potential bipartisan health care deal offers hope for a compromise. Jared sat down with FOX News' Senior Capitol Hill Producer Chad Pergram to discuss.

Our Rachel Sutherland and Chief Intelligence Correspondent Catherine Herridge weigh in on the hours-long Senate Judiciary Committee hearing earlier this week.

Chris Anderson, with Anderson Robbins Research, joined Jared to discuss the latest Fox News poll of Alabama's Senate race.

Listen to the latest ""From Washington"":

Follow Jared on Twitter: @JaredHalpern",From Washington: Political Zig Zagging,https://radio.foxnews.com/2017/10/20/from-washington-political-zig-zagging/
183,"['united', 'gingrich', 'smart', 'newt', 'lottery', 'immigration', 'honest', 'work', 'trump', 'need', 'terrorists', 'system', 'scrap', 'diversity', 'york']","By Newt Gingrich, Fox NewsPresident Trump is right: We should end the diversity lottery for immigration.
The lottery system should instead be replaced with a merit-based system that actively seeks people who will help grow the American economy.
However, in light of the terrorist attacks in New York, Orlando, San Bernardino, Boston and elsewhere, closing the lottery loophole isn’t enough.
We need to take far more decisive steps in improving and securing our immigration system.
They should be thoroughly interrogated and a new law should be developed so that captured terrorists are not able to benefit from Miranda rights.","By Newt Gingrich, Fox News

President Trump is right: We should end the diversity lottery for immigration. It is an absurd system for randomly selecting who should come to the United States. The lottery system should instead be replaced with a merit-based system that actively seeks people who will help grow the American economy.

Instead of continuing liberal, politically correct immigration rules that emphasize what the left calls “diversity,” we need a system that focuses on an individual’s merit, work and achievement. What a person can contribute to America should be more important when making immigration decisions than whether he or she fits some political science mantra of diversity.

However, in light of the terrorist attacks in New York, Orlando, San Bernardino, Boston and elsewhere, closing the lottery loophole isn’t enough. We need to take far more decisive steps in improving and securing our immigration system.

First, we need to identify terrorists as enemy combatants. They should be thoroughly interrogated and a new law should be developed so that captured terrorists are not able to benefit from Miranda rights.","Newt Gingrich: Get Smart -- Scrap The Diversity Lottery, Be Honest About Terrorists",http://nation.foxnews.com/2017/11/03/newt-gingrich-get-smart-scrap-diversity-lottery-be-honest-about-terrorists
184,"['14yearold', 'pastors', 'daughter', 'shooting', 'texas', 'killed', 'church']",,,Pastor's 14-Year-Old Daughter Killed in Texas Church Shooting,http://insider.foxnews.com/2017/11/05/texas-church-shooting-pastors-14-year-old-daughter-killed
185,"['elder', 'statues', 'withholds', 'race', 'wilder', 'endorsement', 'democrat', 'support', 'close', 'statesman', 'virginia', 'gillespie', 'governors', 'gubernatorial', 'governor', 'northam']","The close Virginia governor’s race coming up Tuesday has attracted national attention and endorsements from top Democrats and Republicans, with one notable exception -- Virginia elder statesman Doug Wilder.
Wilder, who won the 1990 Virginia gubernatorial race to become the first African-American elected U.S. governor, has a long history of backing fellow Democrats for governor.
In this year’s Virginia governor’s race, Wilder has endorsed neither Republican nominee Ed Gillespie nor Democrat Ralph Northam, instead backing Northam running mate Justin Fairfax.
Before becoming governor, Wilder served in the state Senate.
During his term as governor, Wilder was revered by Republicans for being fiscally responsible.","The close Virginia governor’s race coming up Tuesday has attracted national attention and endorsements from top Democrats and Republicans, with one notable exception -- Virginia elder statesman Doug Wilder.

Wilder, who won the 1990 Virginia gubernatorial race to become the first African-American elected U.S. governor, has a long history of backing fellow Democrats for governor.

He backed Mark Warner in 2001 and Terry McAuliffe in 2013, though he didn’t support fellow Democrat Creigh Deeds' failed 2009 bid.

And throughout his roughly 40 years in elected office, Wilder, considered a moderate Democrat, has been noted for his fiscal and law-and-order conservatism.

In this year’s Virginia governor’s race, Wilder has endorsed neither Republican nominee Ed Gillespie nor Democrat Ralph Northam, instead backing Northam running mate Justin Fairfax.

“We do not have the best candidates. I will start off with that,” Wilder, who several years ago declared himself an independent, said in a recent “1947: The Meet the Press Podcast.”

Though Wilder has endorsed neither gubernatorial candidate, the race has attracted some big-name support and endorsements.

President Trump has backed Gillespie via Twitter, saying he’d be a “great” governor and suggesting Northam would be “VERY weak on crime!”

Former President Barack Obama last month stumped in Virginia for Northam, in a race that in the closing weeks has largely become a referendum on which candidate would keep Virginians safer from criminals, including illegal immigrants.

And Hollywood has even gotten into the act.

“I'm writing from the set of my new movie to ask for your help in this critical governor's race in Virginia,” actor Mark Ruffalo wrote in a recent fundraising/get-out-the-vote letter for MoveOn.org. “The stakes in this year's elections couldn't be higher. I'm asking that you help by taking a few minutes to call progressive Virginia voters … and ask them to vote for Ralph Northam.”

Northam leads Gillespie by 5 percentage points, according to a Fox News poll released Monday.

Virginia was the only southern state that Democrat Hillary Clinton won in last year’s White House race.

Wilder argued in the podcast that Fairfax, who also is African-American, has been marginalized in the race, which will hurt the Democratic ticket.

“No Democrat is going to get elected in Virginia without strong African-American support,” he said. “Now that you understand that, what do you do to get that vote? You don’t do it by dissing Justin.”

A grandson of slaves, Wilder grew up in poverty and worked his way to becoming one of Richmond’s most successful trial lawyers. Before becoming governor, Wilder served in the state Senate. He was also the mayor of Richmond.

During his term as governor, Wilder was revered by Republicans for being fiscally responsible. Without raising taxes, he set up a “rainy day” account of $200 million -- a revenue fund that since its inception has stabilized the state through many volatile budgets.

Unlike the last gubernatorial election that largely focused on Virginia’s economy, social issues have emerged this year as deciding factors.

One key issue is whether to remove Confederate statues in Virginia.

During the gubernatorial debates in September, Gillespie said that he would preserve the Confederate statues, while Northam called for the statues to be removed. He said that he would prefer to see the statues in museums.

Wilder suggested in the podcast that Northam should focus on educating the public about the Civil War, especially in schools.

“To the extent of saying we are going to spend money to take our monuments and put them in museums, where is that money going to come from when schools are not getting the teachers that we need?” he asked.

Wilder’s advice to both candidates regarding the statues: Let the people of Virginia decide what they want to do.

“If the people want to take it down, take it down, but have consensus to the degree of participation,” he said. “It shouldn’t be done just by saying ‘I want this done.’ You can’t deal with it by knee-jerk actions.""","In close Virginia governor's race, elder statesman Wilder withholds endorsement",http://www.foxnews.com/politics/2017/11/06/in-close-virginia-governors-race-elder-statesman-wilder-withholds-endorsement.html
186,"['updated', 'stirewaltdana', 'start', '1132017', 'greg', 'w', 'perino', 'whip', 'week', 'shannon', 'stirewalt', 'rundown', 'fox']","Start the day with this quick news podcast!
· Perino & StirewaltDana Perino & Chris Stirewalt dishing on politics news every week.
· The One w/ Greg GutfeldYou know him.
Greg Gutfeld.
· Livin’ the BreamInspirational stories, personal anecdotes and an insider’s perspective from Shannon Bream.","More Podcasts

· The Whip Around

In hurry? Start the day with this quick news podcast!

· Hourly Newscast

The news updated every hour!

· The Five

It’s the full primetime show. FREE!

· Perino & Stirewalt

Dana Perino & Chris Stirewalt dishing on politics news every week.

· The One w/ Greg Gutfeld

You know him. You love him. Greg Gutfeld.

· Livin’ the Bream

Inspirational stories, personal anecdotes and an insider’s perspective from Shannon Bream.

· HemmerTime

One on one with engaging personalities hosted by Bill Hemmer.",The FOX News Rundown 11/3/2017,https://radio.foxnews.com/2017/11/03/the-fox-news-rundown-1132017/
