,KEYWORDS,SUMMARY,TEXT,TITLE,URL
218,"['cop', 'officer', 'helps', 'facebook', 'york', 'diamond', 'drivers', 'woman', 'went', 'paramus', 'jersey', 'highway', 'realized', 'garcia', 'lost', 'ring', 'engagement']","A police officer in Northern New Jersey came to the rescue of a woman who lost her diamond engagement ring Sunday while changing a flat tire on the side of a busy highway.
""When she returned home she realized that her ring was missing and called our department to file a report,"" police said.
Garcia went back to the stretch of highway with police later that day, but was unable to find the ring.
On Monday, Paramus police said, Officer Jon Henderson went back to look for it during his free patrol time and found the ring.
The two posed in a picture posted on the department's Facebook page, with Garcia beaming with excitement after being reunited with her ring.","A police officer in Northern New Jersey came to the rescue of a woman who lost her diamond engagement ring Sunday while changing a flat tire on the side of a busy highway.

Police in Paramus, located just outside New York City, said in a Facebook post that Kimberly Garcia realized when she got home on Sunday that she had lost her ring on Route 4 after pulling over to change the tire.

""When she returned home she realized that her ring was missing and called our department to file a report,"" police said.

Garcia went back to the stretch of highway with police later that day, but was unable to find the ring.

On Monday, Paramus police said, Officer Jon Henderson went back to look for it during his free patrol time and found the ring.

The two posed in a picture posted on the department's Facebook page, with Garcia beaming with excitement after being reunited with her ring.",New Jersey cop helps find driver's lost diamond engagement ring on highway,https://www.foxnews.com/us/2017/09/20/new-jersey-cop-helps-find-drivers-lost-diamond-engagement-ring-on-highway.html
219,"['racial', 'players', 'nfl', 'comment', 'apologizes', 'coach', 'ditka', 'saying', 'know', 'interview', 'mike', 'chicago', 'comments', 'oppression']","Mike Ditka has apologized for saying he wasn’t aware of any racial oppression over the last 100 years in the United States.
The famed Chicago Bears coach came under fire for making the comments during a radio interview on Monday about NFL players kneeling during the national anthem.
Ditka went further on Monday, saying he didn’t know what “social injustices” players are protesting.
Even in Chicago, where Ditka is revered, the reaction was critical and incredulous.
“It’s so ridiculous, it’s hard to have a conversation about it,” Carmen DeFalco, an ESPN radio host in Chicago, told Chicago television station WLS-TV.","Mike Ditka has apologized for saying he wasn’t aware of any racial oppression over the last 100 years in the United States.

The famed Chicago Bears coach came under fire for making the comments during a radio interview on Monday about NFL players kneeling during the national anthem. He issued an apology the next day, saying he was talking about professional football and not society as a whole.

“I have absolutely seen oppression in society in the last 100 years,” the Hall of Fame tight end and Super Bowl-winning coach said in statement to WGN-TV in Chicago. “The interview was about the NFL and related issues. That’s where my head was at.”

The interview aired before the Chicago Bears played the Minnesota Vikings on Monday night.

The 77-year-old old Ditka previously has made harsh comments about players who take a knee, which has sparked fierce debate about issues such as patriotism and protest. He said he would bench players who didn’t stand during the anthem.

Ditka went further on Monday, saying he didn’t know what “social injustices” players are protesting.

“There has been no oppression in the last 100 years that I know of,” he said.

Ditka’s comments triggered a quick backlash, with many chastising him for seemingly ignoring or not knowing about Jim Crow Laws that enforced racial segregation and the lynching of African Americans that occurred well into Ditka’s lifetime.

“Great coach ... clueless person,” tweeted retired NFL player Steve Smith.

Even in Chicago, where Ditka is revered, the reaction was critical and incredulous.

“It’s so ridiculous, it’s hard to have a conversation about it,” Carmen DeFalco, an ESPN radio host in Chicago, told Chicago television station WLS-TV. “I don’t know how you could grow up in this country — especially when he did — and be completely unaware of something as significant as the Civil Rights Movement of the 1960s.”",Mike Ditka apologizes for comment on racial oppression,https://www.foxnews.com/sports/2017/10/11/mike-ditka-apologizes-for-comment-on-racial-oppression.html
220,"['director', 'james', 'fbi', 'comey', 'investigation']",,,FBI director says there is no investigation into James Comey,https://video.foxnews.com/v/5607686505001/?playlist_id=2114913880001
221,"['swoyer', 'rosemary', 'ruled', 'prayer', 'federal', 'congress', 'court', 'washington', 'upheld', 'timesa', 'sessions', 'whos', 'permitted', 'upholds', 'sits']","By Alex Swoyer - The Washington TimesA federal court ruled Wednesday that Congress can continue to open its sessions each day with a prayer, and upheld the House’s ability to pick and choose who’s allowed to lead the prayer.
U.S. District Judge Rosemary M. Collyer, a Bush appointee who sits in Washington, D.C., rejected a challenge by Daniel Barker, co-president of Freedom From Religion Foundation, who said he was not permitted to give an opening invocation, even though other guest chaplains have been permitted.","By Alex Swoyer - The Washington Times

A federal court ruled Wednesday that Congress can continue to open its sessions each day with a prayer, and upheld the House’s ability to pick and choose who’s allowed to lead the prayer.

U.S. District Judge Rosemary M. Collyer, a Bush appointee who sits in Washington, D.C., rejected a challenge by Daniel Barker, co-president of Freedom From Religion Foundation, who said he was not permitted to give an opening invocation, even though other guest chaplains have been permitted.",Federal Court Upholds Prayer In Congress,http://nation.foxnews.com/2017/10/12/federal-court-upholds-prayer-congress#commenting
222,"['right', 'away', 'hooks', 'told', 'dan', 'energy', 'lure', 'therre', 'son', 'pink', 'fisherman', 'monster', 'uses', 'trip', 'trout', 'drink', 'fishing', 'wobbler', 'fish']","Dan Therre was on a fishing trip with his father, brother and two others, when he realized he wasn’t getting a bite.
We set up camp at an Adirondack pond near Tupper Lake after traveling across one pond and portaging into another.
[After] a few hours of daylight we fished with worms without a bite,” his father, Don Therre, told NYup.com.
“We stopped to have lunch and my son had a sandwich and energy drink.
But as far as making the energy drink fishing lure an annual tradition, Therre was “sure [next time] everyone will bring a wobbler with them.”","Dan Therre was on a fishing trip with his father, brother and two others, when he realized he wasn’t getting a bite.

""The trip started like most. We set up camp at an Adirondack pond near Tupper Lake after traveling across one pond and portaging into another. [After] a few hours of daylight we fished with worms without a bite,” his father, Don Therre, told NYup.com.

MOOSE HUNTER SLAMS FACEBOOK CRITICS WHO CALLED HER 'DISGUSTING'

The group, who was out fishing for brook trout, ended their day without much to show for it.

The next morning, Therre said, he got up early and was able to get some response from the fish with his “Lake Clear Wobbler with a small spinner and worm behind it.”

“This combination has been used in the Adirondacks for almost a century, The brook trout responded quickly. Unfortunately, nobody else had one,” he told NYup.com. “The nearest place was a several hour portage and trip to get there. Nobody else wanted to do that.”

So when they all stopped to have lunch, Therre’s son came up with his own solution to the lure shortage – he was going to make his own out of the leftovers from his lunch.

“We stopped to have lunch and my son had a sandwich and energy drink. As he took a sip and set his can down, he said, ‘I'm going to make a wobbler out of the (pink) can.’ I told him it was worth a try but wasn't sure it would work,” Therre said.

FOLLOW US ON FACEBOOK FOR MORE FOX LIFESTYLE NEWS

After Therre handed his son his wobbler to use as a guide for the size and shape, Dan made one of his own out of a shiny pink Monster Energy Pipeline Punch can.

Therre admits he was “skeptical” about the trout being attracted to the pink and silver metal, but “within 10 to 15 minutes [Dan] got a hit and announced he hooked it.”

“He then proceeded to catch four more on it before our time was over,” Therre said.

The group faired just as well, catching 30 brook trout all together. But as far as making the energy drink fishing lure an annual tradition, Therre was “sure [next time] everyone will bring a wobbler with them.”","Fisherman uses Monster Energy Drink can to lure fish, hooks one right away",http://www.foxnews.com/great-outdoors/2017/10/03/fisherman-uses-monster-energy-drink-can-to-lure-fish-hooks-one-right-away.html
223,"['online', 'channel', 'watch', 'business', 'fox', 'network']",,,Watch Fox News Channel and Fox Business Network Online,https://video.foxnews.com/v/1241186546001/fox-news-channel/#sp=watch-live
224,"['trump', 'values', 'president', 'voter', 'delivers', 'speech', '2017', 'summit']",,,President Trump delivers speech at 2017 Values Voter Summit,http://video.foxnews.com/v/5608987279001/
225,"['wearing', 'posted', 'hairs', 'nose', 'beauty', 'look', 'bizarre', 'viral', 'extensions', 'latest', 'hair', 'trend']","Nose hair extensions are popping up all over social media as the latest bizarre beauty trend.
Nose hair extension #nosehair #lashes #extensions #beauty #selfie #eyelashextensions #falselashes #加藤一二三 A post shared by GretChen Chen (@gret_chen_chen) on Oct 4, 2017 at 12:39pm PDTThe unique beauty statement was derived from Gret_Chen_Chen, an Instagram user, who posted a photo of herself wearing eyelash extensions around her nostrils.
She called them “nose hair extensions.”TWITTER USERS ARE SHARING VIRAL ‘WEIGHT LOSS’ TRANSFORMATION PICS AFTER DUMPING THEIR EXESFOX26 reported she wore the eyelashes as a joke but the photo went viral and the trend quickly caught on.
Several beauty bloggers posted photos of themselves wearing the small hairs on their nose, as well.
""Is it something we're saying is the big new trend for 2017?","Nose hair extensions are popping up all over social media as the latest bizarre beauty trend.

Nose hair extension #nosehair #lashes #extensions #beauty #selfie #eyelashextensions #falselashes #加藤一二三 A post shared by GretChen Chen (@gret_chen_chen) on Oct 4, 2017 at 12:39pm PDT

The unique beauty statement was derived from Gret_Chen_Chen, an Instagram user, who posted a photo of herself wearing eyelash extensions around her nostrils. She called them “nose hair extensions.”

TWITTER USERS ARE SHARING VIRAL ‘WEIGHT LOSS’ TRANSFORMATION PICS AFTER DUMPING THEIR EXES

FOX26 reported she wore the eyelashes as a joke but the photo went viral and the trend quickly caught on. Several beauty bloggers posted photos of themselves wearing the small hairs on their nose, as well. Other people put it them on their lips for fun, as well.

Taylor R., a beauty blogger, said in a YouTube video the hairs look like “spiders or cockroaches crawling out of your face.”

FOLLOW US ON FACEBOOK FOR MORE FOX LIFESTYLE NEWS

""I think it's really fun for people to take a break from the workday and look at something maybe a little inspiring or and just have a break or moment to enjoy that,"" Laura Levinson, the Senior Beauty Editor at Pop Sugar, told FOX5. ""Is it something we're saying is the big new trend for 2017? Probably not.""",Nose hair extensions are the latest bizarre beauty trend,https://www.foxnews.com/lifestyle/2017/10/12/nose-hair-extensions-are-latest-bizarre-beauty-trend.html
226,"['children', 'boyle', 'husband', 'guantanamo', 'caitlan', 'khadr', 'pakistan', 'held', 'officials', 'firefight', 'american', 'family', 'militants', 'canadian', 'press', 'coleman', 'leave']","Canadian Joshua Boyle reportedly balked at boarding a U.S. plane out of Pakistan on Thursday, worrying his background could land him in hot water with American officials, specifically believing he could be imprisoned at Guantanamo Bay.
The Canadian-born Khadr was 15 in 2002 when he tossed a grenade in a firefight that killed U.S. Army Sgt.
Caitlan Coleman, of Stewartstown, Pa., was rescued along with Boyle and their children on Thursday after their captors moved them across the border to Pakistan from Afghanistan.
U.S. officials supplied the intelligence used to facilitate the release, Pakistan said.
This is a positive moment for our country's relationship with Pakistan,"" President Trump said in a statement Thursday.","An American woman, her Canadian husband and their three children -- who were freed from a Taliban-affiliated group after five years of captivity -- left Pakistan for an unknown destination on Friday, one day after reports emerged the woman's husband feared being jailed by U.S. authorities.

Canadian Joshua Boyle reportedly balked at boarding a U.S. plane out of Pakistan on Thursday, worrying his background could land him in hot water with American officials, specifically believing he could be imprisoned at Guantanamo Bay.

Boyle was previously married to the sister of Omar Khadr, a Canadian man who spent 10 years at Guantanamo Bay after being captured in 2002 in a firefight at an Al Qaeda compound in Afghanistan.

The Canadian-born Khadr was 15 in 2002 when he tossed a grenade in a firefight that killed U.S. Army Sgt. 1st Class Christopher Speer, a special forces medic.

Other officials had discounted any link between that background and Boyle's capture by the Haqqani network in 2012, with one describing it to The Associated Press in 2014 as a ""horrible coincidence.""

Caitlan Coleman, of Stewartstown, Pa., was rescued along with Boyle and their children on Thursday after their captors moved them across the border to Pakistan from Afghanistan. U.S. officials supplied the intelligence used to facilitate the release, Pakistan said.

The couple was kidnapped in October 2012 while on a backpacking trip that took them to Russia, Kazakhstan, Tajikistan and Kyrgyzstan, and then to Afghanistan. All three children were born in captivity.

""Today they are free. This is a positive moment for our country's relationship with Pakistan,"" President Trump said in a statement Thursday. ""The Pakistani government's cooperation is a sign that it is honoring America's wishes for it to do more to provide security in the region.""

The Associated Press contributed to this report.","American Caitlan Coleman, family leave Pakistan after five years held by militants",http://www.foxnews.com/world/2017/10/13/family-freed-from-militants-leaves-pakistan.html
227,"['websites', 'users', 'scientists', 'following', 'firm', 'millions', 'hack', 'cybersecurity', 'star', 'spied', 'malware', 'website', 'virus', 'web', 'pornhub']","A cybersecurity firm has confirmed Pornhub was affected by a malicious software (malware) for more than a year and may have affected millions of the adult website’s subscribers.
Proofpoint, the cybersecurity firm, said in an Oct. 6 report it discovered the virus, dubbed Kovter, had been hiding in the website’s advertisements, the Kansas City Star reported.
Users may have gotten the virus if they clicked on a tab that stated there was “a critical update” for the browser on which they were viewing Pornhub.
A MASSIVE HOLE JUST OPENED IN ANTARTICA’S ICE AND SCIENTISTS CAN’T EXPLAIN ITProofpoint said it informed Pornhub of the malware, which was immediately removed.
""Regardless, threat actors are following the money and looking to more effective combinations of social engineering, targeting and pre-filtering to infect new victims at scale.”","A cybersecurity firm has confirmed Pornhub was affected by a malicious software (malware) for more than a year and may have affected millions of the adult website’s subscribers.

Proofpoint, the cybersecurity firm, said in an Oct. 6 report it discovered the virus, dubbed Kovter, had been hiding in the website’s advertisements, the Kansas City Star reported.

VOLCANOES KILL ABOUT 540 PEOPLE A YEAR, SCIENTISTS SAY

Pornhub is the globe’s most popular website for porn and the 20th favored website in the U.S., Alexa, which gathers web traffic data, reported. The site attracts some 80 million visitors a day, the Star reported.

Users may have gotten the virus if they clicked on a tab that stated there was “a critical update” for the browser on which they were viewing Pornhub. Once a user clicked on the link, the virus was downloaded, and it could trace a person’s web history and identification.

A MASSIVE HOLE JUST OPENED IN ANTARTICA’S ICE AND SCIENTISTS CAN’T EXPLAIN IT

Proofpoint said it informed Pornhub of the malware, which was immediately removed. Researchers warned the malware could have done much worse damage and sites need to be wary of future hacks.

“While the payload in this case is ad fraud malware, it could just as easily have been ransomware, an information stealer, or any other malware,” Proofpoint wrote in the report.

""Regardless, threat actors are following the money and looking to more effective combinations of social engineering, targeting and pre-filtering to infect new victims at scale.”",Millions of Pornhub users may have been spied on following hack,https://www.foxnews.com/tech/2017/10/12/millions-pornhub-users-may-have-been-spied-on-following-hack.html
228,"['better', 'extra', 'room', 'add', 'bedroom', 'dedicated', 'craft', 'office', 'life', 'small', 'wall', 'space', 'spare']","I love the idea of transforming an extra bedroom into a beautiful walk-in closet and dressing room.
If you are someone who enjoys scrapbooking, jewelry making, sewing or similar hobbies, a dedicated craft room may be exactly what you crave.
Outfit a small extra bedroom with exercise equipment and a wall-mounted television.
Also, large wall mirrors not only make a small bedroom appear larger but can help you ensure correct form and prevent injuries.
With an available bedroom, a quiet dedicated space for yoga or pilates may be an attainable luxury.","next

prev next

prev

Excess space is a luxury that most of us do not enjoy while our kids are living at home. But many of my clients find that once their grown children have moved out of the house and established their own households, they suddenly have extra unused spaces. At some point, those childhood bedrooms get cleaned out and stand waiting for a fresh coat of paint and a new purpose.

If you’re lucky enough to have extra square footage in your nest, here are eight ideas for turning that space into something fit for your current lifestyle.

1. A walk-in closet and dressing room. I love the idea of transforming an extra bedroom into a beautiful walk-in closet and dressing room. Several of my clients have done this, gaining both functionality and luxury. One client was even able to connect her new dressing room to her master bath — a nice perk if your floor plan allows. Many companies specialize in custom cabinetry and closets and can help you add this extra bit of comfort to your home.

2. A home office. Some people telecommute, others finish work projects or emails after hours at home, while still others simply enjoy having a dedicated home office for paying bills and taking care of other personal business. An extra bedroom is a perfect option for a home office because the door can be closed for solitude and focus or to hide clutter. You might line closets in the room with custom shelving and cabinets. Or, if this level of construction is not in your budget, you might purchase some beautiful storage solutions at furniture stores that can help you create a good-looking and organized home office.

3. A guest bedroom. Perhaps your adult children live out of town and stay for several nights when they visit. Or maybe other friends or family members often bunk in your home. A dedicated guest room might be just what you need. To make this a relatively inexpensive project, you might repurpose some furniture from a child’s former bedroom. A fresh coat of paint, new bedding, and updated accessories may be all you need to complete its new look.

4. A craft room. If you are someone who enjoys scrapbooking, jewelry making, sewing or similar hobbies, a dedicated craft room may be exactly what you crave. Frequently, craft projects span days or even weeks, and putting supplies away in the middle of a project can be cumbersome. Even if your funds do not allow for built-ins, a large table and wall shelving can work wonders for storing and organizing craft materials.

5. A reading nook. Maybe you have been longing for a quiet, comfortable place to relax with a good book — a small spare bedroom easily could be outfitted for this purpose. You may be able to relocate a comfortable chair from elsewhere in your home. Add a good reading lamp and a small book shelf and, if you want to go further, paint the walls a new color and add accessories, artwork and throw pillows. A cozy blanket in a bright color is another inexpensive way to add style to your reading spot.

6. An exercise gym. Outfit a small extra bedroom with exercise equipment and a wall-mounted television. Watching your favorite show while working out can make the time much more pleasant — I’m speaking from experience here. Also, large wall mirrors not only make a small bedroom appear larger but can help you ensure correct form and prevent injuries.

7. A yoga or pilates studio. With an available bedroom, a quiet dedicated space for yoga or pilates may be an attainable luxury. If your space and budget allow, enhancing a new studio by adding sliding doors out to a private garden is a wonderful way to create a special place with plenty of light and fresh air. A bubbling fountain augments the mood. Painting the walls a cool, calming color such as blue or gray can also boost the tranquility.

8. A multifunctional space. If you have only one spare bedroom but a variety of needs, a Murphy bed or wall bed may be the solution for you. Multiple companies specialize in beds that fold effortlessly into an attractive wall cabinet when not needed. That way, you can use your spare room as a home office, craft space or exercise studio without a bed taking up floor space — at least not until just before your visiting children arrive.",How to make use and better your life with a spare bedroom,https://www.foxnews.com/real-estate/2017/09/28/how-to-make-use-and-better-your-life-with-spare-bedroom.html
229,"['total', 'million', '43', 'receiving', 'claims', 'lowest', 'level', 'reported', 'washington', 'number', 'nearly', 'workers', 'fall', 'mark', 'hurricanes', 'unemployment', 'despite']","by Joseph Lawler, Washington ExaminerThe total number of laid-off workers receiving unemployment benefits fell to 1.89 million at the end of September, the Department of Labor reported Thursday, the lowest such mark in nearly 44 years.","by Joseph Lawler, Washington Examiner

The total number of laid-off workers receiving unemployment benefits fell to 1.89 million at the end of September, the Department of Labor reported Thursday, the lowest such mark in nearly 44 years.","Unemployment Claims Fall To Lowest Level In 43 Years, Despite Hurricanes",http://nation.foxnews.com/2017/10/12/unemployment-claims-fall-lowest-level-43-years-despite-hurricanes
