,KEYWORDS,SUMMARY,TEXT,TITLE,URL
70,"['daily', 'evans', 'bad', 'told', 'review', 'woman', 'bodyshamed', 'come', 'chance', 'response', 'left', 'hotel', 'wrote', 'owner', 'claims']","A woman was in for a rude awakening after she left a negative hotel review and got a surprising response from the manager.
Emily Chance was unimpressed with her accommodations at the Nelcon Hotel in Blackpool, England, so she left a less-than-stellar review on Booking.com.
A hotel spokesperson responded to Chance’s review, asking what she expected for the price.
According to Chance, the hotel owner, Ken Evans, then sent her a text message to her personal phone that went too far, she told Daily Mail.
FOLLOW US ON FACEBOOK FOR MORE FOX LIFESTYLE NEWSEvans told Daily Mail that Chance’s review was inaccurate.","A woman was in for a rude awakening after she left a negative hotel review and got a surprising response from the manager.

Emily Chance was unimpressed with her accommodations at the Nelcon Hotel in Blackpool, England, so she left a less-than-stellar review on Booking.com. Giving the business 3.8 out of 10 stars, Chance complained that there was “horrendous smell” and dirty linens, among other issues.

""The property itself is in a bad condition the room wasn't too bad but very run down and more of an effort could be made to the rooms considering they ask for money,"" she wrote in her review.

DELTA PASSENGER CLAIMS EDIBLE MARIJUANA MADE HIM PUNCH FLIGHT ATTENDANT

Chance booked the hotel for her and her husband’s two-year wedding anniversary for about $50 for their two-night stay. She wrote that the living conditions were “unhealthy” and she wouldn’t be staying there again.

A hotel spokesperson responded to Chance’s review, asking what she expected for the price. ""Most of what you describe I do not recognize as a matter of interest … I think possibly you were expecting a four-star hotel,"" the response read.

But the hotel’s response didn’t stop there. According to Chance, the hotel owner, Ken Evans, then sent her a text message to her personal phone that went too far, she told Daily Mail.

""For someone who has never been away before you do not come across as nervous in fact you come across as a nasty piece of work who probably should be put on a diet as you must hate everything and everyone,"" Evans wrote in the text.



FOLLOW US ON FACEBOOK FOR MORE FOX LIFESTYLE NEWS

Evans told Daily Mail that Chance’s review was inaccurate. “I don't have a problem with people reviewing us, but what she wrote was a pack of lies,” he said.

The hotel currently has a 6.9 out of 10 score on Booking.com based on 182 reviews.","Hotel owner body-shamed woman after she left bad review, she claims",https://www.foxnews.com/travel/2017/10/12/hotel-owner-body-shamed-woman-after-left-bad-review-claims.html
71,"['helped', 'brittany', 'visits', 'aldean', 'today', 'shooting', 'wont', 'las', 'woundedthe', 'victims', 'jason', 'wrote', 'vegas', 'visit']","Jason Aldean returned to Las Vegas one week after a mass shooting during his performance at a music festival left 58 people dead and hundreds more hurt.
""Feels surreal being back in Vegas today.
Visiting some of the strongest people we have ever met... fighting the toughest battle of them all...for their lives,"" Brittany Aldean wrote on Instagram.
A post shared by Brittany Aldean (@brittanyaldean) on Oct 8, 2017 at 2:55pm PDTThe hospital said in a statement Aldean's visit ""helped heal hearts and cheer those who were wounded.""
The visit came a day after Aldean performed on Tom Petty's ""I Won't Back Down"" on ""Saturday Night Live"" in tribute to the victims.","Jason Aldean returned to Las Vegas one week after a mass shooting during his performance at a music festival left 58 people dead and hundreds more hurt.

The country singer and his wife Brittany visited survivors of the shooting at the University Medical Center of Southern Nevada.

""Feels surreal being back in Vegas today. Visiting some of the strongest people we have ever met... fighting the toughest battle of them all...for their lives,"" Brittany Aldean wrote on Instagram. ""You have helped us try to begin the healing process by seeing the strength each one of you have. Thank you for today. We will never forget.""

A post shared by Brittany Aldean (@brittanyaldean) on Oct 8, 2017 at 2:55pm PDT

The hospital said in a statement Aldean's visit ""helped heal hearts and cheer those who were wounded.""

The visit came a day after Aldean performed on Tom Petty's ""I Won't Back Down"" on ""Saturday Night Live"" in tribute to the victims.",Jason Aldean visits Las Vegas shooting victims,https://www.foxnews.com/entertainment/2017/10/09/jason-aldean-visits-las-vegas-shooting-victims.html
72,"['losers', 'winners', 'obamacare', 'executive', 'pledging', 'trump', 'leonard', 'numerous', 'loosen', 'trumps', 'washington', 'obamacares', 'mandates', 'order', 'signed']","by Kimberly Leonard, Washington ExaminerPresident Trump signed an executive order Thursday directing federal agencies to loosen Obamacare's mandates and pledging to bring numerous Americans less expensive health insurance coverage.","by Kimberly Leonard, Washington Examiner

President Trump signed an executive order Thursday directing federal agencies to loosen Obamacare's mandates and pledging to bring numerous Americans less expensive health insurance coverage.",Winners And Losers Of Trump's Executive Order On ObamaCare,http://nation.foxnews.com/2017/10/13/winners-and-losers-trumps-executive-order-obamacare#commenting
73,"['tomi', 'antitrump', 'left', 'prowoman', 'lahren']",,,"Tomi Lahren: The left is not pro-woman, just anti-Trump",https://video.foxnews.com/v/5607878398001/?playlist_id=2114913880001
74,"['written', 'turkishgerman', 'writer', 'warranthe', 'turkey', 'yalcin', 'widespread', 'killings', 'drops', 'wont', 'spain', 'view', 'vacationing', 'extradition']","Spain's government says that a Turkish-born writer, who has German citizenship, won't be extradited to Turkey for his alleged involvement with an outlawed group.
German authorities and rights groups protested after Dogan Akhanly was arrested in August while vacationing in southern Spain on a Turkish warrant.
He was later released but ordered to remain in Madrid while the extradition request was considered.
Akhanly has written about the mass killings of Armenians in Turkey in 1915.
The killings are a sensitive subject in Turkey, which rejects the widespread view that they constituted genocide.","Spain's government says that a Turkish-born writer, who has German citizenship, won't be extradited to Turkey for his alleged involvement with an outlawed group.

German authorities and rights groups protested after Dogan Akhanly was arrested in August while vacationing in southern Spain on a Turkish warrant.

He was later released but ordered to remain in Madrid while the extradition request was considered.

Spanish Deputy Prime Minister Soraya Saenz de Santamaria said Friday that the government halted the process on the same grounds for releasing Turkish-Swedish writer Hamza Yalcin last month — because under Spanish laws refugees can't be extradited.

Akhanly has written about the mass killings of Armenians in Turkey in 1915. The killings are a sensitive subject in Turkey, which rejects the widespread view that they constituted genocide.",Spain drops extradition of Turkish-German writer to Turkey,http://www.foxnews.com/world/2017/10/13/spain-drops-extradition-turkish-german-writer-to-turkey.html
75,"['finds', 'study', 'prescription', 'studied', 'health', 'energy', 'risk', 'increase', 'substance', 'drinks', 'likely', 'findings', 'cocaine']","Energy drinks have been blamed for heart attacks and banned from college campuses, but they're are now being studied for their potential to increase one's chances of getting hooked on drugs.
Specifically, they found a significant increase in drug use among 25-year-olds who regularly consumed energy drinks in the five years prior—and the links to cocaine, alcohol and prescription stimulants are especially strong.
Even the 17.4 percent whose use was intermittent were more likely to use cocaine and prescription drugs than the 20.6 percent who never used energy drinks.
By controlling for things like risk-taking behaviors, caffeine consumption, prior substance use and demographics, researchers say they've singled out energy drinks as the culprit.
(Apparently the health effects of snorting chocolate have yet to be studied.)","Energy drinks have been blamed for heart attacks and banned from college campuses, but they're are now being studied for their potential to increase one's chances of getting hooked on drugs.

And the news is not good: Writing in the journal Drug and Alcohol Dependence, a University of Maryland School of Public Health researcher says their ""results suggest that energy drink users might be at heightened risk for other substance use, particularly stimulants.""

Specifically, they found a significant increase in drug use among 25-year-olds who regularly consumed energy drinks in the five years prior—and the links to cocaine, alcohol and prescription stimulants are especially strong.

Among their findings: Out of 1,099 participants recruited for the study while in college, more than half (51.4 percent) reported a sustained level of energy drink consumption for the years studied, reports Medical Express, and were ""significantly more likely to be using stimulant drugs"" at age 25. Even the 17.4 percent whose use was intermittent were more likely to use cocaine and prescription drugs than the 20.6 percent who never used energy drinks.

By controlling for things like risk-taking behaviors, caffeine consumption, prior substance use and demographics, researchers say they've singled out energy drinks as the culprit. The findings come right as Senate minority leader Chuck Schumer has called on the FDA to investigate Coco Loko, a caffeinated raw cacao snuff he recently called ""cocaine on training wheels,"" per Quartz. (Apparently the health effects of snorting chocolate have yet to be studied.)

This article originally appeared on Newser","Energy drinks could increase risk of cocaine use, study finds",http://www.foxnews.com/food-drink/2017/08/11/energy-drinks-could-increase-risk-cocaine-use-study-finds.html
76,"['mercedesbenz', 'sound', 'venue', 'concert', 'garth', 'refunds', 'demand', 'issues', 'brooks', 'upper', 'fans', 'looking', 'stadium']","The first concert in Atlanta’s shiny new $1.5 billion Mercedes-Benz Stadium ended in controversy late Thursday night as some fans took to social media to demand refunds, claiming they could not hear country music superstar Garth Brooks.
“We sprung a couple hundred bucks to see Garth Brooks at the heavily advertised, much anticipated, and [first ever], concert at this stadium,” a fan wrote in a 1-star review on Mercedes-Benz Stadium’s Facebook page.
“Garth Brooks played the first concert tonight at Mercedes-Benz Stadium and it was a spectacular show that tens of thousands enjoyed,” the venue stated.
“We have heard some fan concerns about sound quality in certain sections of the upper concourse and sound engineers are looking into that now.
Mercedes-Benz Stadium opened in August and is home to the National Football League's Atlanta Falcons and Major League Soccer's Atlanta United.","The first concert in Atlanta’s shiny new $1.5 billion Mercedes-Benz Stadium ended in controversy late Thursday night as some fans took to social media to demand refunds, claiming they could not hear country music superstar Garth Brooks.

Attendees of the show were blasting the venue on Facebook and Twitter Friday morning, posting videos of Brooks playing with a significant echo that frustrated fans. Some fans who were sitting close to the stage reportedly left early.

“We sprung a couple hundred bucks to see Garth Brooks at the heavily advertised, much anticipated, and [first ever], concert at this stadium,” a fan wrote in a 1-star review on Mercedes-Benz Stadium’s Facebook page. “We sat in section 125, and we could not hear one word that Garth or Trisha [Yearwood] said or sang. It was extremely disappointing.”

The venue said after the concert that it was looking into the issues.

“Garth Brooks played the first concert tonight at Mercedes-Benz Stadium and it was a spectacular show that tens of thousands enjoyed,” the venue stated. “We have heard some fan concerns about sound quality in certain sections of the upper concourse and sound engineers are looking into that now. We do know that a breaker was tripped that powered speakers in the parts of the upper level for a small amount of time and was resolved.”

The show was being filmed and recorded for a future Brooks live album release.

Mercedes-Benz Stadium opened in August and is home to the National Football League's Atlanta Falcons and Major League Soccer's Atlanta United. Ed Sheeran is the next artist scheduled for a concert there.",Garth Brooks fans demand refunds over Mercedes-Benz Stadium sound issues,https://www.foxnews.com/entertainment/2017/10/13/garth-brooks-fans-demand-refunds-over-mercedes-benz-stadium-sound-issues.html
77,"['accepted', 'lost', 'happened', 'watters', 'election', 'words', '2016', 'clinton', 'actions', 'hillary', 'responsibility', 'jesse']",Jesse Watters: Clinton lost the 2016 election because she has never accepted any responsibility for her actions.,Jesse Watters: Clinton lost the 2016 election because she has never accepted any responsibility for her actions.,Watters' Words: What Happened with Hillary?,http://nation.foxnews.com/2017/09/18/watters-words-what-happened-hillary
78,"['roger', 'field', 'dollar', 'nfl', 'national', 'flag', 'social', 'owners', 'players', 'anthem', 'patriotism', 'justice', 'salute']","NFL owners were initially supportive and protective of their players, their brand assets on the field, as players kneeled down while the national anthem played.
But, owners are proving to be hypocrites by not being true to the value of social justice nor patriotism and instead have one focus: the dollar.
NFL national anthem policy is on pages A62-63 of the league’s rulebook.
It states: 'The National Anthem must be played prior to every NFL game, and all players must be on the sideline for the National Anthem.
During the National Anthem, players on the field and bench area should stand at attention, face the flag, hold helmets in their left hand and refrain from talking.'","NFL owners were initially supportive and protective of their players, their brand assets on the field, as players kneeled down while the national anthem played. Some may argue players could have found a better venue to highlight the true challenges within the justice system without seeming to disrespect the flag, yet owners backed their right under the first amendment.

The owners and Roger Goodell did not expect the fiery fan blowback. Outraged conservatives perceived kneeling as an encroachment on the principles near and dear to not only them but a majority of Americans. Respecting country, respecting America’s lineage, the military and their families are collectively exemplified by the flag. But, owners are proving to be hypocrites by not being true to the value of social justice nor patriotism and instead have one focus: the dollar.

The NFL must have had some foresight into the importance of the national anthem and the related conduct displayed on the field before kickoff. NFL national anthem policy is on pages A62-63 of the league’s rulebook. It states: 'The National Anthem must be played prior to every NFL game, and all players must be on the sideline for the National Anthem. During the National Anthem, players on the field and bench area should stand at attention, face the flag, hold helmets in their left hand and refrain from talking.'

Because the NFL was bleeding cash on the field, the owners and Roger Goodell had to call an audible and scramble away from their players.

Ignoring their own league rules caused conservative organizations, pundits, media, and activists to call for an NFL boycott. Football fans and businesses rallied, burning jerseys and season tickets, canceling their Direct TV Football packages, not buying tickets, merchandise, and playing smash mouth themselves by turning the channel.

Due to the costly backlash, according to the Wall Street Journal, the National Football League’s owners will discuss next week whether to unilaterally change league policy and require players to stand during the national anthem. If players refuse to rise up, they could face disciplinary action by the league or by the team. The NFL may change the rules of conduct in direct response to their fans who are rejecting politics on the field and hitting them where it hurts them most—their Gucci wallets.

Because the NFL was bleeding cash on the field, the owners and Roger Goodell had to call an audible and scramble away from their players. Initially, they believed the politics of social justice was ""the right thing to do” on behalf of their players and to support the broader ideas the protests were about.

But, kneeling players proved to kill ticket and jersey sales and viewership -- and their positions are viewed by many fans as divisive and disrespectful -- negatively impacting the NFL brand and profits. So social justice and the fear of losing support of the players had to take a back seat.

It’s also clear this ""juke"" move by the NFL is not one based on patriotism, because the original position of the NFL, as written in their rulebook, was to respect America's anthem -- a principle they happily discarded until faced with lost money and ratings.

Conservative fans and media are claiming victory. Patriotism seems to sell and ultimately forced owners and Roger Goodell to expose the hypocrisy of their real motives and priorities -- which had nothing to do with the importance of supporting social justice, or even patriotism, but everything to do with profit.",The NFL and its owners salute one flag: The dollar,http://www.foxnews.com/opinion/2017/10/12/nfl-and-its-owners-salute-one-flag-dollar.html
79,"['hilton', 'steve', 'revolution']",,,The Next Revolution with Steve Hilton,https://www.foxnews.com/on-air/the-next-revolution-with-steve-hilton/index.html
80,"['prolife', '200', 'torn', 'padre', 'oct', 'quickly', 'pio', 'perera', 'taken', 'posters', 'catholic', 'university', 'society', 'nearly', 'upset']","By NATHAN RUBBELKE, THE COLLEGE FIXNearly 200 pro-life posters were taken down at a Catholic university by students who were reportedly upset the posters sought to highlight similarities between the issues of abortion and immigration.
The posters included the phrases “Don’t abort my fellow humans,” “#NoHumanBeingIsIllegal,” and “#AbortionIsAnImmigrationIssue.”The Padre Pio Society, a Catholic student group at Loyola Marymount University, had displayed scores of the anti-abortion posters across the Los Angeles campus earlier this month only to find them all removed less than two days later.
“I was pretty upset that the posters were taken down so quickly because we put up almost 200 posters and all of them were taken down so quickly,” senior Delano Perera, president of the Padre Pio Society, told The College Fix in an email.
Padre Pio Society members posted them around campus on the evening of Oct. 2.
They were completely gone by the morning of Oct. 4, according to Perera.","By NATHAN RUBBELKE, THE COLLEGE FIX



Nearly 200 pro-life posters were taken down at a Catholic university by students who were reportedly upset the posters sought to highlight similarities between the issues of abortion and immigration.

The posters included the phrases “Don’t abort my fellow humans,” “#NoHumanBeingIsIllegal,” and “#AbortionIsAnImmigrationIssue.”

The Padre Pio Society, a Catholic student group at Loyola Marymount University, had displayed scores of the anti-abortion posters across the Los Angeles campus earlier this month only to find them all removed less than two days later.

“I was pretty upset that the posters were taken down so quickly because we put up almost 200 posters and all of them were taken down so quickly,” senior Delano Perera, president of the Padre Pio Society, told The College Fix in an email.

Padre Pio Society members posted them around campus on the evening of Oct. 2. They were completely gone by the morning of Oct. 4, according to Perera.",Nearly 200 Pro-Life Posters Torn Down at Catholic University,http://nation.foxnews.com/2017/10/13/nearly-200-pro-life-posters-torn-down-catholic-university#commenting
81,"['online', 'channel', 'watch', 'business', 'fox', 'network']",,,Watch Fox News Channel and Fox Business Network Online,http://video.foxnews.com/v/1241186546001
82,"['power', 'samantha']",,,Who is Samantha Power?,http://video.foxnews.com/v/5608987015001/
83,"['mercedesbenz', 'works', 'car', 'cars', 'wheel', 'sclass', 'smart', 'drive', 'steering', '2018', 'road', 'system', 'youre', 'feature']","The Mercedes-Benz S-Class has always been a showcase for the brand’s latest technology, and the updated 2018 model is no different.
Intelligent Drive has pedestrian and bicyclist detection system and can autonomously brake for either that gets in front of the car if you don’t.
It also monitors the lines on the road and steers itself between them, even when your hands are off the steering wheel.
When engaged, this works on off ramps, twisty country roads and traffic circles, even if you’re manually steering.
The S-Class (which runs from $90,895 to well over $200,000) will actually make it less likely that you’ll encounter any of the latter.","The Mercedes-Benz S-Class has always been a showcase for the brand’s latest technology, and the updated 2018 model is no different.

Along with a bizarre Energizing Comfort feature that uses lights, scents, massaging seats and electronic music in an attempt to chill you out or revitalize you (seriously), the full-size sedan debuts the newest version of Mercedes-Benz’s Intelligent Drive collection of semi-autonomous driver aids.

Where to begin?

Intelligent Drive has pedestrian and bicyclist detection system and can autonomously brake for either that gets in front of the car if you don’t. It also monitors the lines on the road and steers itself between them, even when your hands are off the steering wheel. It will do that at both highway and around town speeds for up to a minute at a time before it asks you to check in by touching the wheel.

Tapping into both of those abilities, it can anticipate that you might want to swerve around a person you’re heading toward and helps you turn the steering wheel if you do. Mercedes actually developed the system to make an evasive maneuver like this all by itself, but tests showed that drivers caught off guard were instinctively grabbing the wheel and messing up the move. Humans have trust issues, apparently.

It can change lanes on the highway, however, but only if you ask it to. Just hit the turn signal stalk and it uses sensors to check the blind spot and 80 meters beyond for approaching traffic, then sidles over if the coast is clear. If it’s not, it will give the other cars 10 seconds to move out of the way before it gives up trying.

Regardless of what lane it’s in, the S-Class doesn’t wander around too much as it cruises along, but doesn’t stay locked in the center as well as Cadillac’s similar Super Cruise does. It also disengages too often for you to get completely comfortable relying on it, and that’s partially intentional. It’s marketed as a comfort feature that makes driving easier and safer, but isn’t supposed to do all the work. Especially since obeying stop signs and red lights is still up to you.

Speed limits are a different story. Using mapping data, Intelligent Drive knows if the cruise control is set too high for the road ahead and will automatically slow you down to an appropriate speed. When engaged, this works on off ramps, twisty country roads and traffic circles, even if you’re manually steering. You can go for miles at a variety of speeds without ever touching the gas or brake if you don’t need to stop for intersections, or any surprise obstacles in the road.

The S-Class (which runs from $90,895 to well over $200,000) will actually make it less likely that you’ll encounter any of the latter. It has a car-to-car communication system that networks all of the Mercedes vehicles in an area that are equipped with the feature so they can send each other warning messages about road conditions.

If you hit a patch of ice and the stability control engages, for instance, it will mark that spot and alert any other cars with the feature as they approach the location. You can even drop your own thumbtack on the map if you pass an accident, a tree blocking the road, or some other danger. It works similar to Waze, and there’s nothing stopping you from using it to note the position of certain black and white cars parked on the side of the road, too.

The communications are sent over a cellular network, not directly, so cars can’t give each other their precise location to help keep from running into each other, but that’s the long-term plan behind this concept and pretty much a necessity to fill the roads with fully-autonomous cars one day.

The S-Class isn’t one of those, but it’s getting closer.",The 2018 Mercedes-Benz S-Class is a very smart car,https://www.foxnews.com/auto/2017/10/12/2018-mercedes-benz-s-class-is-very-smart-car.html
