,KEYWORDS,SUMMARY,TEXT,TITLE,URL
145,"['expected', 'trump', 'iran', 'officials', 'pact', 'compliance', 'nuclear', 'deal', 'congress', 'president', 'speech', 'irans', 'certify']","The refusal to certify Iran’s compliance doesn’t mean the U.S. will pull out of the deal, the officials added, and Mr. Trump isn’t expected to ask Congress to re-impose economic sanctions that had been lifted as part of the agreement.
But it could send the White House down a road of trying to change a deal that U.S. allies still support.
Iran vowed a “crushing” response if the U.S. takes that step.
Officials said they had discussed the possibility of the speech taking place in front of the unoccupied Iranian Embassy in Washington, although that plan was set aside.
The president will speak in advance of a Sunday deadline to inform Congress about whether or not Iran is complying with the nuclear deal, under the terms of a U.S. law passed in 2015 meant to provide congressional oversight.","Decision doesn’t mean U.S. will withdraw from deal; president will also lay out broader Iran policy



By Felicia Schwartz, The Wall Street Journal



WASHINGTON — President Donald Trump is expected to announce on Friday that he won’t certify Iran is complying with the 2015 multinational nuclear agreement and will take Tehran to task more broadly for practices ranging from missile tests to support of violent groups, U.S. officials said.

The refusal to certify Iran’s compliance doesn’t mean the U.S. will pull out of the deal, the officials added, and Mr. Trump isn’t expected to ask Congress to re-impose economic sanctions that had been lifted as part of the agreement. But it could send the White House down a road of trying to change a deal that U.S. allies still support.

Mr. Trump, a longtime opponent of the accord negotiated under his predecessor’s administration, is expected to announce his decision in a speech in which he will also lay out plans to crack down on Iran’s missile program and its support for Hezbollah and other militant groups in the Middle East, the officials said.

Mr. Trump is also likely to designate the Islamic Revolutionary Guard Corps, Iran’s elite military branch, as a terrorist organization, a step that has been the subject of internal administration debates, according to people familiar with the deliberations.

Iran vowed a “crushing” response if the U.S. takes that step.

The venue for Mr. Trump’s remarks was the subject of debate as well. Officials said they had discussed the possibility of the speech taking place in front of the unoccupied Iranian Embassy in Washington, although that plan was set aside.

Mr. Trump’s speech will mark the end of a months-long Iran policy review by the administration and begin an uncertain process under which Congress has 60 days to consider on an expedited basis reinstating sanctions that had been lifted under the terms of the nuclear accord.

The president will speak in advance of a Sunday deadline to inform Congress about whether or not Iran is complying with the nuclear deal, under the terms of a U.S. law passed in 2015 meant to provide congressional oversight.",Trump Expected Not to Certify Iran Compliance With Nuclear Pact,http://nation.foxnews.com/2017/10/13/trump-expected-not-certify-iran-compliance-nuclear-pact
146,"['run', 'sen', 'washingtonher', 'republican', 'collins', 'woman', 'lepage', 'wont', 'gop', 'shes', 'maine', 'staying', 'governor', 'shed', 'weighing']","ROCKPORT, Maine -- Republican Susan Collins says she's staying out of the governor's race because she believes she can do more good for Maine by staying in the U.S. Senate.
The 64-year-old Collins has been weighing for months whether she'd make a bigger impact in the Senate or by launching a bid to become the first woman to serve as Maine's governor.
Collins is one of a handful of GOP centrists and decided she's needed in Washington.
Her decision Friday will likely free more gubernatorial candidates who have been waiting on the sidelines to enter the race.
Collins said previously that she'd like to heal the state and ""bring people back together.""","ROCKPORT, Maine -- Republican Susan Collins says she's staying out of the governor's race because she believes she can do more good for Maine by staying in the U.S. Senate.

The 64-year-old Collins has been weighing for months whether she'd make a bigger impact in the Senate or by launching a bid to become the first woman to serve as Maine's governor.

Collins is one of a handful of GOP centrists and decided she's needed in Washington.

Her decision Friday will likely free more gubernatorial candidates who have been waiting on the sidelines to enter the race.

Two-term Republican Gov. Paul LePage cannot run again because of term limits.

Like President Donald Trump, LePage has been a polarizing leader. Collins said previously that she'd like to heal the state and ""bring people back together.""",GOP US Sen. Collins won't run for Maine governor,https://www.foxnews.com/politics/2017/10/13/gop-us-sen-collins-wont-run-for-maine-governor.html
147,"['paul', 'car', 'alexis', 'retirement', 'dejoria', 'announces', 'professional', 'kalitta', 'funny', 'career', 'nhra', 'driver', 'super']","NHRA Funny Car driver Alexis DeJoria said she is retiring from the series at the end of this season to ""swtich my focus towards my family.""
The DeJoria was the first female driver to break the 4-second barrier in a Funny Car and has five event wins in her career.
DeJoria is the daughter of billionaire entrepreneur John Paul DeJoria, a co-founder of Paul Mitchell hair care products and The Patron Spirits Co. Alexis DeJoria married TV personality and renowned motorcycle fabricator Jesse James in 2013.
In her six-year pro career, DeJoria became the first woman to compete in 100 Funny Car events.
""I've accomplished great things throughout my NHRA career,"" she said.","NHRA Funny Car driver Alexis DeJoria said she is retiring from the series at the end of this season to ""swtich my focus towards my family.""

The DeJoria was the first female driver to break the 4-second barrier in a Funny Car and has five event wins in her career.

The 40-year-old said retirement was ""one of the hardest decisions I've ever had to make.""

DeJoria is the daughter of billionaire entrepreneur John Paul DeJoria, a co-founder of Paul Mitchell hair care products and The Patron Spirits Co. Alexis DeJoria married TV personality and renowned motorcycle fabricator Jesse James in 2013. She has a teenage daughter, Isabella, from a previous relationship.

DeJoria began her NHRA career in 2005, moving up the ranks in Super Gas, Super Comp and Top Alcohol Funny Car categories before making her professional debut in September 2011.

In her six-year pro career, DeJoria became the first woman to compete in 100 Funny Car events.

""I've accomplished great things throughout my NHRA career,"" she said. ""Working with Kalitta Motorsports and driving for Connie Kalitta has been an absolute honor. The man is a legend. He's been the best boss I could have ever hoped for as a professional nitro Funny Car pilot.""

DeJoria and her team have three races remaining in 2017, beginning at the Texas FallNationals this weekend.

The Associated Press contributed to this report",NHRA driver Alexis DeJoria announces retirement,https://www.foxnews.com/auto/2017/10/10/nhra-driver-alexis-dejoria-announces-retirement.html
148,"['iran', 'react', 'trumps', 'deal', 'nuclear', 'announcement']",,,How will Iran react to Trump's nuclear deal announcement?,http://video.foxnews.com/v/5608998515001/
149,"['title', 'yankees', 'york', 'win', 'kluber', 'season', 'game', 'astros', 'yanks', 'team', 'world', 'series', 'indians', 'beat', 'face', 'al']","With the win, the Yankees completed their comeback from a 2-0 deficit in the Division Series to dethrone the AL champions.
The AL West champion Astros, led by 5-foot-6 second-base dynamo and MVP candidate Jose Altuve, went 5-2 against the wild-card winners this season.
One win shy of a Series title last year, the Indians had only one goal in mind in 2017.
Everything was set up for the Indians: Kluber on the mound, Game 5 at home, sensational setup man Andrew Miller rested.
2 led the Yankees to a second straight World Series title.","Didi Gregorius, following in the October footprints left by Derek Jeter, homered twice off Corey Kluber as the New York Yankees beat the Cleveland Indians 5-2 in Game 5 on Wednesday night.

With the win, the Yankees completed their comeback from a 2-0 deficit in the Division Series to dethrone the AL champions.

These bend-but-don't-break Yankees staved off elimination for the fourth time in this postseason and advanced to play the Houston Astros in the AL Championship Series starting Friday at Minute Maid Park.

The AL West champion Astros, led by 5-foot-6 second-base dynamo and MVP candidate Jose Altuve, went 5-2 against the wild-card winners this season.

After winning twice in New York, the Yankees -- with little offensive help from rookie star Aaron Judge -- came into Progressive Field and finished off the Indians, who won 102 games during the regular season, ripped off a historic 22-game streak and were favored to get back to the World Series after losing in seven games a year ago to the Chicago Cubs.

Cleveland's Series drought turns 70 next year -- baseball's longest dry spell.

The Indians closed to 3-2 in the fifth against starter CC Sabathia before David Robertson pitched 2 2/3 hitless innings for the win. Yankees closer Aroldis Chapman, who faced Cleveland in last year's spine-tingling World Series and signed an $86 million free agent contract in December, worked two innings for the save.

Chapman went to the mound with a three-run lead in the ninth after Brett Gardner battled Cody Allen for 12 pitches before hitting an RBI single, with New York's fifth run scoring when Todd Frazier raced home on right fielder Jay Bruce's throwing error.

Gardner's gritty at-bat was symbolic of these Yankees. They wouldn't give in.

When Austin Jackson was called out on strikes to end it, the Yankees rushed to the mound to celebrate with a wide-eyed Chapman.

These baby Bronx Bombers became the 10th team to overcome a 2-0 deficit to win a best-of-five playoff series. New York also did it in 2001, rallying to beat Oakland -- a series remembered for Jeter's backhand flip to home plate.

Gregorius, who took over at shortstop following Jeter's retirement after the 2014 season, hit a solo homer in the first off Kluber and added a two-run shot in the third off Cleveland's ace, who didn't look like himself during either start in this series.

One win shy of a Series title last year, the Indians had only one goal in mind in 2017.

They came up short again, and have now lost six consecutive games with a chance to clinch a postseason series dating to last year's World Series, when they squandered a 3-1 lead to the Chicago Cubs.

Cleveland is the first team in history to blow a two-game series lead in consecutive postseasons.

Everything was set up for the Indians: Kluber on the mound, Game 5 at home, sensational setup man Andrew Miller rested.

The Yankees, though, wouldn't be denied. They battled back from a 3-0 deficit in the first inning of their wild-card game against Minnesota and then had to overcome a crushing loss in Game 2, when manager Joe Girardi's decision not to challenge a hit batter, drew heavy criticism and possibly cost New York during in a 9-8 loss in 13 innings.

But these young Yankees, who are ahead of schedule to be contenders, displayed pinstriped pride.

""This team has never stopped fighting and never stopped believing,"" Girardi said before Game 5. ""That's the mark of a very good team. They know how to persevere and continue to grind out everything, whether it's an at-bat or it's on the other side, you're facing a batter, how you grind it out.""

The Yankees did it without much help from Judge, who struck out four times in Game 5, and went 1 for 20 (.050) in the series with 16 strikeouts.

But the 6-foot-7 rookie might have saved New York's season in Game 3, when he reached above the right-field wall to rob Francisco Lindor of a two-run homer in a 1-0 win.

Kluber was one of baseball's most consistent pitchers all season, winning 18 games and leading the AL with a 2.25 ERA. He's a favorite to win his second Cy Young Award.

However, October has been cruel to the right-hander. He allowed nine runs, including four homers, over 6 1/3 innings in two postseason starts, hardly what he or the Indians expected.

Gregorius came in batting just .077 (1 for 13) in the series and only .133 (2 of 15) in his career against Kluber before tagging the right-hander for two homers in the first three innings.

The 27-year-old with the easy smile and sweet swing gave the Yankees a 3-0 lead in the third, pulling an 0-1 pitch into the lower deck in right. Gregorius set a franchise record for home runs in a season by a shortstop with 25, one more than Jeter hit in 1999 when No. 2 led the Yankees to a second straight World Series title.



Just as in Game 2, Kluber didn't get out of the first unscathed.



Gregorius got New York off to an ideal start, homering with two outs in the first when Kluber grooved a fastball. The shot deep into the seats in right raised the anxiety level to an already jittery Cleveland crowd fearing the worst.

A few hours later, those fears were realized.","Yanks beat Indians, will face Astros for AL title",https://www.foxnews.com/sports/2017/10/12/yanks-beat-indians-will-face-astros-for-al-title.html
150,"['better', 'john', 'rips', 'misreporting', 'kelly', 'medias', 'develop', 'sources']",,,John Kelly Rips Media's Misreporting: 'Develop Some Better Sources',http://insider.foxnews.com/2017/10/12/white-house-chief-staff-john-kelly-press-develop-some-better-sources
151,"['primaries', 'reform', 'pass', 'republican', 'trump', 'voters', 'virtually', 'washington', 'tax', 'gop', 'growing', 'american', 'needs', 'united', 'congress', 'face']","By David N. Bossie, Fox NewsThe American people are frustrated and rightly so.
Tens of millions of Americans came together and elected the ultimate political outsider Donald Trump president of the United States in 2016.
This was a continuation of the message sent by voters in 2010 and again in 2014 that Washington, D.C., is broken.
Now nine months into the reform-minded Trump administration, that feeling of frustration is palpable and growing with each day.
It’s growing because Republican leaders in Congress can’t seem to get their act together to keep their promises to the American people and pass the president’s conservative reform agenda.","By David N. Bossie, Fox News

The American people are frustrated and rightly so. Tens of millions of Americans came together and elected the ultimate political outsider Donald Trump president of the United States in 2016. This was a continuation of the message sent by voters in 2010 and again in 2014 that Washington, D.C., is broken.

Now nine months into the reform-minded Trump administration, that feeling of frustration is palpable and growing with each day. It’s growing because Republican leaders in Congress can’t seem to get their act together to keep their promises to the American people and pass the president’s conservative reform agenda. The Republican majority is Congress is not enormous but it’s large enough to pass the big ticket items that virtually every member of the House and Senate caucuses has supported and campaigned on over the years.",The GOP Congress Needs To Pass Tax Reform -- Or Face Primaries. Voters Have Had Enough,http://nation.foxnews.com/2017/10/13/gop-congress-needs-pass-tax-reform-or-face-primaries-voters-have-had-enough
152,"['uplifting', 'stood', 'king', 'late', 'capital', 'thai', 'bhumibol', 'elephants', 'death', 'white', 'ancient', 'royal', 'trumpeted', 'tribute', 'thailands']","nextprevEleven Thai elephants, doused in powder to appear an auspicious white, stood at attention and trumpeted grandly at a ceremony Friday in Thailand's ancient royal capital, Ayutthaya, marking one year since King Bhumibol Adulyadej's death.
Mourners clad in black stood in front of the elephants and fell silent for 89 seconds from 3:52 p.m., the official time of Bhumibol's death in what Thailand's Buddhist culture recognized as his 89th year.
Then they sang an uplifting royal anthem and held pictures of Bhumibol above their heads while others prostrated on the ground.","next

prev

Eleven Thai elephants, doused in powder to appear an auspicious white, stood at attention and trumpeted grandly at a ceremony Friday in Thailand's ancient royal capital, Ayutthaya, marking one year since King Bhumibol Adulyadej's death. Mourners clad in black stood in front of the elephants and fell silent for 89 seconds from 3:52 p.m., the official time of Bhumibol's death in what Thailand's Buddhist culture recognized as his 89th year. Then they sang an uplifting royal anthem and held pictures of Bhumibol above their heads while others prostrated on the ground.",Thai elephants in tribute to late king at ancient capital,https://www.foxnews.com/world/2017/10/13/thai-elephants-in-tribute-to-late-king-at-ancient-capital.html
153,"['talked', 'women', 'weinstein', 'quiet', 'didnt', 'hollywood', 'harvey', 'theyre', 'happen', 'fonda', 'jane', 'world', 'kept', 'powerful', 'knew']","Hollywood veteran Jane Fonda has revealed she learned of the allegations against mogul Harvey Weinstein a year ago — but said nothing.
Fonda, 79, made the admission in an interview on BBC World News HARDtalk, saying that she chose to keep quiet because “it didn’t happen to me”.
Asked by why there had been industry silence for so long about the shocking allegations of sexual harassment — many of which date back decades — Fonda explained.
“Well, it didn’t happen to me …” she said.
It’s very, very common, just as it is in every country of the world, in every aspect ... in business, in government.","Hollywood veteran Jane Fonda has revealed she learned of the allegations against mogul Harvey Weinstein a year ago — but said nothing.

Fonda, 79, made the admission in an interview on BBC World News HARDtalk, saying that she chose to keep quiet because “it didn’t happen to me”.

Asked by why there had been industry silence for so long about the shocking allegations of sexual harassment — many of which date back decades — Fonda explained.

“Why don’t they talk about it? Because he’s powerful. Because they’re scared … I mean, who are the women that he preyed on and preys on? Young women — most of these women were in their twenties when it happened. Vulnerable. Afraid that if they say anything or do anything that it’ll ruin their career. And I found out about him about a year ago and I wish that I had spoken out …”

BBC World News presenter Stephen Sackur asked Fonda why she chose not to speak out.

“Well, it didn’t happen to me …” she said.

“I didn’t want to expose and I will admit that I should have been braver. And I think from now on I will be when I hear such stories,” she continued.

“Thank God it’s being talked about. This is hardly unique in Hollywood. It’s very, very common, just as it is in every country of the world, in every aspect ... in business, in government. It’s the entitlement of too many men and it is epidemic. And when they’re famous and powerful like Harvey, then it gets talked about and so it’s really important that those women have been brave enough to come out.”

Click here for more on this story from News.com.au",Jane Fonda: I knew about Harvey Weinstein and kept quiet,http://www.foxnews.com/entertainment/2017/10/13/jane-fonda-knew-about-harvey-weinstein-and-kept-quiet.html
154,"['nasal', 'doctor', 'sniffles', 'infection', 'signs', 'cavities', 'cause', 'treatment', 'cold', 'symptoms', 'common', 'sinus']","At the core, a sinus infection is an inflammation of the sinus cavities.
Because they’re in such distinct locations, you can pinpoint a sinus infection with high accuracy if you have symptoms around these areas.
10 Signs of a Sinus InfectionAlthough a sinus infection may have some similar symptoms to the common cold, a few signs will give away the true culprit.
Pressure in any of the sinus locations mentioned aboveThough not always, you may feel pain in the sinus cavities since they are directly affected.
EaracheFluid may get trapped in your ear with a sinus infection, resulting in an ear infection as well.","Suffering through sniffles and a sore throat? While you might blame the detested common cold for your troubles, your symptoms may actually line up more with a sinus infection, or sinusitis.

A cold and a sinus infection can look quite similar with their sore throats and post-nasal drip. However, since nearly 30 million people get chronic sinusitis every year, it’s a good possibility you could have it too. If you do discover that you have a sinus infection, you may be able to get targeted treatment that your body needs.

What Causes Sinusitis?

At the core, a sinus infection is an inflammation of the sinus cavities. You have four of these in specific areas, including on your forehead, behind your cheeks, between your eyes and near the bridge of your nose (ethmoids). Because they’re in such distinct locations, you can pinpoint a sinus infection with high accuracy if you have symptoms around these areas.

So why do sinus infections happen? They occur for a number of reasons, and the cause isn’t always obvious. First of all, the tissue lining of the nasal cavities might be inflamed or blocked due to allergies, a common cold, bacteria or irritants like nasal sprays or cigarette smoke.

DO YOU REALLY NEED THESE VITAMIN SUPPLEMENTS?

Also, chronic dryness of mucous membranes can lead to an infection. You might experience this dryness because of dehydration, medications or a lack of humidity in the surrounding air.

In rare cases, the infection may be the result of fungus. These cases require immediate medical attention because the fungus can grow and cut off blood circulation.

10 Signs of a Sinus Infection

Although a sinus infection may have some similar symptoms to the common cold, a few signs will give away the true culprit.

1. Facial tenderness

The blockage or inflammation may cause a general aching in your face.

2. Pressure in any of the sinus locations mentioned above

Though not always, you may feel pain in the sinus cavities since they are directly affected.

3. Congestion

Most cases of sinusitis will have some blockage, altering your smell, taste or voice.

4. Earache

Fluid may get trapped in your ear with a sinus infection, resulting in an ear infection as well.

STUDENT DIAGNOSED WITH MASSIVE TUMOR AFTER TEACHER RECOMMENDS EYE TEST

5. Sinus headache

Similar to the facial tenderness, congestion and inflammation may cause an overall ache in the sinus cavities of your forehead.

6. No response to over-the-counter nasal medications

Here, you may have a bacterial sinus infection.

7. Puffy eyes

Inflamed sinuses in this area may cause the blood vessels surrounding your eyes to swell.

8. Thick, discolored mucus

Discolored mucus suggests that the body is trying to fight off infection.

9. Bad breath

When foul-smelling infected mucus starts dripping down the back of the throat (post-nasal drip), you may notice a smell to your breath too.

10. Sore Throat

Post-nasal drip and coughing may cause irritation to the back of the throat.

Treating Sinusitis

Most of the time, acute sinus infections can be effectively treated at home.

Home treatment includes

using a steam vaporizer or inhaler

clearing out passages with a nasal rinse

taking OTC decongestants

applying a warm compress

getting plenty of fluids

getting rest

If the symptoms last for longer than 1-1 ½ weeks, you should seek out treatment from a doctor. At that point, your treatment will vary based on the type of infection you have.

10 SYMPTOMS OF GALLBLADDER PROBLEMS

Antibiotics

For instance, a bacterial sinus infection will need an antibiotic to help your body fight it off. Again, your doctor may suspect a bacterial infection if you have bad breath or if the infection doesn’t respond to other treatments.

Steroids

Sometimes, a doctor may prescribe nasal or oral steroids. These help to reduce the swelling in the sinuses.

Allergy medications

If allergies are irritating your sinuses, you may simply need the proper allergy medications to get rid of the problem. In chronic cases where you don’t know the cause, you might consider undergoing allergy testing.

Surgery

A less common treatment method is surgery. Your doctor will usually recommend it if you have severe, chronic sinusitis that won’t go away or if you get sinusitis multiple times per year. During surgery, the doctor will actually enlarge your sinus cavities to encourage proper drainage.

Because of many similar signs to each other, sinus infections can sometimes mask themselves as a common cold. In some cases, the infection may have even started as a cold and worsened. To tell the two apart, try comparing what you’re experiencing with the 10 common symptoms listed above. Then, if your symptoms are persistent, you can better hone in on and describe your infection’s symptoms to your doctor.

This article first appeared on AskDrManny.com.",10 signs that your sniffles are a sinus infection,https://www.foxnews.com/health/2017/10/12/10-signs-that-your-sniffles-are-sinus-infection.html
