,KEYWORDS,SUMMARY,TEXT,TITLE,URL
132,"['wall', 'congress', 'build', 'daughter', 'illegal', 'mom', 'immigrant', 'president', 'work', 'killed']",,,Mom Whose Daughter Was Killed by Illegal Immigrant: Congress and President Must Work Together to Build the Wall,http://insider.foxnews.com/2017/10/08/mom-whose-daughter-killed-illegal-immigrant-congress-and-president-must-work-together
133,"['vegas', 'continue', 'las', 'left', 'politicize', 'shameful', 'massacre', 'hannity']",,,Hannity: 'Beyond Shameful' for Left to Continue to Politicize Las Vegas Massacre,http://insider.foxnews.com/2017/10/06/sean-hannity-lessons-las-vegas-massacre-needs-america-come-together
134,"['lahren', 'celebs', 'im', 'looking', 'tomi', 'owners', 'sick', 'gun', 'elitists']",,,"Tomi Lahren: I'm So Sick of Celebs, Elitists Looking Down on Gun Owners",http://insider.foxnews.com/2017/10/06/tomi-lahrens-final-thoughts-gun-control-push-after-las-vegas-shooting
135,"['wall', 'life', 'office', 'add', 'room', 'better', 'craft', 'spare', 'bedroom', 'space', 'extra', 'dedicated', 'small']","I love the idea of transforming an extra bedroom into a beautiful walk-in closet and dressing room.
If you are someone who enjoys scrapbooking, jewelry making, sewing or similar hobbies, a dedicated craft room may be exactly what you crave.
Outfit a small extra bedroom with exercise equipment and a wall-mounted television.
Also, large wall mirrors not only make a small bedroom appear larger but can help you ensure correct form and prevent injuries.
With an available bedroom, a quiet dedicated space for yoga or pilates may be an attainable luxury.","next

prev next

prev

Excess space is a luxury that most of us do not enjoy while our kids are living at home. But many of my clients find that once their grown children have moved out of the house and established their own households, they suddenly have extra unused spaces. At some point, those childhood bedrooms get cleaned out and stand waiting for a fresh coat of paint and a new purpose.

If you’re lucky enough to have extra square footage in your nest, here are eight ideas for turning that space into something fit for your current lifestyle.

1. A walk-in closet and dressing room. I love the idea of transforming an extra bedroom into a beautiful walk-in closet and dressing room. Several of my clients have done this, gaining both functionality and luxury. One client was even able to connect her new dressing room to her master bath — a nice perk if your floor plan allows. Many companies specialize in custom cabinetry and closets and can help you add this extra bit of comfort to your home.

2. A home office. Some people telecommute, others finish work projects or emails after hours at home, while still others simply enjoy having a dedicated home office for paying bills and taking care of other personal business. An extra bedroom is a perfect option for a home office because the door can be closed for solitude and focus or to hide clutter. You might line closets in the room with custom shelving and cabinets. Or, if this level of construction is not in your budget, you might purchase some beautiful storage solutions at furniture stores that can help you create a good-looking and organized home office.

3. A guest bedroom. Perhaps your adult children live out of town and stay for several nights when they visit. Or maybe other friends or family members often bunk in your home. A dedicated guest room might be just what you need. To make this a relatively inexpensive project, you might repurpose some furniture from a child’s former bedroom. A fresh coat of paint, new bedding, and updated accessories may be all you need to complete its new look.

4. A craft room. If you are someone who enjoys scrapbooking, jewelry making, sewing or similar hobbies, a dedicated craft room may be exactly what you crave. Frequently, craft projects span days or even weeks, and putting supplies away in the middle of a project can be cumbersome. Even if your funds do not allow for built-ins, a large table and wall shelving can work wonders for storing and organizing craft materials.

5. A reading nook. Maybe you have been longing for a quiet, comfortable place to relax with a good book — a small spare bedroom easily could be outfitted for this purpose. You may be able to relocate a comfortable chair from elsewhere in your home. Add a good reading lamp and a small book shelf and, if you want to go further, paint the walls a new color and add accessories, artwork and throw pillows. A cozy blanket in a bright color is another inexpensive way to add style to your reading spot.

6. An exercise gym. Outfit a small extra bedroom with exercise equipment and a wall-mounted television. Watching your favorite show while working out can make the time much more pleasant — I’m speaking from experience here. Also, large wall mirrors not only make a small bedroom appear larger but can help you ensure correct form and prevent injuries.

7. A yoga or pilates studio. With an available bedroom, a quiet dedicated space for yoga or pilates may be an attainable luxury. If your space and budget allow, enhancing a new studio by adding sliding doors out to a private garden is a wonderful way to create a special place with plenty of light and fresh air. A bubbling fountain augments the mood. Painting the walls a cool, calming color such as blue or gray can also boost the tranquility.

8. A multifunctional space. If you have only one spare bedroom but a variety of needs, a Murphy bed or wall bed may be the solution for you. Multiple companies specialize in beds that fold effortlessly into an attractive wall cabinet when not needed. That way, you can use your spare room as a home office, craft space or exercise studio without a bed taking up floor space — at least not until just before your visiting children arrive.",How to make use and better your life with a spare bedroom,https://www.foxnews.com/real-estate/2017/09/28/how-to-make-use-and-better-your-life-with-spare-bedroom.html
136,"['went', 'beacham', 'finds', 'throat', 'reflux', 'woman', 'cough', 'kamean', 'traveling', 'youre', 'relief', 'developing', 'mystery', 'know', 'asthma']","Desperate, Beacham went online and found DeKalb gastroenterologist Dr. Jeffrie Kamean and his partners, who immediately suspected Beacham's problem wasn't asthma.
""I said 'How do you know I'm not an asthma patient, how do you know that,'"" Beacham said.
""And he said, 'I just know, that is not an asthma cough.'""
Kamean said if you have an unexplained cough, see a lung doctor and an ear, nose and throat specialist first.
""There is still a debate in our field as to how much reflux really causes cough and sinus issues,"" Kamean said.","At 72, Jane Beacham loves to travel, and she's serious about it.

""The kind of traveling I like to do is to hop off the airplane with the plugs still in my ears and hit the ground moving,"" Beacham said.

But more than a decade ago, Beacham began coughing and clearing her throat, constantly.

""It was embarrassing,"" she said.

A lung doctor listened to her symptoms and diagnosed her with asthma, prescribing a series of medications.

""I bet I went through 7 or 8 different types of inhalers,"" Beacham remembered.

HOW HOCKEY FANS' HEARTS REACT TO STRESSFUL MOMENTS IN THE GAME

But nothing helped; the cough continued.

""I was just getting out of breath, getting out of the air,” she said.

Desperate, Beacham went online and found DeKalb gastroenterologist Dr. Jeffrie Kamean and his partners, who immediately suspected Beacham's problem wasn't asthma.

""I said 'How do you know I'm not an asthma patient, how do you know that,'"" Beacham said. ""And he said, 'I just know, that is not an asthma cough.'""

After extensive testing, Beacham was diagnosed with ""silent reflux."" She didn't have heartburn.

But during sleep, acid would leak from her stomach, up through her esophagus, pooling in the back of her throat. Kamean said that caused the irritation triggering her cough.

""So the idea is that it's at night,"" Kamean said. ""It's real reflux, but it's 'silent' because you're 'sleeping.'""

Put on on an acid-reducing medication, Beacham stopped coughing.

REGIS PHILBIN OPENS UP ON HEART ISSUES, CHOLESTEROL HEALTH

""And when she came back in two months, she said it was a miracle,"" Kamean said. ""Her cough was gone, she was sleeping, she was ready to travel.""

Earlier this year, Beacham underwent the LINX procedure, to stop the reflux.

Kamean said if you have an unexplained cough, see a lung doctor and an ear, nose and throat specialist first. Then, if you're still coughing, find a gastroenterologist willing to look deeper.

""There is still a debate in our field as to how much reflux really causes cough and sinus issues,"" Kamean said. ""We are firm believers here at DeKalb that that is true. We've had a lot of successful surgeries here correcting reflux, and medication as well.""

These days, Beacham is traveling again.

""I just got back from France,"" she said. ""Had a great trip. Do it again in a minute. Waiting for the next one!""

This article first appeared on Fox 5 Atlanta.",Woman finds relief 10 years after developing 'mystery' cough,https://www.foxnews.com/health/2017/10/06/woman-finds-relief-10-years-after-developing-mystery-cough.html
137,"['husband', 'sentence', 'twoyear', 'widow', 'illegal', 'immigrant', 'slams', 'children', 'killed']",,,"Widow Slams Two-Year Sentence For Illegal Immigrant Who Killed Husband, Two Children",http://insider.foxnews.com/2017/10/07/widow-slams-two-year-sentence-illegal-immigrant-who-killed-husband-two-children
138,"['way', 'tech', 'prescription', 'prices', 'qa', 'oreo', 'used', 'click', 'old', 'comparing', 'tapes', 'android', 'youre', 'scan', 'phone', 'ways', 'vhs', 'transferring']","Click here for the easiest way to scan your old photos.
Converting VHS tapesQ: My son is getting married, and I’d like to make a video using his childhood VHS tapes.
A: If you have a massive library of VHS tapes, you can buy a converter.
Android Oreo vs. iOS 11Q: How does the new Android operating system compare with Apple iOS 11?
Second, buying a used phone can be a security risk, especially if the vendor is crooked and has installed spyware.","Preserving old photos

Q: I have a bunch of old photos from my mother’s estate. What’s the easiest way to scan them?

A: Mounds of old photos are still gathered in shoeboxes, and if we don't digitize them soon, we risk losing those images. There are plenty of services that can scan the images for you professionally, and, of course, you can always photograph these pictures with your phone. But there's still another way to archive these snapshots, and you'll be delighted to know that it's free. Click here for the easiest way to scan your old photos.

Converting VHS tapes

Q: My son is getting married, and I’d like to make a video using his childhood VHS tapes. Help! The wedding is in two months!

A: If you have a massive library of VHS tapes, you can buy a converter. But if you're looking to transfer a few tapes, the most cost-effective solution is to use a service. The process can be pricy; each DVD can hold up to two hours, so you want to make sure you're watching the length of your home movies. The good news is that this will probably be the cheapest investment of your son’s wedding, and you should have plenty of time to get the job done. Click here for three easy ways to modernize your old videotapes.

Cut prescription costs

Q: My prescription drug costs are so high. Do the websites that promise you lower costs deliver?

A: This is such a vital question, and it’s likely to become even more pressing in the coming years. One very effective way to save money is to compare the prices of individual medications at nearby pharmacies. That may seem daunting, but, luckily, there's an app (actually there are three) for that. Click here for three ways to save money on prescriptions.

Android Oreo vs. iOS 11

Q: How does the new Android operating system compare with Apple iOS 11? Are they just the same pig with different lipstick?

A: Wouldn't it be great if you could open two applications at the same time on your smartphone? Until now, this hasn't been very practical. But larger screens and increased reliance on our pocket-sized gadgets have made this kind of multitasking more attractive. For the most part, these two operating systems are very similar to each other, and each is very much in keeping with the traditions of its brand. But this new feature, known as “Picture-in-Picture,” is a pretty significant leap, and only one of these two operating systems has it. Can you guess which? Click here for a comparison of Android Oreo and iOS 11.

Buying used smartphones

Q: I’d like to save money and buy a used smartphone. I’m afraid of getting a bad phone. Any pointers?

A: You are wise to be cautious, and for two big reasons. First, there might be damage that isn’t obvious when you pick it up, or the software might not run as smoothly as you’d hoped. I have a friend who bought a used iPhone that worked great, except for a fuzzy camera lens that made it unusable for taking photos. Second, buying a used phone can be a security risk, especially if the vendor is crooked and has installed spyware. Certain phones are extremely susceptible to this, especially when they change hands. I recommend refurbished phones, which are usually less expensive and work great, but if you’re dead set on buying a secondhand phone, there are ways to avoid getting swindled.

Click here to learn how to buy a used smartphone.

What questions do you have? Call my national radio show and click here to find it on your local radio station. You can listen to the Kim Komando Show on your phone, tablet or computer. From buying advice to digital life issues, click here for my free podcasts.

Copyright 2017, WestStar Multimedia Entertainment. All rights reserved.

Learn about all the latest technology on the Kim Komando Show, the nation's largest weekend radio talk show. Kim takes calls and dispenses advice on today's digital lifestyle, from smartphones and tablets to online privacy and data hacks. For her daily tips, free newsletters and more, visit her website at Komando.com.","Tech Q&A: Android Oreo, transferring VHS tapes, comparing prescription prices and more",https://www.foxnews.com/tech/2017/10/08/tech-q-android-oreo-transferring-vhs-tapes-comparing-prescription-prices-and-more.html
139,"['image', 'customer', 'autism', 'extra', 'finish', 'salon', 'facebook', 'goes', 'client', 'feel', 'young', 'wyatt', 'post', 'mile', 'jacob', 'barber', 'lafrenière']","A Canadian barber is being praised as an “everyday hero” for doing whatever it takes to make his youngest customer feel comfortable during haircuts.
Wyatt has autism, and Lafrenière told CBC News that her little one is both hyposensitive and hypersensitive, so having his hair touched can feel unbearable.
TEEN'S CANCER KEEPS HIM FROM HOMECOMING, DATE BRINGS DANCE TO HIM''Usually hairdressers sort of panicked when they saw Wyatt arrive, so it was really exceptional to meet Mr. Jacob,'' Lafrenière said.
It has to stay quiet,'' he said, adding that he’ll spend over an hour to style their locks just right.
''Maybe it will open people's eyes that there are other ways to approach differences,” she said.","A Canadian barber is being praised as an “everyday hero” for doing whatever it takes to make his youngest customer feel comfortable during haircuts. On Sept. 24, Fauve Lafrenière posted a photo on Facebook of Franz Jacob lying down on the ground to finish a trim on her six-year-old son, Wyatt, in a post that has since gone viral.

Wyatt has autism, and Lafrenière told CBC News that her little one is both hyposensitive and hypersensitive, so having his hair touched can feel unbearable. According to Autisim Speaks, this is a common issue. When it’s time for a haircut, though, Jacob’s salon Authentischen Barbier in Quebec is their go-to.

TEEN'S CANCER KEEPS HIM FROM HOMECOMING, DATE BRINGS DANCE TO HIM

''Usually hairdressers sort of panicked when they saw Wyatt arrive, so it was really exceptional to meet Mr. Jacob,'' Lafrenière said. ''He welcomes him like his best friend. To see that he accepts these differences is just fantastic.”

Celebrating the second anniversary of the old-time, memorabilia-packed barber shop, Jacob knows just how to cater to his autistic clients. ""I lock the front door. It has to stay quiet,'' he said, adding that he’ll spend over an hour to style their locks just right. Furthermore, every customer has different needs.

A post shared by Authentischen Barbier (@authentischenbarbier) on Mar 25, 2017 at 5:34pm PDT

COUPLE 'LIGHTS UP SKY' FOR BABY GENDER REVEAL AFTER LOSING ONE OF THEIR TWINS

''I understood that with Wyatt I have to follow him around the salon with my tools to finish the cut,” he said. ''It's all part of customer service.''

FOLLOW US ON FACEBOOK FOR MORE FOX LIFESTYLE NEWS

In addition to the 350-plus likes and nearly 40 shares the image of Jacob and Wyatt won on Lafrenière’s Facebook post, she said she was thrilled to see the image also go viral on Imgur, an image sharing site, with over 850,000 views pouring in.

''Maybe it will open people's eyes that there are other ways to approach differences,” she said.",Barber goes the extra mile for young client with autism,https://www.foxnews.com/lifestyle/2017/10/07/barber-goes-extra-mile-for-young-client-with-autism.html
140,"['fox', 'customer', 'batur', 'quarter', 'facebook', 'pounder', 'mcdonalds', 'meat', 'australia', 'claims', 'customers', 'little', 'maggots']","A woman in New South Wales, Australia, is claiming she found a little something extra insider her double Quarter Pounder: a whole mess of maggots.
Eager to share her repulsion with other ""Maccas"" customers, Yasmine Batur posted footage of her meal to Facebook on Oct. 2.
In the video, Batur zooms in on the corners of her Quarter Pounder box, where there appeared to be a few small insects squirming around.
MCDONALD'S WORKER WAS SELLING 'HAPPY' MEALS WITH A SIDE OF COCAINE""Those little things you're seeing there are maggots,"" she said, before dissecting the burger and zooming in on the meat, which also appeared to contain maggots.
“We encourage the customer to get in contact with us so we can discuss further.”Likewise, Batur has not yet responded to Fox News’ request for comment.","A woman in New South Wales, Australia, is claiming she found a little something extra insider her double Quarter Pounder: a whole mess of maggots.

Eager to share her repulsion with other ""Maccas"" customers, Yasmine Batur posted footage of her meal to Facebook on Oct. 2. In the video, Batur zooms in on the corners of her Quarter Pounder box, where there appeared to be a few small insects squirming around.

MCDONALD'S WORKER WAS SELLING 'HAPPY' MEALS WITH A SIDE OF COCAINE

""Those little things you're seeing there are maggots,"" she said, before dissecting the burger and zooming in on the meat, which also appeared to contain maggots. ""They're in the meat patty,"" she added.

Batur said she was not only disgusted, but disappointed. “How dare they serve this to unsuspecting customers,” she wrote, explaining that her dining companion, Michael, had unfortunately finished his burger before the discovery was made, and was “violently vomiting.”

According to Daily Mail Australia, who first broke the news, McDonald's Australia has denied Batur’s claims and said the notion that the little critters came from their kitchens is absurd.

BURGER KING USES 'IT' AS PART OF ITS LONGEST MARKETING STUNT EVER

“It’s not possible for this to occur in our restaurants. Our food is cooked at incredibly high temperatures,” a spokesperson said. “We encourage the customer to get in contact with us so we can discuss further.”

Likewise, Batur has not yet responded to Fox News’ request for comment.

FOLLOW US ON FACEBOOK FOR MORE FOX LIFESTYLE NEWS",McDonald’s customer claims she found maggots in Quarter Pounder,https://www.foxnews.com/food-drink/2017/10/06/mcdonald-s-customer-claims-found-maggots-in-quarter-pounder.html
141,"['months', 'sentence', 'prosecutors', 'teen', 'weber', 'henrico', 'boy', 'romp', 'school', '31', 'pleads', 'teacher', 'guilty', 'sex', 'virginia', 'misdemeanor', 'student']","A former Virginia high school teacher pleaded guilty Friday to a misdemeanor charge related to her sexual relationship with a teenage boy.
Ashley Leigh Lewis Weber, 31, admitted to two counts of having consensual sex with a child who was at least 15 years old.
Each count carries a 12-month prison sentence, but the case judge suspended the sentence on one of the counts.
That summer, Weber took the boy to her parents' home in Henrico, where they had sex.
Judge Margaret Deglau ordered that Weber not be allowed to contact the boy and criticized the teacher for what she called ""victimization.""","A former Virginia high school teacher pleaded guilty Friday to a misdemeanor charge related to her sexual relationship with a teenage boy.

Ashley Leigh Lewis Weber, 31, admitted to two counts of having consensual sex with a child who was at least 15 years old. Each count carries a 12-month prison sentence, but the case judge suspended the sentence on one of the counts.

Weber also was initially charged with a felony count of using a communications device to proposition a minor. That charge was withdrawn by prosecutors in exchange for a guilty plea on the misdemeanor counts.

The Richmond Times-Dispatch reported that prosecutors ultimately expect Weber to serve about six months in jail.

Weber, a history teacher at Douglas S. Freeman in Henrico County, turned herself in on Aug. 1, two months after police were tipped off about the relationship.

Prosecutor Stacey Davenport said Weber met the student during the 2015-16 school year. That summer, Weber took the boy to her parents' home in Henrico, where they had sex. Davenport said the boy was 15 at the time of this first encounter.

Judge Margaret Deglau ordered that Weber not be allowed to contact the boy and criticized the teacher for what she called ""victimization.""

Click for more from Richmond.com.","Virginia teacher, 31, pleads guilty to sex romp with teen boy student",http://www.foxnews.com/us/2017/10/08/virginia-teacher-31-pleads-guilty-to-sex-romp-with-teen-boy-student.html
142,"['rights', 'published', 'strike', 'lightning', 'llc', 'material', 'world', 'reserved', 'redistributed', 'trade', 'network', 'minutes', 'rewritten', 'bolts', 'market', 'center']","©2017 FOX News Network, LLC.
All rights reserved.
This material may not be published, broadcast, rewritten, or redistributed.
All market data delayed 20 minutes.","©2017 FOX News Network, LLC. All rights reserved. This material may not be published, broadcast, rewritten, or redistributed. All market data delayed 20 minutes.",Lightning bolts strike One World Trade Center,http://www.foxnews.com/science/slideshow/2017/08/23/lightning-bolts-strike-one-world-trade-center.html
