,KEYWORDS,SUMMARY,TEXT,TITLE,URL
213,"['howard', 'revealed', 'stern', 'singer', 'thing', 'thats', 'tells', 'video', 'miley', 'told', 'cyrus', 'wrecking', 'music', 'interview']","Singer Miley Cyrus sat with Howard Stern Wednesday to promote her new album and revealed some secrets.
Cyrus told Stern that her birth name is Destiny Hope, but her father, singer Billy Ray Cyrus dubbed her Miley because she was “always smiling,” Cyrus said.
The “Malibu” singer told Stern she was booted from school for teaching her classmates what a French kiss was.
That's not why I liked it,"" Cyrus told Stern.
Cyrus concluded the interview with a shout out to her mother, Tish Cyrus, for keeping her grounded.","Singer Miley Cyrus sat with Howard Stern Wednesday to promote her new album and revealed some secrets.

Cyrus, 24, who just released her latest album “Younger Now,” spoke with Stern and dished about her boyfriend Liam Hemsworth, her infamous 2013 MTV Video Music Award performance and the “Wrecking Ball” music video, E! News reported.

However, Cyrus also revealed a few fun facts, including her real name and why she was kicked out of school.

Cyrus told Stern that her birth name is Destiny Hope, but her father, singer Billy Ray Cyrus dubbed her Miley because she was “always smiling,” Cyrus said.

Cyrus also said her father initially did not want her to audition for Disney’s “Hannah Montana” due to his experience in show business.

MILEY CYRUS BACKTRACKS ON VOW TO LEAVE AMERICA BECAUSE TRUMP WAS ELECTED

Cyrus also revealed she was a bit of a rebel when she was in school. The “Malibu” singer told Stern she was booted from school for teaching her classmates what a French kiss was.

The “Party in the U.S.A.” singer said she was not bothered by Hemsworth being surrounded by attractive actors but said she “keeps my little spies.”

Cyrus called her 2013 VMA performance “the best thing that’s ever happened to me in my life.”

""I didn't like it because I thought I had done something that was gonna make everyone talk about me. That's not why I liked it,"" Cyrus told Stern.

""The reason why that's the best thing that's ever happened to me in my life is that's when I realized my power.”

MILEY CYRUS REVEALS: ‘I FELT SEXUALIZED’

Cyrus acknowledged the “Wrecking Ball” video and claimed that it was “not going anywhere.”

""Swinging around naked in the middle of a bunch of rubble licking a sledge hammer—that's forever,"" Cyrus told Stern. ""That's not going anywhere.""

Cyrus spoke about her new music and noted that she stopped smoking marijuana and cigarettes to focus on her new record and wrote her hit song “Malibu” in the car.

Cyrus concluded the interview with a shout out to her mother, Tish Cyrus, for keeping her grounded.",Miley Cyrus tells all in interview with Howard Stern,http://www.foxnews.com/entertainment/2017/10/04/miley-cyrus-tells-all-in-interview-with-howard-stern.html
214,"['cheetos', 'way', 'n', 'frozen', 'item', 'hits', 'snack', 'burger', 'wait', 'grocery', 'yearround', 'mac', 'king', 'stores']","Yes, you read that headline correctly: The limited-edition Burger King Mac n’ Cheetos that you crave year-round can now be cooked in the comforts of your own home.
Windows down, Mac n’ Cheetos up.
In addition to the original Mac n’ Cheetos, there’s a new version of the product on shelves: Flamin’ Hot Mac n’ Cheetos.
So now you don’t have to drive all the way to Burger King during the limited release times to get your cheese-covered cheese snack fix.
The Burger King snack retailed for $2.69, and these boxes are available for a cool $4.98.","The frozen aisle at your local grocery store just got dangerously cheesy.

Yes, you read that headline correctly: The limited-edition Burger King Mac n’ Cheetos that you crave year-round can now be cooked in the comforts of your own home.

Windows down, Mac n’ Cheetos up. It’s summertime. A post shared by Burger King (@burgerking) on Jun 24, 2017 at 11:17am PDT

Frito-Lay announced that it’s releasing two versions of the ultimate crave-worthy snack to retailers around the United States. In addition to the original Mac n’ Cheetos, there’s a new version of the product on shelves: Flamin’ Hot Mac n’ Cheetos.

So now you don’t have to drive all the way to Burger King during the limited release times to get your cheese-covered cheese snack fix. You can just pop a box of Mac n’ Cheetos in any conventional or toaster oven, wait a few minutes, and live your cheesy life in pure bliss.

The snack continues its affordable pricing, too. The Burger King snack retailed for $2.69, and these boxes are available for a cool $4.98.

Sounds like a Frozen Food Hall of Fame candidate to us!

This article originally appeared on The Daily Meal.",Burger King item hits grocery stores,https://www.foxnews.com/food-drink/2017/10/07/burger-king-item-hits-grocery-stores.html
215,"['whats', 'game', 'hijacked', 'theyre', 'dont', 'hannity', 'controversy', 'left', 'players', 'limbaugh', 'think', 'owners', 'rush', 'anthem', 'nfl', 'protests']","Conservative talk radio host Rush Limbaugh weighed in Thursday on the ongoing furor over NFL players kneeling during ""The Star-Spangled Banner,"" telling Fox News' ""Hannity"" that ""the left has hijacked this game.""
Those comments were condemned by NFL owners and dozens of players took a knee prior to the weekend's games, which in turn brought a backlash from some fans.
On Thursday night, Limbaugh told Hannity that the league's owners ""have to be scared to death"" by the protests and their fallout.
I don’t think they understand what’s going on,"" the veteran radio host said.
""They think they’re relating to the majority of their fan base, they’re not!","Conservative talk radio host Rush Limbaugh weighed in Thursday on the ongoing furor over NFL players kneeling during ""The Star-Spangled Banner,"" telling Fox News' ""Hannity"" that ""the left has hijacked this game.""

Previously a devoted pro football fan, Limbaugh told Sean Hannity that he did not watch Sunday's slate of games after hearing of the planned protests by players and vowed ""I'm going to be playing golf on Sundays now.""

The act of taking a knee during the pregame playing of the national anthem was started by then-San Francisco 49ers quarterback Colin Kaepernick last year. Kaepernick said his action was a protest of racial inequality and police brutality.

President Trump brought the protests back into the national spotlight Friday when he asked the crowd at an Alabama rally, ""Wouldn't you love to see one of these NFL owners, when somebody disrespects our flag, to say 'get that son of a b---- off the field right now, out, he's fired?'""

Those comments were condemned by NFL owners and dozens of players took a knee prior to the weekend's games, which in turn brought a backlash from some fans.

On Thursday night, Limbaugh told Hannity that the league's owners ""have to be scared to death"" by the protests and their fallout.

""I don’t think they understand what’s happening to them. I don’t think they understand what’s going on,"" the veteran radio host said. ""They think they’re relating to the majority of their fan base, they’re not! They’re driving them away.

""And I hate it,"" Limbaugh continued. ""I don’t want the NFL to get smaller, I don’t want it to become insignificant, I don’t want it to be taken over by a bunch of wusses. I don’t want it to be taken over by left-wing social justice causes.

Addressing the player protesters, Limbaugh concluded, ""Use something besides the NFL sideline, use something besides the flag, use something besides something that people use to escape.""",Rush Limbaugh on NFL anthem controversy: 'The left has hijacked this game',https://www.foxnews.com/us/2017/09/28/rush-limbaugh-on-nfl-anthem-controversy-left-has-hijacked-this-game.html
216,"['program', 'amnesty', 'relatives', 'substantial', 'tripling', 'increase', 'taxpayers', 'illegal', 'population', 'expert', 'paul', 'cost', 'open', 'parents', 'washington', 'daca', 'million', 'billions', '14']","by Paul Bedard, Washington ExaminerAmnesty for 700,000 illegal immigrants in the DACA program would open the door for 1.4 million more of their parents and relatives to enter the U.S., tripling their population and adding substantial costs to taxpayers, according to an immigration expert.","by Paul Bedard, Washington Examiner

Amnesty for 700,000 illegal immigrants in the DACA program would open the door for 1.4 million more of their parents and relatives to enter the U.S., tripling their population and adding substantial costs to taxpayers, according to an immigration expert.","Expert: DACA Amnesty To Increase Illegal Population To 14 Million, Cost Billions",http://nation.foxnews.com/2017/10/05/expert-daca-amnesty-increase-illegal-population-14-million-cost-billions
217,"['shooter', 'info', 'las', 'vegas', 'girlfriend', 'revealed']",,,More info revealed on Las Vegas shooter and his girlfriend,https://video.foxnews.com/v/5601940104001/?playlist_id=2114913880001
218,"['10062017', 'hannity']",,,Hannity 10-06-2017,https://video.foxnews.com/v/5600942403001/?playlist_id=5556999982001
219,"['dinesh', 'protect', 'amendment', 'tyranny', 'dsouza', 'second']",,,Dinesh D'Souza: Second Amendment Is There to Protect Against Government Tyranny,http://insider.foxnews.com/2017/10/07/second-amendment-protects-against-government-tyranny-dinesh-dsouza
220,"['hate', 'death', 'las', 'vegas', 'tv', 'terror', 'shooting', 'kind', 'utter', 'protest', 'willingly', 'men', 'hope', 'weve', 'witnessed', 'shirt']","One shirtless guy in a cowboy hat had been splashed with blood, which prompted the reporter to ask if he had been injured.
Neither seemed to comprehend nor consider the paradox: the worst of men and the best of men … utter grace amidst utter evil.
Television networks have given airtime to those champions who scampered through gunfire in Las Vegas to help, just as they did to those who waded through floods and storm damage recently in Texas, Florida and Puerto Rico.
As I watched the news coverage in the hours after the carnage in Las Vegas, I couldn’t peel my eyes from the television.
Those in Las Vegas were exhibiting a new kind of protest, the kind everybody watching was uniting around: a protest against death, terrorism, evil and division.","Ironically, I was in bed last Sunday night reading a book about the challenges of America, when my 18-year-old daughter pushed open my bedroom door and blurted: “Have you heard what’s happening in Vegas? There’s a man with a machine gun who’s killing people at a concert!”

As I rushed to put on some clothes I caught myself whispering, “No, no, not another tragedy.”

I ran downstairs and flipped on the TV, where coverage had started only moments earlier. The first thing I saw was a reporter stopping wandering people and asking what they saw. Their zombie-like responses showed they were still in shock.

One shirtless guy in a cowboy hat had been splashed with blood, which prompted the reporter to ask if he had been injured. Unaware of the crimson stains, he semi-stuttered that the blood wasn’t his own but came from a victim he had helped to carry to safety.

Another guy who looked to be in his mid-20s, when asked where his shirt was, stumbled and stammered out the reply that he took off his shirt to cover the faces of the dead.

Neither seemed to comprehend nor consider the paradox: the worst of men and the best of men … utter grace amidst utter evil. I glanced at my daughter who just sat there clutching a pillow to her chest and cried.

Our nation has been repeatedly ravaged by numerous shootings of individuals, police officers and mass groups of people. On top of that, we are plagued with natural disasters, racial division, political upheaval and even nuclear missile threats from abroad.

We are a nation filled with unrest, a people who have been saturated by every tragedy as it has been plastered across our televisions, newspapers, internet and social media. We grieve for those brothers and sisters who suffer, we are repulsed and sickened by the depraved perpetrators, and we are inspired by the gallant saviors who courageously disregard their own safety at the expense of complete strangers.

Lights shine brightest on the darkest of nights and unknown heroes arise in the days of adversity.

Television networks have given airtime to those champions who scampered through gunfire in Las Vegas to help, just as they did to those who waded through floods and storm damage recently in Texas, Florida and Puerto Rico. But we long for more; we desire to be quenched from their personal wells that drip with honor and valor.

In those heroes who willingly trod at death’s door, we see what is good in America and a portrait of who we can and should be. It’s why, now more than ever, we need less blame, politicizing and villains. We need more exposure to the common people who epitomize courage in the midst of cowardice – those who give us hope when all hope seems to be lost.

As I watched the news coverage in the hours after the carnage in Las Vegas, I couldn’t peel my eyes from the television. By the time my TV screen went dark after 4 a.m., the details were slim but there was less focus on the murderer and more on his victims.

Those in Las Vegas were exhibiting a new kind of protest, the kind everybody watching was uniting around: a protest against death, terrorism, evil and division. They were physically, verbally and morally objecting to the mayhem that sought to instill fear, hate and darkness. Their resistance converted into shielding others from bullets, calming the wounded as they were in the throes of death and carrying victims to safety.

And let’s never forget our brave law enforcement officers – the lately vilified men and women in blue who didn’t hesitate or vacillate when called upon to apprehend a demonic madman who was mowing down the innocent.

The book of John in the Bible states that there is a type of love that is greater than any other: it is the kind that embraces death so that others might have life. It is the rare, unconventional love that is dispensed independent of merit, worth or obligation but is gifted willingly because it comes from the purest of place … self-sacrifice.

This example has been written about for over 2,000 years and contains our greatest hope and purpose for eternal peace, purpose and brotherhood.","Las Vegas shooting: America, we've witnessed a new kind of protest -- against death, terror and hate",https://www.foxnews.com/opinion/2017/10/07/las-vegas-shooting-america-weve-witnessed-new-kind-protest-against-death-terror-and-hate.html
221,"['2yearold', 'customer', 'chickfila', 'used', 'bathroom', 'say', 'witness', 'assault', '35', 'according', 'told', 'child', 'man', 'gray', 'great', 'sexual']","A Florida man was arrested Friday in the sexual assault of a 2-year-old in the bathroom of an Orlando-area Chick-fil-A after a customer said he witnessed the attack, according to police.
Orlando Police said David Gray, 35, faces charges of sexual battery of a child younger than 12, lewd or lascivious battery and molestation, child abuse and contributing to the delinquency of a minor.
“(The witness) stated he flushed the toilet on purpose to let the man hear him in the bathroom.
“I’ll [expletive] kill you,” Gray told the man, according to police.
The 35-year-old then left the bathroom, and the customer started yelling ""call the police, a child is being abused in the bathroom.""","A Florida man was arrested Friday in the sexual assault of a 2-year-old in the bathroom of an Orlando-area Chick-fil-A after a customer said he witnessed the attack, according to police.

Orlando Police said David Gray, 35, faces charges of sexual battery of a child younger than 12, lewd or lascivious battery and molestation, child abuse and contributing to the delinquency of a minor. He was denied bond when he appeared before a judge Saturday, FOX 35 reported.

A customer told police he was in the bathroom at the restaurant Friday morning when he noticed there was activity in one of the bathroom stalls, and caught a glimpse of the child’s reflection with Gray, according to a police report obtained by WFTV.

“(The witness) was not sure if the baby was bouncing or if they were having sex,” the report said. “(The witness) stated he flushed the toilet on purpose to let the man hear him in the bathroom. (The witness) stated, if he panics, then he must be doing something wrong.”

The customer then told he flushed the urinal and saw Gray panic when he realized someone else was in the bathroom with him.

Gray, who was in a motorized wheelchair at the time, quickly attempted to get dressed and then pulled out a stun gun to keep the customer from leaving the bathroom, the Orlando Sentinel reported.

“I’ll [expletive] kill you,” Gray told the man, according to police.

The 35-year-old then left the bathroom, and the customer started yelling ""call the police, a child is being abused in the bathroom.""

Police said Gray was working as a home day care provider for the family of the child, and was a frequent visitor to the restaurant

His former landlord Sebrina Bryant told FOX 35 Orlando Gray is the last person she'd suspect of doing such a vicious attack.

“He was just great,” Bryant said. “He was great with the kids, great with paying his rent on time. I never seen any signs.”","Chick-fil-A bathroom used in sexual assault of 2-year-old, police say",https://www.foxnews.com/us/2017/10/08/chick-fil-bathroom-used-in-sexual-assault-2-year-old-police-say.html
222,"['fox', 'channel', 'gianno', 'fnc', 'relations', 'analyst', 'press', 'signs', 'analysis', 'network', 'caldwell', 'strategic', '30', 'political']","NEW YORK – SEPTEMBER 25, 2017 – FOX News Channel (FNC) has signed Gianno Caldwell, the founder of Caldwell Strategic Consulting, as a political analyst, announced Suzanne Scott, president of programming for the network.
Prior to his career in government relations, Caldwell worked for the Social Security Administration as a senior legal analyst to the former Federal National Medicare Chief Judge.
Caldwell is the recipient of both the 2016 Porsche Power “30 under 30” and the Red Alert Politics “30 under 30” awards.
FOX News Channel (FNC) is a 24-hour all-encompassing news service dedicated to delivering breaking news as well as political and business news.
Owned by 21st Century Fox, FNC is available in more than 90 million homes and dominates the cable news landscape, routinely notching the top ten programs in the genre.","NEW YORK – SEPTEMBER 25, 2017 – FOX News Channel (FNC) has signed Gianno Caldwell, the founder of Caldwell Strategic Consulting, as a political analyst, announced Suzanne Scott, president of programming for the network. In this capacity, he will appear across FNC and FOX Business Network’s daytime and primetime programs, providing analysis and commentary on political, financial and cultural issues.

In making the announcement, Scott said, “Gianno’s insight has been widely valued across our network, prompting healthy discussion and debate on critical issues facing the country. We are delighted to have him officially join the FOX News Channel, sharing top-notch analysis with our viewers.”

Caldwell added, “I am excited, honored and humbled to bring my political analysis exclusively to the number one cable network in the nation. FOX News has felt like family since my first appearance on the network. I am thankful for God’s continued favor throughout this journey and I am thankful for the support of my family, colleagues, and friends.”

In conjunction to his contributor role with FOX News Channel, Caldwell serves as a special correspondent to Extra TV, covering red carpets in Hollywood and Washington, DC. He is also a contributor for The Hill newspaper.

As the founder of Caldwell Strategic Consulting (CSC), Caldwell has provided strategic advice in the areas of public affairs and government relations, where he has worked with clients at the congressional, federal, state and local levels.

Caldwell began his government relations career serving as the Director of Government Relations for Naperville Township, a local government agency in Illinois. In this position, he successfully lobbied the reduction of property tax rates for the whole of Naperville Township. From there, he went on to serve as a legislative liaison to the Illinois State Treasurer, which led him to an internship with Congressman John Shimkus, where he assisted with research and analysis of health, energy, and telecommunications legislation in Washington, D.C.

Prior to his career in government relations, Caldwell worked for the Social Security Administration as a senior legal analyst to the former Federal National Medicare Chief Judge. In 2011, he was the Director of African American Outreach for the DuPage County Republican party, and served as an advance staffer on Mitt Romney’s 2012 presidential campaign.

Caldwell is the recipient of both the 2016 Porsche Power “30 under 30” and the Red Alert Politics “30 under 30” awards. He is a Chicago native and graduated from Grand Canyon University with a Bachelor’s of Science degree in Psychology.

FOX News Channel (FNC) is a 24-hour all-encompassing news service dedicated to delivering breaking news as well as political and business news. The number one network in cable, FNC has been the most watched television news channel for more than 15 years and according to a Suffolk University/USA Today poll, is the most trusted television news source in the country. Owned by 21st Century Fox, FNC is available in more than 90 million homes and dominates the cable news landscape, routinely notching the top ten programs in the genre.

###

FOX News Media Contact:

Jaclyn Giuliano – 212.301.3436",FOX NEWS CHANNEL SIGNS GIANNO CALDWELL AS POLITICAL ANALYST – Fox News Channel Press,http://press.foxnews.com/2017/09/fox-news-channel-signs-gianno-caldwell-as-political-analyst/
