,KEYWORDS,SUMMARY,TEXT,TITLE,URL
250,"['carter', 'making', 'son', 'inside', 'singersongwriter', 'payne', 'sings', 'cash', 'wrote', 'music', 'episode', 'cabin', 'waylon', 'john']","Once considered the most famous baby in country music, the author, producer, and singer/songwriter John Carter Cash is still making music inside the famous cabin that his father built almost 50 years ago.
The son of June Carter and the legendary Johnny Cash, John Carter grew up during the height of his parents' careers, sharing the world's biggest stage from the moment he could walk.
In this episode, John Carter shares some insightful stories about his father's writing process, their life on the road and sings some of his favorite songs from both sides of his family.
Her son, singer/songwriter Waylon Payne also joins us in this episode to celebrate his Mama.
Waylon sings beautifully throughout and plays a powerful rendition of ""Mama Drive On,"" a song he wrote in his mother's honor.","Audio clip: Listen to audio clip.

Once considered the most famous baby in country music, the author, producer, and singer/songwriter John Carter Cash is still making music inside the famous cabin that his father built almost 50 years ago. The son of June Carter and the legendary Johnny Cash, John Carter grew up during the height of his parents' careers, sharing the world's biggest stage from the moment he could walk.

Subscribe and download on your favorite podcast platform: Apple Podcasts, Google Play, Tune In, Stitcher.

In this episode, John Carter shares some insightful stories about his father's writing process, their life on the road and sings some of his favorite songs from both sides of his family. He talks about growing up inside the Carter Cash legacy, admitting it might have been more difficult if his father hadn't been such a humble and generous man who wrote and recorded music till the day he died.

One of the artists that Johnny Cash championed was a talented girl from Oklahoma, named Sammi Smith. Her son, singer/songwriter Waylon Payne also joins us in this episode to celebrate his Mama.

Through the ups and downs, Waylon describes life as one of constant struggle, but also one of indelible perseverance. He speaks of his mother in reverent tones as someone who believed and constantly inspired him as he followed in her footsteps. Waylon sings beautifully throughout and plays a powerful rendition of ""Mama Drive On,"" a song he wrote in his mother's honor.

Robert K. Oermann hosts this special episode with the series producer, Brad Newman by his side.

Like us on Facebook. Follow us on Twitter and Instagram. We want to know what you think. Pitch us an artist, or simply spread the word and find out more about the series. #childrenofsong",John Carter Cash & Waylon Payne: Making Music Inside the Cash Cabin,https://radio.foxnews.com/2017/10/06/john-carter-cash-waylon-payne-making-music-inside-the-cash-cabin/
251,"['caldwell', 'relations', 'signs', 'press', 'gianno', 'fox', 'channel', 'analyst', 'network', 'analysis', 'strategic', 'fnc', '30', 'political']","NEW YORK – SEPTEMBER 25, 2017 – FOX News Channel (FNC) has signed Gianno Caldwell, the founder of Caldwell Strategic Consulting, as a political analyst, announced Suzanne Scott, president of programming for the network.
Prior to his career in government relations, Caldwell worked for the Social Security Administration as a senior legal analyst to the former Federal National Medicare Chief Judge.
Caldwell is the recipient of both the 2016 Porsche Power “30 under 30” and the Red Alert Politics “30 under 30” awards.
FOX News Channel (FNC) is a 24-hour all-encompassing news service dedicated to delivering breaking news as well as political and business news.
Owned by 21st Century Fox, FNC is available in more than 90 million homes and dominates the cable news landscape, routinely notching the top ten programs in the genre.","NEW YORK – SEPTEMBER 25, 2017 – FOX News Channel (FNC) has signed Gianno Caldwell, the founder of Caldwell Strategic Consulting, as a political analyst, announced Suzanne Scott, president of programming for the network. In this capacity, he will appear across FNC and FOX Business Network’s daytime and primetime programs, providing analysis and commentary on political, financial and cultural issues.

In making the announcement, Scott said, “Gianno’s insight has been widely valued across our network, prompting healthy discussion and debate on critical issues facing the country. We are delighted to have him officially join the FOX News Channel, sharing top-notch analysis with our viewers.”

Caldwell added, “I am excited, honored and humbled to bring my political analysis exclusively to the number one cable network in the nation. FOX News has felt like family since my first appearance on the network. I am thankful for God’s continued favor throughout this journey and I am thankful for the support of my family, colleagues, and friends.”

In conjunction to his contributor role with FOX News Channel, Caldwell serves as a special correspondent to Extra TV, covering red carpets in Hollywood and Washington, DC. He is also a contributor for The Hill newspaper.

As the founder of Caldwell Strategic Consulting (CSC), Caldwell has provided strategic advice in the areas of public affairs and government relations, where he has worked with clients at the congressional, federal, state and local levels.

Caldwell began his government relations career serving as the Director of Government Relations for Naperville Township, a local government agency in Illinois. In this position, he successfully lobbied the reduction of property tax rates for the whole of Naperville Township. From there, he went on to serve as a legislative liaison to the Illinois State Treasurer, which led him to an internship with Congressman John Shimkus, where he assisted with research and analysis of health, energy, and telecommunications legislation in Washington, D.C.

Prior to his career in government relations, Caldwell worked for the Social Security Administration as a senior legal analyst to the former Federal National Medicare Chief Judge. In 2011, he was the Director of African American Outreach for the DuPage County Republican party, and served as an advance staffer on Mitt Romney’s 2012 presidential campaign.

Caldwell is the recipient of both the 2016 Porsche Power “30 under 30” and the Red Alert Politics “30 under 30” awards. He is a Chicago native and graduated from Grand Canyon University with a Bachelor’s of Science degree in Psychology.

FOX News Channel (FNC) is a 24-hour all-encompassing news service dedicated to delivering breaking news as well as political and business news. The number one network in cable, FNC has been the most watched television news channel for more than 15 years and according to a Suffolk University/USA Today poll, is the most trusted television news source in the country. Owned by 21st Century Fox, FNC is available in more than 90 million homes and dominates the cable news landscape, routinely notching the top ten programs in the genre.

###

FOX News Media Contact:

Jaclyn Giuliano – 212.301.3436",FOX NEWS CHANNEL SIGNS GIANNO CALDWELL AS POLITICAL ANALYST – Fox News Channel Press,http://press.foxnews.com/2017/09/fox-news-channel-signs-gianno-caldwell-as-political-analyst/
252,"['trump', 'korea', 'kelly', 'going', 'north', 'cuts', 'plans', 'bring', 'growth', 'think', 'biggest', 'history', 'thats', 'tax', 'praises', 'taxes', 'president']","In an interview on “Sunday Morning Futures with Maria Bartiromo,” Trump talked about his plan to bring the “biggest [tax] cuts ever in the history of this country.”“I think we’re going to get our taxes,” Trump said in the two-part interview.
It’ll be the biggest cuts ever in the history of this country,” Trump added.
And that’s all coming up, believe me that’s going to be out there very soon.”“I want to get the taxes first.
“He is a man who felt this was important for the country.”Despite his past criticism on China’s lack of action against North Korea, Trump applauded Chinese President Xi Jinping and his actions against North Korea.
“And China's really helping us, and — well, also with respect to North Korea, 93 percent of things going into North Korea come through China.","President Trump detailed his historic tax cut plans, talked about his Twitter habits and praised Gen. John Kelly’s Thursday speech dismissing Florida Rep. Frederica Wilson’s suggestion that he was forced to make public statements to keep his job in an exclusive Fox News interview on Sunday.

In an interview on “Sunday Morning Futures with Maria Bartiromo,” Trump talked about his plan to bring the “biggest [tax] cuts ever in the history of this country.”

“I think we’re going to get our taxes,” Trump said in the two-part interview. I think it’s going to be — well, hopefully before the end of the year, but maybe much sooner than that.”

“So there’s a great spirit for it, people want to see it, and I call it tax cuts. It is tax reform also, but I call it tax cuts. It’ll be the biggest cuts ever in the history of this country,” Trump added.

Trump said he believes he has the votes for his historic plan to pass in Congress. He reiterated his plan to tackle taxes and health care to promote “tremendous growth” and address the debt and deficit in the U.S.

“Well, it’s going to be all growth. Look, it’s going to be growth. I think that growth can be staggering. I also think we have a lot of waste in this country. And we’ll be doing other things. We will be doing welfare reform. I mean that’s coming up,” the president said.

He added, “Okay, and whether people like it or not. You know people don’t like having a house and working three jobs and having somebody nearby where their living better than the person with the three jobs. It’s not fair. And that’s all coming up, believe me that’s going to be out there very soon.”

“I want to get the taxes first. I want to get health care. We’re doing a big infrastructure bill which will be a very positive thing. But we’re going to have tremendous growth,” Trump said.

When asked about the “bickering and feuding” with other Republican politicians, including Senators Bob Corker and John McCain, the president said it sometimes helps because “it gets people to do what they’re supposed to be doing.”

“I think, actually sometimes it helps. Sometimes it gets people to do what they’re supposed to be doing. And you know, that’s the way it is,” Trump told Fox News. “I just want what’s right. And I think, for the most part, they want what’s right too. So we’ll see what happens but I do believe we have the votes for health care at the appropriate time. And I think we’re going to have the votes for taxes and I will say the fact that healthcare is so difficult, I think, makes the taxes easier.”

The president also touched on Kelly’s Thursday appearance in the White House briefing room after Trump was criticized for his condolences to the widow of Sgt. La David Johnson, who was killed with three other U.S. soldiers in Niger on Oct. 4. Florida Democratic Rep. Frederica Wilson said Trump told Johnson’s widow that her deceased husband “knew what he signed up for.”

Trump said his chief of staff is “an elegant man.”

“[Kelly] was so offended, because he was in the room when I made the call and so were other people,” Trump said. “And the call was a very nice call. He was so offended that a woman would be — that somebody would be listening to that call.”

Trump dismissed Wilson’s claim that Kelly was forced to make public statements to keep his job.

“He didn't want this job,” Trump said, adding that Wilson's comment was ""sickening"" to him. “He is a man who felt this was important for the country.”

Despite his past criticism on China’s lack of action against North Korea, Trump applauded Chinese President Xi Jinping and his actions against North Korea. He called Xi a “good man” who has been helping the U.S. with the nuclear crisis.

“He's for China and I'm for the U.S., OK? So we start off with that, but we do have a very good — I would say an exceptional relationship,” Trump told Fox News. “And China's really helping us, and — well, also with respect to North Korea, 93 percent of things going into North Korea come through China. China is big stuff.”

Talking about his Twitter habits, Trump said he has a “tremendous platform” between Twitter, Instagram and Facebook. He defended his tweets, saying they are “well crafted” and he is being “treated very unfairly by the media.”

“See I don’t call it Tweets, Tweeting is like a typewriter — when I put it out, you put it immediately on your show,” Trump said.

“I was always good student, I am like a person that does well with that kind of thing. And I doubt I would be here if weren’t for social media, to be honest with you. Because there is a fake media out there, I get treated very unfairly by the media,” the president added.

He said, “So when somebody, says something about me, I am able to go bing, bing, bing and I take care of it. The other way, I would never be get the word out.”

The second part of the exclusive interview with Trump will air on Monday on ""Mornings With Maria"" on the Fox Business Network from 6 a.m. to 9 a.m.","Trump plans to bring 'biggest tax cuts ever' in US history, praises Kelly",http://www.foxnews.com/politics/2017/10/22/trump-plans-to-bring-biggest-tax-cuts-ever-in-us-history-praises-kelly.html
253,"['report', 'korea', 'north', 'states', 'south', 'threatened', 'strike', 'united', 'military', 'nuclear', 'threatens', 'york', 'exercises', 'waters', 'unimaginable']","By Mark Moore, New York PostNorth Korea threatened the United States with an “unimaginable” nuclear strike for conducting military exercises with South Korea in the waters off the Korean peninsula, according to a report on Thursday.","By Mark Moore, New York Post

North Korea threatened the United States with an “unimaginable” nuclear strike for conducting military exercises with South Korea in the waters off the Korean peninsula, according to a report on Thursday.",North Korea Threatens To Go Nuclear Over US Military Exercises,http://nation.foxnews.com/2017/10/20/north-korea-threatens-go-nuclear-over-us-military-exercises#commenting
254,"['perfectionist', 'making', 'cathy', 'buddy', 'rich', 'sinatra', 'drummer', 'series', 'life', 'episode', 'goodman', 'papa', 'played']","Buddy Rich was a relentless perfectionist whose life revolved around making great music and entertaining audiences everywhere.
Through the eyes of his daughter Cathy Rich, we learn about the many sides of her famous father, who could be demanding, but always fair.
Cathy has devoted her life to preserving Buddy Rich's legacy and she shares some telling stories about the man who she says played the drums like a Stradivarius.
Great insight in this episode from the trumpeter, Ross Konikoff who played with Buddy Rich and a fun story about the drummer and Benny Goodman from the guitarist/entertainer, John Pizzarelli.
Pitch us an artist, or simply spread the word and find out more about the series.","Audio clip: Listen to audio clip.

Buddy Rich was a relentless perfectionist whose life revolved around making great music and entertaining audiences everywhere. Arguably the greatest drummer that ever lived, this self-taught genius never practiced but instead, played with the likes of Frank Sinatra, Benny Goodman, Tommy Dorsey and Artie Shaw, always making these giants better.

Subscribe and download on your favorite podcast platform: Apple Podcasts, Google Play, Tune In, Stitcher.

Notorious for being brash and brutal to those who failed him, this episode reveals a loyal craftsman, who might have been an even better performer. With his lightning-quick wit and charismatic charm, he entertained kings and celebrities with the grace of Sinatra and the ease of Jerry Lewis, both of whom he counted as close friends.

Through the eyes of his daughter Cathy Rich, we learn about the many sides of her famous father, who could be demanding, but always fair. Cathy has devoted her life to preserving Buddy Rich's legacy and she shares some telling stories about the man who she says played the drums like a Stradivarius.

Great insight in this episode from the trumpeter, Ross Konikoff who played with Buddy Rich and a fun story about the drummer and Benny Goodman from the guitarist/entertainer, John Pizzarelli.

The series producer, Brad Newman hosts this episode, which takes a wonderful trip down memory lane.

Like us on Facebook. Follow us on Twitter and Instagram. We want to know what you think. Pitch us an artist, or simply spread the word and find out more about the series. #childrenofsong","Cathy Rich: My Perfectionist Papa, Buddy Rich",https://radio.foxnews.com/2017/10/02/cathy-rich-my-perfectionist-papa-buddy-rich/
255,"['washington', 'diagnosed', 'medical', 'simpson', 'attack', 'post', 'dog', 'told', 'beloved', 'woman', 'brokenheart', 'heart', 'loss', 'syndrome', 'texas']","The symptoms can mimic those of a heart attack and is also referred to as “broken-heart syndrome,” The Washington Post reported.
“The kids were grown and out of the house, so she was our little girl,” Simpson, 62, told The Washington Post.
“It was such a horrendous thing to have to witness,” Simpson told The Washington Post.
She was then airlifted to the Memorial Hermann Heart & Vascular Institute – Texas Medical Center, where doctors discovered her arteries were clear, indicating her illness was not a heart attack.
She was diagnosed with Takotsubo cardiomyopathy and released after two days, and continues to take two heart medications daily, The Washington Post reported.","Doctors were expecting to treat a Texas woman who was mourning the death of her beloved Yorkshire terrier for a possible heart attack, only to discover that her symptoms were actually due to a broken heart. Joanie Simpson, whose 2016 medical ordeal was detailed in the New England Journal of Medicine, was diagnosed with Takotsubo cardiomyopathy, a condition commonly associated with the loss of a spouse or child.

The symptoms can mimic those of a heart attack and is also referred to as “broken-heart syndrome,” The Washington Post reported. The condition is most common in women ages 58 to 75, and can cause weakening of the left ventricle, according to Harvard Medical School.

For Simpson, who at the time was stressed due to her son’s impending back surgery, her son-in-law’s unemployment and a property sale, it was the loss of the dog named Meha that sent her over the edge.

“The kids were grown and out of the house, so she was our little girl,” Simpson, 62, told The Washington Post.

FLORIDA NURSING HOME BILLS RESIDENT WHO DIED DURING HURRICANE IRMA

But when the dog was diagnosed with congenital heart failure, Simpson decided it was best to have her euthanized. She canceled the appointment when the dog seemed to bounce back to health, but Meha died the next day.

“It was such a horrendous thing to have to witness,” Simpson told The Washington Post. “When you’re already kind of upset about other things, it’s like a brick on a scale. I mean everything just weighs on you.”

Sometime after Meha’s death, Simpson woke with back pain that traveled to her chest and went to an emergency room near her Houston home. She was then airlifted to the Memorial Hermann Heart & Vascular Institute – Texas Medical Center, where doctors discovered her arteries were clear, indicating her illness was not a heart attack. She was diagnosed with Takotsubo cardiomyopathy and released after two days, and continues to take two heart medications daily, The Washington Post reported.

She said she was not surprised by the diagnosis after it was explained to her.

“It is heartbreaking. It is traumatic. It is all of the above,” Simpson said of owning a pet. “But you know what? They give so much love and companionship that I’ll do it again. I will continue to have pets. That’s not going to stop me.”",Woman diagnosed with 'broken-heart syndrome' after loss of beloved dog,https://www.foxnews.com/health/2017/10/20/woman-diagnosed-with-broken-heart-syndrome-after-loss-beloved-dog.html
256,"['trump', 'going', 'san', 'rate', 'wall', 'prototypes', 'town', 'tested', 'tallpresident', 'southern', 'diego', 'promised', 'theyre']","Micah Rate, Town HallThey're big.
They're beautiful.
And they're 30-feet tall.
President Trump promised a wall along our southern border, and he promised that prototypes would be designed and tested.","Micah Rate, Town Hall

They're big. They're beautiful. And they're 30-feet tall.

President Trump promised a wall along our southern border, and he promised that prototypes would be designed and tested.",The Wall Prototypes Are Going Up In San Diego,http://nation.foxnews.com/2017/10/20/wall-prototypes-are-going-san-diego
257,"['report', 'toback', 'meeting', 'director', 'masturbate', 'james', 'harassment', 'weinstein', 'times', 'sexual', '30', 'accused', 'women']","More than 30 women accused James Toback of sexual harassment, saying the director and writer preyed on young actresses for years and lured them into a meeting that would turn sexual and often end with him masturbating in front of them, a new bombshell report revealed on Sunday.
The women said Toback would tout his success in Hollywood and lured them into a meeting, interview or audition for a role.
But the encounters would quickly turn sexual as the director asks the women inappropriate questions such as, “How often do you masturbate?” the report stated.
Toback denied the allegations, telling the Los Angeles Times that he never met or has “no recollection” of meeting the women.
McGowan also tweeted about the allegations against Toback, saying: ""James Toback damn you for stealing, damn you for traumatizing.""","More than 30 women accused James Toback of sexual harassment, saying the director and writer preyed on young actresses for years and lured them into a meeting that would turn sexual and often end with him masturbating in front of them, a new bombshell report revealed on Sunday.

Toback, who directed “Black and White” and “Two Girls and a Guy” and was also nominated for an Oscar for writing “Bugsy,” allegedly sexually harassed at least 38 women for decades, according to a Los Angeles Times report. The newspaper interviewed the women, who detailed similar encounters with the 72-year-old director over the years.

The women said Toback would tout his success in Hollywood and lured them into a meeting, interview or audition for a role. But the encounters would quickly turn sexual as the director asks the women inappropriate questions such as, “How often do you masturbate?” the report stated. Toback would then dry hump the women or masturbate in front of them.

HARVEY WEINSTEIN SEX SCANDAL: DETAILING THE ALLEGATIONS

Actress Adrienne LaValley recalled to the Los Angeles Times the time Toback harassed her in a hotel room in 2008 when he rubbed his crotch on her leg.

“I felt like a prostitute, an utter disappointment to myself, my parents, my friends. And I deserved not to tell anyone,” she said.

Starr Rinaldi said she was an aspiring actress when Toback approached her in New York City’s Central Park about 15 years ago. She said she felt the alleged harassment she dealt with from the director was a “test” to how serious she was about acting.

“He always wanted me to read for him in a hotel or come back to his apartment, like, ‘How serious are you about your craft?’” Rinaldi said. “And the horrible thing is, whichever road you choose, whether you sleep with him or walk away, you’re still broken.”

She added, “You have been violated.”

HARVEY WEINSTEIN DISPUTES LUPITA NYONG'O'S SEXUAL HARASSMENT CLAIMS

The women Toback targeted ranged from aspiring actresses, women in the industry to people on the streets. Louise Post, the guitarist and vocalist for indie rock band Veruca Salt, said she met Toback in 1987 and went to his apartment.

“He told me he’d love nothing more than to masturbate while looking into my eyes,” Post said. “Going to his apartment has been the source of shame for the past 30 years, that I allowed myself to be so gullible.”

The women told the newspaper they are telling their stories after multiple women, including Cara Delevingne and Gwyneth Paltrow, came forward accusing fallen movie mogul Harvey Weinstein of sexual harassment. Weinstein was ultimately fired from his own company after the New York Times revealed he paid off at least eight women, including Rose McGowan. The actress later tweeted she was raped by Weinstein.

Toback denied the allegations, telling the Los Angeles Times that he never met or has “no recollection” of meeting the women. He also said it was “biologically impossible” for him to engage in the sexual behavior the women accused him of doing because of the medication he takes for his diabetes and heart condition for the last 22 years.

McGowan also tweeted about the allegations against Toback, saying: ""James Toback damn you for stealing, damn you for traumatizing.""",Director James Toback accused of sexual harassment by over 30 women: report,https://www.foxnews.com/entertainment/2017/10/22/director-james-toback-accused-sexual-harassment-by-over-30-women-report.html
