,KEYWORDS,SUMMARY,TEXT,TITLE,URL
74,"['moments', 'powers', 'tonya', 'inspiring', 'remi', 'seal', 'transformers', 'adeleke', 'navy', 'j', 'shares', 'veteran', 'audio']","Audio clip: Listen to audio clip.
After the loss of his father left his family impoverished, Remi Adeleke turned to the streets of the Bronx to fill the hole in his heart--until one day, an unexpected wake-up call led him to the elite ranks of the military.
Today, this US Navy Veteran shares his story to show others that with resilience, anything is possible.
Adeleke, a US Navy SEAL Veteran and actor in ""Transformers: The Last Knight"", spends ""A Few Moments With..."" FOX's Tonya J.
Listen to ""A Few Moments With.."" Remi Adeleke below:Follow Tonya J.","Audio clip: Listen to audio clip.

After the loss of his father left his family impoverished, Remi Adeleke turned to the streets of the Bronx to fill the hole in his heart--until one day, an unexpected wake-up call led him to the elite ranks of the military. Today, this US Navy Veteran shares his story to show others that with resilience, anything is possible.

Adeleke, a US Navy SEAL Veteran and actor in ""Transformers: The Last Knight"", spends ""A Few Moments With..."" FOX's Tonya J. Powers as they talk about him being recipient of Jockey's 'Show 'Em What's Underneath' campaign, how he was chosen for the 'Transformers' movie and other projects he has lined up.

Listen to ""A Few Moments With.."" Remi Adeleke below:

Follow Tonya J. Powers on Twitter: @TonyaJPowers",Former US Navy SEAL Remi Adeleke Shares His Inspiring Story,https://radio.foxnews.com/2017/10/23/former-us-navy-seal-remi-adeleke-shares-his-inspiring-story/
75,"['series', 'petition', 'white', 'students', 'studying', 'complaints', 'poets', 'dept', 'requirements', 'longer', 'major', 'authors', 'decolonizes', 'yale', 'department', 'harms', 'english']","What’s more, new requirements are in place to ensure a more “diversified” slate of courses.
Previous requirements for the major included two courses in “Major English Poets,” including Chaucer, Shakespeare, Donne, Milton and Eliot, among others.
But that two-course series petitioners had deemed actively harmful due to its focus on white male poets.
The series is no longer a graduation requirement for Yale’s English majors.
The petition, a Google document which has since been made private, critiqued the perceived whiteness of the English department requirements: “A year spent around a seminar table where the literary contributions of women, people of color, and queer folk are absent actively harms all students, regardless of their identity.”","

BY ARYSSA DAMRON - YALE UNIVERSITY •THE COLLEGE FIX



English majors no longer required to take class focused on Chaucer, Shakespeare

A year and a half after a petition circulated calling for Yale to “decolonize the English department,” the first students are enrolled in a new course created by the department to increase the breadth of the curriculum and combat claims of departmental racism.

What’s more, new requirements are in place to ensure a more “diversified” slate of courses.

Previous requirements for the major included two courses in “Major English Poets,” including Chaucer, Shakespeare, Donne, Milton and Eliot, among others. But that two-course series petitioners had deemed actively harmful due to its focus on white male poets. The series is no longer a graduation requirement for Yale’s English majors.

The petition, a Google document which has since been made private, critiqued the perceived whiteness of the English department requirements: “A year spent around a seminar table where the literary contributions of women, people of color, and queer folk are absent actively harms all students, regardless of their identity.”",Yale 'Decolonizes' English Dept. After Complaints Studying White Authors 'Actively Harms' Students,http://nation.foxnews.com/2017/10/27/yale-decolonizes-english-dept-after-complaints-studying-white-authors-actively-harms
76,"['dr', 'details', 'oz', 'horrible', 'injury', 'werent', 'childhood', 'cornmeal', 'momma', 'youre', 'parton', 'kerosene', 'toes', 'dolly', 'work']","If it weren’t for cornmeal, kerosene and her momma, Dolly Parton may have lost her toes a long time ago.
Oz Show” airing Thursday.
Recalling the gory details to a grimacing Oz, Parton — was 6 or 7 years old at the time — says her “momma” came to the rescue with some household items, while her dad and brothers held her down.
“Momma, she put cornmeal; now, you’re a doctor, you might know,” the 71-year-old said to Oz, “I think the cornmeal was to absorb the blood.
“They work and they healed and I’m still walking on them,” she said of her toes.","If it weren’t for cornmeal, kerosene and her momma, Dolly Parton may have lost her toes a long time ago.

“I had jumped across the fence onto a broken mason jar and cut three of my toes, just my little toes on my right foot, almost off, and they were just kind of hanging there,” she told Dr. Mehmet Oz in an episode of the “Dr. Oz Show” airing Thursday.

Recalling the gory details to a grimacing Oz, Parton — was 6 or 7 years old at the time — says her “momma” came to the rescue with some household items, while her dad and brothers held her down.

“Momma, she put cornmeal; now, you’re a doctor, you might know,” the 71-year-old said to Oz, “I think the cornmeal was to absorb the blood. They put kerosene on it for antiseptic and momma took her sewing needles … and she literally had to sew my toes back on.”

And the DIY surgery was a success, as the country music icon has strutted in heels ever since.

“They work and they healed and I’m still walking on them,” she said of her toes.

This article originally appeared in Page Six.",Dolly Parton details horrible childhood injury on 'Dr. Oz',https://www.foxnews.com/entertainment/2017/10/25/dolly-parton-details-horrible-childhood-injury-on-dr-oz.html
77,"['disagree', 'live', 'weve', 'according', 'silencing', 'messages', 'christian', 'promote', 'instead', 'world', 'way', 'videographer', 'business', 'marriage', 'peace', 'celebrate', 'lets', 'work']","Just last week, we had students from Zimbabwe, South Sudan, Japan, Liberia, Saudi Arabia, Pakistan, Iran, and Mali around our table.
Like most people in the expressive professions, we work with all people; we just can’t promote all messages.
And having eight children means we can’t afford to travel the world, so we bring the world to us.
If the First Amendment only protects speech that is popular in its cultural day, then it really doesn’t protect any speech.
I wish I could invite you into our home and discuss it over one of my daughter’s amazing homemade lemon tarts.","Loving big is a way of life around our house. Everyone is welcome. Just last week, we had students from Zimbabwe, South Sudan, Japan, Liberia, Saudi Arabia, Pakistan, Iran, and Mali around our table. We’ve made our goal to fill our home as often as possible with people who are different from us—to learn, to laugh, and to grow—but you might not get that impression if you Google our business or check out my personal Facebook profile.

That’s because 10 months ago, my husband and I filed a federal lawsuit challenging the constitutionality of a Minnesota law that would require our small business to celebrate same-sex marriages if we enter into the marriage industry at all.

As Christians, we’d love to use our talents as filmmakers to celebrate the goodness of marriage as taught in the Bible though our work, but the state has made it clear that if we don’t promote all messages about marriage, we’ll face enormous fines, and even up to 90 days in jail, simply for living according to our convictions.

Since then, we’ve received a staggering amount of messages wishing death, disease, and poverty on us, our family, and even some of our closest associates all because we challenged the idea that the government shouldn’t have the power to silence or threaten anyone for not promoting all messages.

So when a federal judge ruled in our case, and equated our request to protect our conscience to posting a “White Applicants Only” sign in our window, we were both hurt and deeply offended. Like most people in the expressive professions, we work with all people; we just can’t promote all messages.

A person’s protected status is irrelevant to these types of message-based decisions. For example, an atheist print-shop owner is no more guilty of religious discrimination for declining to design a T-shirt for a Christian that proclaims “God exists” than we are guilty of sexual orientation discrimination for declining to create films promoting messages about marriage with which we disagree.

Not just our business practices, but our whole lives, run counter to the “whites only” analogy. Two of our sons are adopted from Ethiopia. Our youngest child is half Cameroonian and half Native American. And having eight children means we can’t afford to travel the world, so we bring the world to us. We do this precisely because we believe beauty exists in the diversity of God’s creation.

In fact, several years ago we intentionally began to stay home on holidays so that we could celebrate with people who would otherwise have no place to go. This has included spending Christmas with an alcoholic Vietnam veteran, a bisexual international student, and yes, even Trump supporters, among many, many others. We love all people. We work with all people. We simply don’t promote all messages.

But the irony of it all is that every single person operates this way. Nobody wants to be forced to promote messages—via custom artistic expression in our case—or have to repress their own speech just because their opinion is unpopular in the eyes of the government.

If the First Amendment only protects speech that is popular in its cultural day, then it really doesn’t protect any speech.

This is why we’re appealing the court’s ruling. This case is about preserving the freedom of all people to live according to their sincerely held beliefs—a principle we all should be able to support.

We are all on a journey with our convictions. I wish I could invite you into our home and discuss it over one of my daughter’s amazing homemade lemon tarts. But until that can happen, no matter where you are on that path or what you believe about marriage, we should all be able to agree that living peacefully according to our deepest convictions without the fear of government punishment is best for everyone.",Christian videographer: Let's live together in peace instead of silencing those with whom we disagree,https://www.foxnews.com/opinion/2017/10/20/christian-videographer-lets-live-together-in-peace-instead-silencing-those-with-whom-disagree.html
78,"['clipthe', 'mf', 'radio', 'talk', 'fox', 'eastern', '10262017', 'kilmeade', 'audio', 'hour', 'listen']","Audio clip: Listen to audio clip.
The first hour of the Brian Kilmeade Radio Show on FOX News Talk 9am-Noon Eastern M-F.","Audio clip: Listen to audio clip.

The first hour of the Brian Kilmeade Radio Show on FOX News Talk 9am-Noon Eastern M-F.",10/26/2017 First Hour,https://radio.foxnews.com/2017/10/26/10262017-first-hour/
79,"['notes', 'protect', 'hartfield', 'instructions', 'vegas', 'funeral', 'massacre', 'officer', 'called', 'left', 'shooting', 'military', 'buried', 'remember', 'killed', 'las']","A Las Vegas police officer and U.S. Army veteran who was among the 58 people killed in the worst mass shooting in modern U.S. history provided instructions ahead of his death.
His burial came after a funeral that drew more than 2,000 family members, friends and police and military officers, with honors that included a motorcade down the Las Vegas Strip.
The married father of two was off-duty and attending the Oct. 1 concert where a gunman opened fire from a hotel room.
LAS VEGAS SHOOTING DETAILS STILL MURKY AS MANDALAY BAY ORDERED TO KEEP EVIDENCEHowever, a year before his death, Hartfield began a computer file detailing the instructions for his funeral.
Hartfield asked to be buried in a veteran’s area so he could continue to “protect” the U.S. with the other buried veterans.","A Las Vegas police officer and U.S. Army veteran who was among the 58 people killed in the worst mass shooting in modern U.S. history provided instructions ahead of his death.

Charleston Hartfield, 34, was buried Friday following private graveside services. His burial came after a funeral that drew more than 2,000 family members, friends and police and military officers, with honors that included a motorcade down the Las Vegas Strip.

The married father of two was off-duty and attending the Oct. 1 concert where a gunman opened fire from a hotel room.

LAS VEGAS SHOOTING DETAILS STILL MURKY AS MANDALAY BAY ORDERED TO KEEP EVIDENCE

However, a year before his death, Hartfield began a computer file detailing the instructions for his funeral.

“If you’re reading this, then I’ve been called home,” Hartfield’s note read. The file was found by his wife, Veronica, following his death.

“Nothing I type will make this any easier, so I will get to the facts. My largest request: Please do not allow anyone to wear black. Black is totally depressing and I don’t want anyone expressing their sorrow over my passing,” Hartfield’s instructions read.

Hartfield asked that Nina Simone and Johnny Cash songs also be played during his funeral.

“I would like for everyone to enjoy themselves. And remember me for who I was. The truth only. None of that stuff about how great I was. Only real stories,” the officer wrote.

Everyone broke that rule over the next hour.

Friends, his cousin, brother and sister, and police and military officials including Brig. Gen. Zachary Doser, the head of the Nevada Army National Guard, characterized the man most called ""Chucky"" as an inspiration, a mentor and a quick wit.

Doser praised Hartfield, who at age 34 had accumulated 17 years of military service in Iraq and with a quartermaster unit in the Nevada Guard, as the epitome of ""everything good about being an American.""

Clark County Sheriff Joe Lombardo called Hartfield, an 11-year police veteran, a “remarkable officer” killed by “an unremarkable person.”

COUNTRY STARS HONOR LAS VEGAS SHOOTING VICTIMS AT CMT ARTISTS

Investigators have not determined what motivated the shooter, Stephen Paddock, 64, a retired accountant, real estate investor and high-stakes gambler, to plan and execute his attack.

Lombardo said Hartfield 's death was considered on-duty because he tried to shield, protect and shepherd people in a concert crowd from danger.

""That night, in a hail of gunfire, Charlie's last actions spoke for him,"" Lombardo said. ""He took actions to save lives.""

Hartfield asked to be buried in a veteran’s area so he could continue to “protect” the U.S. with the other buried veterans.

“The only way I would like to be placed in the ground is if it’s in a veteran’s area. That way myself and the crusty old vets can hold formations and continue to protect and serve our great country once more,” Hartfield wrote.

The Associated Press contributed to this report.",Las Vegas police officer killed in massacre left funeral notes: 'Remember me for who I was',https://www.foxnews.com/us/2017/10/21/las-vegas-police-officer-killed-in-massacre-left-funeral-notes-remember-me-for-who-was.html
80,"['irs', 'email', 'primarily', 'targeted', 'smoking', 'think', 'singling', 'tea', 'affiliation', 'targeting', 'agents', 'washington', 'party', 'supervisors', 'groups', 'timeslawyers', 'political', 'stephen']","By Stephen Dinan - The Washington TimesLawyers think they have finally found the smoking gun in the IRS’s tea party targeting scandal: an email from an IRS agent to her supervisors alerting them that the agency was, in fact, singling out some groups’ applications for extreme scrutiny “primarily because of their political party affiliation.”","By Stephen Dinan - The Washington Times

Lawyers think they have finally found the smoking gun in the IRS’s tea party targeting scandal: an email from an IRS agent to her supervisors alerting them that the agency was, in fact, singling out some groups’ applications for extreme scrutiny “primarily because of their political party affiliation.”",IRS Agent's Email Says Groups Were Targeted 'Primarily Because Of Their Political Party Affiliation',http://nation.foxnews.com/2017/10/26/irs-agents-email-says-groups-were-targeted-primarily-because-their-political-party#commenting
81,"['anchored', 'live', 'bream', 'fox', 'television', 'rulings', 'viewers', 'program', 'washington', 'shannon', 'supreme', 'press', 'et', 'channel', 'fnc', 'court']","FOX News Channel (FNC) will debut a live news program entitled Fox News @ Night anchored by Shannon Bream, launching on October 30, announced Jay Wallace, the network’s president of news.
Fox News @ Night will be a live hour of hard news and analysis of the most compelling stories from Washington and across the country.
She has provided coverage of every major election and Supreme court decision since she joined in 2007, including: the nomination of Neil Gorsuch to the Supreme Court; the 2015 Supreme Court decision to rule in favor of same-sex marriage nationwide; the 2013 Supreme Court rulings on the Defense of Marriage Act (DOMA) and California’s Proposition 8; and rulings on the Patient Protection and Affordable Care Act (PPACA) in 2012.
FOX News Channel (FNC) is a 24-hour all-encompassing news service dedicated to delivering breaking news as well as political and business news.
Owned by 21st Century Fox, FNC is available in more than 90 million homes and dominates the cable news landscape, routinely notching the top ten programs in the genre.","FOX News Channel (FNC) will debut a live news program entitled Fox News @ Night anchored by Shannon Bream, launching on October 30, announced Jay Wallace, the network’s president of news.

Fox News @ Night will be a live hour of hard news and analysis of the most compelling stories from Washington and across the country. With news breaking at all hours — and often late into the evening — the show will provide viewers with the very latest must-see information from FNC’s deep bench of correspondents and experts. It will function as a capstone on today’s most consequential news, with an eye toward setting the table for tomorrow’s ever-changing developments.

In making the announcement, Wallace said, “For the past decade, Shannon’s insight into the inner workings of the Supreme Court and Washington has made her a major asset to our news division. Her experience, coupled with the relationship she has with our viewers, offers a perfect fit for the anchor position at 11PM/ET as we extend our live primetime programming.”

Bream added, “It has been an honor to work alongside the hardest-working team in the news business for the past 10 years. I am delighted to bring our audience an hour of captivating television, providing viewers with a recap of the day’s most important stories and the latest breaking news.”

During her tenure at FNC, Bream most recently served as the network’s Supreme Court correspondent and regularly co-anchored America’s Newsroom (weekdays 9-11AM/ET) alongside Bill Hemmer. She has provided coverage of every major election and Supreme court decision since she joined in 2007, including: the nomination of Neil Gorsuch to the Supreme Court; the 2015 Supreme Court decision to rule in favor of same-sex marriage nationwide; the 2013 Supreme Court rulings on the Defense of Marriage Act (DOMA) and California’s Proposition 8; and rulings on the Patient Protection and Affordable Care Act (PPACA) in 2012. Additionally, Bream is the host of Livin’ the Bream, a podcast that shares inspirational stories, personal anecdotes and an insider’s perspective on actions and rulings from the high court.

Prior to joining the network in 2007, Bream served as a weekend anchor for WRC-TV (NBC) in Washington, DC and an evening anchor for WBTV (CBS) in Charlotte, NC. A graduate of Florida State University’s College of Law and Liberty University, she began her journalism career at WFTS-TV (ABC) in Tampa, FL.

FOX News Channel (FNC) is a 24-hour all-encompassing news service dedicated to delivering breaking news as well as political and business news. The number one network in cable, FNC has been the most watched television news channel for more than 15 years and according to a Suffolk University/USA Today poll, is the most trusted television news source in the country. Owned by 21st Century Fox, FNC is available in more than 90 million homes and dominates the cable news landscape, routinely notching the top ten programs in the genre.

###",ET NEWS PROGRAM ANCHORED BY SHANNON BREAM – Fox News Channel Press,http://press.foxnews.com/2017/09/fox-news-channel-launches-live-11pmet-news-program-anchored-by-shannon-bream/
82,"['campbell', 'linked', 'stump', 'lincoln', 'state', 'lincolns', 'family', 'days', 'society', 'donated', 'wooden', 'told', 'box', 'terry', 'early', 'posterity', 'abraham', 'political', 'journalregister']","Lincoln delivered a speech in the town in 1832, when he campaigned for the state House, according to the newspaper.
Terry Campbell of Green City, Missouri, gave the box to the society Friday on behalf of the Campbell family, the State Journal-Register said.
The land where Lincoln spoke reportedly has been in the family for more than 130 years.
Campbell inherited the box after his father, Bill Campbell, died several years ago.
“Once I got it, I knew what it was, and my dad was the same way,” Terry Campbell said of the object.","An Illinois historical society has received a fitting donation in the “Land of Lincoln.”

A box made from a tree stump on which Abraham Lincoln purportedly gave one of his earliest political speeches was given to the Rochester Historical Preservation Society last week, the (Springfield) State Journal-Register reports.

Lincoln delivered a speech in the town in 1832, when he campaigned for the state House, according to the newspaper.

Terry Campbell of Green City, Missouri, gave the box to the society Friday on behalf of the Campbell family, the State Journal-Register said. The land where Lincoln spoke reportedly has been in the family for more than 130 years.

Campbell inherited the box after his father, Bill Campbell, died several years ago. They’d discussed donating it.

ABRAHAM LINCOLN LETTER MYSTERY 'ALMOST CERTAINLY' SOLVED, EXPERTS SAY

“He told me about the box and that Lincoln had stood on this stump to give his first political speech, and when he got done, members of the family cut the stump down and then built boards out of it to build a box,” Terry Campbell told the newspaper. “There were actually two boxes made out of the stump, both of them alike, and (my dad) had the one.”

The society’s president, John Runions, told the Journal-Register that the box is “a great link” to Lincoln for the small community outside the state capitol of Springfield.

“Once I got it, I knew what it was, and my dad was the same way,” Terry Campbell said of the object. “He didn’t use it for anything. He kept it on a shelf. We knew what it was and that was just kind of a heirloom that sat there and we looked at it.”

The Associated Press contributed to this report.",Wooden box linked to Abraham Lincoln's early political days is donated for posterity,https://www.foxnews.com/us/2017/10/22/wooden-box-linked-to-abraham-lincolns-early-political-days-is-donated-for-posterity.html
83,"['crossshaped', 'removal', 'orders', 'public', 'monument', 'land', 'court']",,,Court orders removal of cross-shaped monument on public land,http://video.foxnews.com/v/5617920233001/
84,"['detonates', 'near', 'somali', 'worstever', 'weeks', 'mogadishu', 'bomb', 'suspected', 'targets', 'capital', 'somalias', 'hotel', 'street', 'car', 'suicide', 'truck']","A Somali police officer says a suspected suicide car bomb has detonated near the gate of a hotel close to the presidential palace in Mogadishu.
Mohamed Hussein says gunfire could be heard inside the Nasa-Hablod hotel.
Saturday's blast in Somalia's capital comes two weeks after more than 350 people were killed in a massive truck bombing on a busy Mogadishu street in the country's worst-ever attack.
The extremist group al-Shabab often targets high-profile areas of Mogadishu.","A Somali police officer says a suspected suicide car bomb has detonated near the gate of a hotel close to the presidential palace in Mogadishu.

Capt. Mohamed Hussein says gunfire could be heard inside the Nasa-Hablod hotel.

Saturday's blast in Somalia's capital comes two weeks after more than 350 people were killed in a massive truck bombing on a busy Mogadishu street in the country's worst-ever attack.

The extremist group al-Shabab often targets high-profile areas of Mogadishu.",Suspected car bomb detonates near hotel in Somalia's capital,http://www.foxnews.com/world/2017/10/28/suspected-car-bomb-detonates-near-hotel-in-somalias-capital.html
