,KEYWORDS,SUMMARY,TEXT,TITLE,URL
243,"['president', 'wrong', 'ken', 'oliver', 'vietnam', 'burns', 'south', 'vietnamese', 'war', 'north', 'pbs', 'richard', 'troops', 'mr', 'nixon']","Washington, D.C. – When Richard Nixon was in the White House, I was in Vietnam and he was my commander-in-chief.
Like too many others, Ken Burns portrays the young Soldiers, Sailors, Airmen and Marines of the Vietnam War as pot-smoking, drug-addicted, hippie marauders.
Because of endless fairy tales told by Ken Burns and others, many Americans associate Richard Nixon with the totality and the worst events of Vietnam.
This intricate and sophisticated approach took shape over four wartime years but receives only superficial mention in Mr. Burns’ production.
Mr. Burns, like John Kerry, has committed a grave injustice to those of us who fought there.","Washington, D.C. – When Richard Nixon was in the White House, I was in Vietnam and he was my commander-in-chief. When I was on Ronald Reagan’s National Security Council staff, I had the opportunity to brief former President Nixon on numerous occasions and came to admire his analysis of current events, insights on world affairs and compassion for our troops. His preparation for any meeting or discussion was exhaustive. His thirst for information was unquenchable and his tolerance for fools was non-existent.

Mr. Nixon’s prosecution of the war in Southeast Asia is poorly told by Ken Burns in his PBS documentary ""The Vietnam War.” That is but one of many reasons Mr. Burns’ latest work is such a disappointment and a tragic lost opportunity.

It’s sad, but I’ve come to accept that the real story of the heroic American GIs in Vietnam may never be told. Like too many others, Ken Burns portrays the young Soldiers, Sailors, Airmen and Marines of the Vietnam War as pot-smoking, drug-addicted, hippie marauders.

Those with whom I served were anything but. They did not commit the atrocities alleged in the unforgivable lies John Kerry described to a congressional committee so prominently featured by Mr. Burns. The troops my brother and I were blessed to lead were honorable, heroic and tenacious. They were patriotic, proud of their service, and true to their God and our country.

To depict them otherwise, as Ken Burns does, is an egregious disservice to them, the families of the fallen and to history. But his treatment of my fellow Vietnam War veterans is just the start. Some of the most blatant travesties in the film are reserved for President Nixon.

Ken Burns may not recall – but my family remembers do: It was Lyndon Johnson who sent my brother and me to war. It was Richard Nixon who brought us home.

Because of endless fairy tales told by Ken Burns and others, many Americans associate Richard Nixon with the totality and the worst events of Vietnam. It’s hardly evident in the Burns “documentary,” but important to note; when President Richard Nixon was elected in 1968, he inherited a nation – and a world – engulfed in discord and teetering on the brink of widespread chaos. His predecessor, Lyndon Johnson, was forced from office with a half million U.S. troops mired in combat and fierce anti-American government demonstrations across the country and in our nation’s capital.

Ken Burns may not recall – but my family remembers: It was Lyndon Johnson who sent my brother and me to war. It was Richard Nixon who brought us home. It is very likely we are alive today because Richard Nixon kept his word.

That’s not the only opportunity for accuracy Mr. Burns ignored. He could have credited President Nixon with granting 18-year olds the right to vote in July 1971 with the 26th Amendment to our Constitution [does “Ken” even recall the slogan, “Old Enough to Fight – Old Enough to Vote!” He should. Burns turned 18 that same month.].

President Nixon pressed on to all but finish the war. As promised, he brought our combat units home, returned 591 Prisoners of War to their wives and families, ended the draft, leveraged the conflict to open ties with China and improved relations with the Soviet Union. He pushed both Communist giants in Beijing and Moscow to force their North Vietnamese puppet into a negotiated settlement. Yet, he is portrayed in the Burns documentary as a cold-blooded, calculating politician more interested in re-election than the lives of U.S. troops in combat.

Contrary to the film’s portrayal, Nixon had a complicated strategy to achieve “Peace with Honor.” His goal was to train and equip the South Vietnamese military to defend their own country in a process he called “Vietnamization” and thereby – withdraw American troops.

President Nixon succeeded in isolating the North Vietnamese diplomatically and negotiated a peace agreement that preserved the right of the people of South Vietnam to determine their own political future. Imperfect as the Saigon government was, by 1973 the South Vietnamese had many well-trained troops and units that fought well and were proud to be our allies. This intricate and sophisticated approach took shape over four wartime years but receives only superficial mention in Mr. Burns’ production.

Despite Democrat majorities in both houses of Congress, Nixon – a deft political powerhouse – attained consistent support from America’s “Silent Majority.”

If Mr. Burns read President Nixon’s memoir or his two successive books in which the former president recounts his emotional anguish at the war’s toll – ""No More Vietnams"" and ""In the Arena"" – there is little evidence in the PBS production. Instead, Burns cherry-picks from the infamous “Nixon tapes” to brand the president as a devious manipulator, striving for mass deception – a patently false allegation.

By the time President Nixon resigned office on August 9, 1974, the Vietnam War was all but won and the South Vietnamese were confident of securing a permanent victory. But in December 1974 – three months after President Nixon departed the White House – a vengeful, Democrat-dominated Congress cut off all aid to South Vietnam.

It was a devastating blow for those to whom President Nixon had promised – not U.S. troops – but steadfast military, economic and diplomatic support. As chronicled in memoirs written afterwards in Hanoi, Moscow and Beijing, the communists celebrated. The ignominious end came with a full-scale North Vietnamese invasion five months later.

Despite the war’s tragic conclusion – and the trauma that continues to afflict our country – there is little in the Burns so-called documentary about the courage, patriotism and dedication of the U.S. troops who fought honorably, bravely, and the despicable way in which we were “welcomed” home.

The PBS “documentary” frequently reminds viewers of the “gallant nationalist fervor” among the North Vietnamese. But the South Vietnamese are portrayed as little more than conniving urchins and weak pawns of the imperialist Americans.

In a technique favored by the “Progressive-Left,” Mr. Burns uses a small cadre of anti-war U.S. and pro-Hanoi Vietnamese “eyewitnesses” to explain the complicated policies of the U.S. government. Mr. Burns apparently refused to interview Henry Kissinger, telling the Portland Press Herald he doubted “...Kissinger’s authority to adequately convey the perspectives of the U.S. government.” This alone disqualifies this “documentary” as definitive history on the Vietnam War.

Though Ken Burns and his collaborators claim otherwise, the real heroes of “The Vietnam War” were not U.S. protestors, but the troops my brother and I led. They fought valiantly for our country and the president who brought us home.

Since meeting President Nixon in the 1980s, I have always remembered how he understood the incredible sacrifice of American blood in the battlefields of Vietnam. He was dedicated to ending the war the right way and committed to sustaining American honor. He kept his promise to bring us home.

Ken Burns failed to keep his promise to tell all sides about the long and difficult war in Vietnam. Mr. Burns, like John Kerry, has committed a grave injustice to those of us who fought there.","Oliver North: PBS and Ken Burns get Vietnam – and Richard Nixon – wrong, again",https://www.foxnews.com/opinion/2017/10/27/oliver-north-pbs-and-ken-burns-get-vietnam-and-richard-nixon-wrong-again.html
244,"['concerts', 'midair', 'live', 'series', 'bringing', 'concert', 'southwest', 'flights', 'airlines', 'sfgate', 'social', 'music', 'warner', 'week']","Southwest Airlines is expanding its effort to bring midair music concerts to select flights, in a promotional move that is already attracting scorn across social media.
The airline announced a deal with Warner Music Nashville this week to continue the ""Live at 35"" in-air concert series, which began in 2011, SFGate reported.
Southwest, which operates more than 1 million flights annually, plans to host only about 20 in-flight concerts per year, according to SFGate.
But prospective passengers voiced concerns on social media Friday that the music would be disruptive.
A Southwest representative said the company decided to expand the concert series because customers typically appreciate the music once in-flight.","Southwest Airlines is expanding its effort to bring midair music concerts to select flights, in a promotional move that is already attracting scorn across social media.

The airline announced a deal with Warner Music Nashville this week to continue the ""Live at 35"" in-air concert series, which began in 2011, SFGate reported.

Southwest, which operates more than 1 million flights annually, plans to host only about 20 in-flight concerts per year, according to SFGate. But prospective passengers voiced concerns on social media Friday that the music would be disruptive.

A Southwest representative said the company decided to expand the concert series because customers typically appreciate the music once in-flight.

Click here for more from SFGate.com.",Southwest Airlines bringing live midair concerts to flights,https://www.foxnews.com/travel/2017/10/27/southwest-airlines-bringing-live-midair-concerts-to-flights.html
245,"['fbi', 'tarnishes', 'shillue', 'investigation', 'byron', 'isnt', 'used', 'washington', 'campaign', 'clintondossier', 'audio', 'york', 'bombshell', 'clinton']","On Wednesday, Fox News contributor Byron York join Tom Shillue to give his take on the Washington Post bombshell that the Clinton campaign funded the infamous Trump-Russia dossier.
Byron York said while the news isn't surprising, the confirmation of Clinton's connection with salacious report isn't just a black eye for the Democrats, but also for the FBI.
Because the clearly partisan dossier was used to justify an investigation in the Trump campaign, the Feds have a lot of explaining to do.
York also says the FBI needs to explain why they stonewalled Republicans' request for more information about the Dossier.
Tom Shillue also asked Byron York about how this would impact the ongoing Russian investigation, Robert Mueller's job status and the growing Clinton foundation uranium scandal.","Audio clip: Listen to audio clip.

On Wednesday, Fox News contributor Byron York join Tom Shillue to give his take on the Washington Post bombshell that the Clinton campaign funded the infamous Trump-Russia dossier.

Byron York said while the news isn't surprising, the confirmation of Clinton's connection with salacious report isn't just a black eye for the Democrats, but also for the FBI.

Because the clearly partisan dossier was used to justify an investigation in the Trump campaign, the Feds have a lot of explaining to do. York also says the FBI needs to explain why they stonewalled Republicans' request for more information about the Dossier.

Tom Shillue also asked Byron York about how this would impact the ongoing Russian investigation, Robert Mueller's job status and the growing Clinton foundation uranium scandal.",Byron York: How The Clinton-Dossier Bombshell Tarnishes The FBI …,https://radio.foxnews.com/2017/10/25/byron-york-how-the-clinton-dossier-bombshell-tarnishes-the-fbi/
246,"['expansion', 'fox', 'anchor', 'franchise', 'weekday', 'cable', 'reporter', 'program', 'programs', 'announces', 'morning', 'press', 'channel', 'fnc', 'friends']","FOX & Friends FIRST to Begin at 4AMFNC Leads Cable News Industry with More Women in Anchor/Host Roles Across Daytime and Primetime ProgrammingNEW YORK — OCTOBER 4, 2017 — FOX News Channel (FNC) is expanding the FOX & Friends franchise by one hour, announced Suzanne Scott, president of programming for FNC.
Beginning October 9th, FOX & Friends FIRST will be presented from 4-6AM/ET and FOX & Friends will continue in the 6-9AM/ET timeslot.
The 4AM hour of FOX & Friends First will be solo-hosted by Heather Childers, while the 5AM hour will be co-anchored by Jillian Mele and Rob Schmitt.
On pace to have its highest-rated year in network history, FOX & Friends has been FNC’s signature morning program for more than 19 years.
Additionally, each hour of the show offers reports on general news, sports, weather, politics, business and entertainment provided by FOX & Friends FIRST co-host Jillian Mele.","FOX & Friends FIRST to Begin at 4AM

FNC Leads Cable News Industry with More Women in Anchor/Host Roles Across Daytime and Primetime Programming

NEW YORK — OCTOBER 4, 2017 — FOX News Channel (FNC) is expanding the FOX & Friends franchise by one hour, announced Suzanne Scott, president of programming for FNC. Beginning October 9th, FOX & Friends FIRST will be presented from 4-6AM/ET and FOX & Friends will continue in the 6-9AM/ET timeslot. The 4AM hour of FOX & Friends First will be solo-hosted by Heather Childers, while the 5AM hour will be co-anchored by Jillian Mele and Rob Schmitt.

With the expansion of the franchise, FNC now has more women anchoring and hosting programs than any other cable news network on weekdays from 4AM-12AM/ET. Additionally, upon the debut of Fox News @ Night on October 30th, FNC will have live weekday programming for 20 hours a day.

In making the announcement, Scott said, “As FOX & Friends continues to mark its most-watched year in network history, we are thrilled to give our viewers more of the morning franchise they love.”

FOX & Friends FIRST is presented prior to the network’s signature morning show, previewing the day ahead by covering the latest news headlines in politics, business, entertainment and health. The early morning program is the number one cable news program in its timeslot, dominating CNN and MSNBC in both total viewers and the 25-54 demographic.

On pace to have its highest-rated year in network history, FOX & Friends has been FNC’s signature morning program for more than 19 years. Co-hosted by Steve Doocy, Ainsley Earhardt and Brian Kilmeade, the show has eclipsed the competition for 190 consecutive months. Featuring interviews with numerous celebrities, authors, athletes and political heavyweights, the program also includes regular stunts and musical performances both on set and outside before gathering crowds. Additionally, each hour of the show offers reports on general news, sports, weather, politics, business and entertainment provided by FOX & Friends FIRST co-host Jillian Mele.

Heather Childers joined FNC in 2010 as a general assignment reporter based in New York. During her tenure, she served as an anchor of America’s News HQ from 2011 to 2013, as well as helped launch FOX & Friends FIRST, where she has been a co-host for nearly five years. Prior to joining FNC, Childers served as a weekday evening anchor for News 14 Carolina (YNN 14) in Charlotte, NC. She was also a weekend evening anchor and weekday reporter for WLOS-TV (ABC 13) in Asheville, NC and a weekday anchor for WFLX-TV (FOX 29) in Albany, GA. Childers began her career as a producer at WCNC-TV (NBC 22) in Charlotte, NC. She graduated from the University of North Carolina with a B.A. in English.

Jillian Mele joined FNC from Comcast SportsNet Philadelphia (CSN Philly) in March 2017. While with CSN Philly, she earned an Emmy Award for her co-host role on the local morning news program, Breakfast on Broad. Earlier in her career, Mele spent seven years with WCAU-TV (NBC 10) in Philadelphia, PA and reported in various capacities, including as a news, sports and traffic reporter. She got her on-air start as a local news anchor for stations in Presque Isle, Maine, and Binghamton, NY. Mele received a B.A. in arts and communication from La Salle University.

Rob Schmitt was named a weekend news anchor and general assignment reporter at FNC in June 2016 and has served as a substitute anchor for various programs including FOX & Friends First, and FOX Report. Prior to joining FNC, he was an anchor for WNBC-TV (NBC 4) in New York, helming the 12 Noon News while also contributing reports to the 5PM/ET and 6PM/ET news programs. Before joining WNBC-TV, Schmitt worked as an anchor and reporter for CBS2/KCAL9 (CBS) in Los Angeles, CA, and began his career at WPLG-TV (ABC) in Miami, FL. A native of Indiana, Schmitt received a B.A. from the Ernie Pyle School of Journalism at Indiana University.

FOX News Channel (FNC) is a 24-hour all-encompassing news service dedicated to delivering breaking news as well as political and business news. The number one network in cable, FNC has been the most-watched television news channel for more than 15 years and according to a Suffolk University/USA Today poll, is the most-trusted television news source in the country. Owned by 21st Century Fox, FNC is available in 90 million homes and dominates the cable news landscape, routinely notching the top ten programs in the genre.

-END-

FOX News Media Contact :

Jessica Jensen/212.301.3531",FOX NEWS CHANNEL ANNOUNCES EXPANSION OF FOX & FRIENDS FRANCHISE – Fox News Channel Press,http://press.foxnews.com/2017/10/fox-news-channel-announces-expansion-of-fox-friends-franchise/
247,"['baines', 'president', 'johnson', 'youll', 'lbj', 'times', 'lyndon', 'johnsons', 'texas', 'life', 'war', 'political']","When Vice president Lyndon Baines Johnson accompanied President John F. Kennedy to Dallas in November of 1963, Johnson's long political career seemed to be over.
With rumors abounding that Kennedy was going to drop him from the ticket in the upcoming 1964 election, Johnson had resigned himself to returning to a quiet life on his Texas ranch.
Then an assassin's bullet forever changed Lyndon Johnson's political fortune.
Lady Bird Johnson's home movies will give you a behind-the-scenes look at three decades of her husband's life.
And you'll hear how LBJ got what he wanted by using the legendary ""Johnson treatment.""","Audio clip: Listen to audio clip.

When Vice president Lyndon Baines Johnson accompanied President John F. Kennedy to Dallas in November of 1963, Johnson's long political career seemed to be over. With rumors abounding that Kennedy was going to drop him from the ticket in the upcoming 1964 election, Johnson had resigned himself to returning to a quiet life on his Texas ranch.

Then an assassin's bullet forever changed Lyndon Johnson's political fortune.

In this special biography episode of ""War Stories with Oliver North,"" you'll see how a former Texas school teacher made a rapid ascent through the ranks in Washington to become a political powerhouse. Lady Bird Johnson's home movies will give you a behind-the-scenes look at three decades of her husband's life. Former speech writer Harry Mcpherson reflects on how Johnson pushed sweeping civil rights reforms and dramatically expanded federal social programs through a reluctant congress. And you'll hear how LBJ got what he wanted by using the legendary ""Johnson treatment.""

Johnson's gradual escalation of the war in Vietnam divided the country, overshadowed his domestic policies and forever tainted his administration's accomplishments. Racial violence, political assassinations and growing opposition to the war made the 1960's one of the most tumultuous decades in our nation's history. Former secretary of health, education and welfare Joseph Califano recalls how the weight of trying to lead our country through the chaos took a terrible toll on the man who envisioned America as the ""great society,"" and gives you the inside story on the night LBJ went on national television and shocked the nation.",The Life And Times Of Lyndon Baines Johnson,https://radio.foxnews.com/2017/10/10/the-life-and-times-of-lyndon-baines-johnson/
