,KEYWORDS,SUMMARY,TEXT,TITLE,URL
169,"['wanted', 'kind', 'retire', 'im', 'need', 'concept', 'final', 'hard', 'going', 'kenny', 'rogers', 'enjoy', 'retirement']","Kenny Rogers promised himself he would retire from the music industry when he felt he could no longer put on shows ""properly.""
You get out there [and] it's hard, hard work.
The ""Islands in the Stream"" singer said his retirement is final and is not planning any future comebacks.
""I'm going out because I need to go out and I'm going to enjoy my time at home with my wife and kids.
I'm going to enjoy every moment of it.""","Kenny Rogers promised himself he would retire from the music industry when he felt he could no longer put on shows ""properly.""

""Every day is not a holiday. You get out there [and] it's hard, hard work. I can't do it like I used to do it,"" Rogers told Fox News. ""And I swore that I'd do this until I started embarrassing myself.""

The 79-year-old will bid farewell to his fans at an all-star final show Wednesday at Nashville's Bridgestone Arena. It will also mark the last time Rogers will sing with his longtime duet partner Dolly Parton.

""All these people wanted to come do songs of mine and say thank you because, I had kind of — I hate this, this is awkward for me — I had inspired them to some extent and they wanted to pay me back and I thought it was very nice, so I'm glad we're going to get a chance to do it,"" he said.

In addition to Parton, Rogers will be joined by Little Big Town, the Flaming Lips, Idina Menzel, Elle King, Jamey Johnson and Alison Krauss.

The ""Islands in the Stream"" singer said his retirement is final and is not planning any future comebacks.

""That's always been kind of a rub with me when people retire 10 times,"" he said. ""I'm going out because I need to go out and I'm going to enjoy my time at home with my wife and kids. I'm going to enjoy every moment of it.""

Reflecting on his decades-long career, Rogers said there have been certain standout moments.

""What's really made me happy is that I set out with a concept and it worked, and my concept now is to quit my concept.""",Kenny Rogers on retirement: 'I'm going out because I need to go out',https://www.foxnews.com/entertainment/2017/10/25/kenny-rogers-on-retirement-im-going-out-because-need-to-go-out.html
170,"['hogs', 'takes', 'hog', 'fawns', 'texas', 'east', 'clowers', 'killed', 'man', 'feral', 'backyard', 'property', '416pound', 'wild']","If you’re a feral hog, don’t mess with Texans.
That’s the lesson learned by a 416-pound wild hog that was killed by an East Texas man after wreaking havoc on his property for the past five years.
A man, Joe Clowers in Union Grove, Texas, killed the hog with an AR-15.
""My property lays between some populated areas and I try to maintain an environment like a sanctuary or nursery for the deer to raise fawns,"" Clowers told the Houston Chronicle.
Along with things like mosquitoes, fire ants, snakes and rats, wild hogs are probably one of the more disliked animals in the Lone Star state.","If you’re a feral hog, don’t mess with Texans.

That’s the lesson learned by a 416-pound wild hog that was killed by an East Texas man after wreaking havoc on his property for the past five years.

A man, Joe Clowers in Union Grove, Texas, killed the hog with an AR-15.

""My property lays between some populated areas and I try to maintain an environment like a sanctuary or nursery for the deer to raise fawns,"" Clowers told the Houston Chronicle.

Texas is home to the largest feral hog population in the United States, with an estimated 4 million hogs statewide, according to local media, and the animals are increasingly finding their way to developed suburbs.

Along with things like mosquitoes, fire ants, snakes and rats, wild hogs are probably one of the more disliked animals in the Lone Star state.

GRANNY BAGS GATOR WHILE ON HUNT WITH SON, GRANDCHILDREN

The hog had been preying on the fawns in the area and Clowers said he always stayed armed when visiting his deer feeders in case the beast charged him.

The departed hog will live on as a trophy mounted on the wall in his home, he added.

“He was the big daddy,"" Clowers said. ""I called him the bush beast.”",East Texas man takes down 416-pound wild hog in backyard,https://www.foxnews.com/us/2017/10/22/east-texas-man-takes-down-416-pound-wild-hog-in-backyard.html
171,"['fbi', 'coming', 'house', 'dossier', 'bombshells', 'records', 'fusions', 'firm', 'russia', 'trump', 'bank', 'fusion', 'release']","A judge may order Fusion GPS to give House investigators its bank records.
The answers are in Fusion’s bank records.
So why did the firm suddenly insist that middleman law firm Perkins Coie release Fusion from confidentiality agreements, and spill the beans on who hired it?
Because there’s something Fusion cares about keeping secret even more than the Clinton-DNC news—and that something is in those bank records.
We may learn the FBI knew the dossier was a bought-and-paid-for product of Candidate Clinton, but used it anyway.","A judge may order Fusion GPS to give House investigators its bank records.





By Kimberley A. Strassel, The Wall Street Journal



The confirmation this week that Hillary Clinton’s campaign and the Democratic National Committee paid an opposition-research firm for a “dossier” on Donald Trump is bombshell news. More bombshells are to come.

The Fusion GPS saga isn’t over. The Clinton-DNC funding is but a first glimpse into the shady election doings concealed within that oppo-research firm’s walls. We now know where Fusion got some of its cash, but the next question is how the firm used it. With whom did it work beyond former British spy Christopher Steele ? Whom did it pay? Who else was paying it?

The answers are in Fusion’s bank records. Fusion has doggedly refused to divulge the names of its clients for months now, despite extraordinary pressure. So why did the firm suddenly insist that middleman law firm Perkins Coie release Fusion from confidentiality agreements, and spill the beans on who hired it?

Because there’s something Fusion cares about keeping secret even more than the Clinton-DNC news—and that something is in those bank records. The release of the client names was a last-ditch effort to appease the House Intelligence Committee, which issued subpoenas to Fusion’s bank and was close to obtaining records until Fusion filed suit last week. The release was also likely aimed at currying favor with the court, given Fusion’s otherwise weak legal case. The judge could rule as early as Friday morning.

If the House wins, don’t be surprised if those records include money connected to Russians. In the past Fusion has worked with Russians, including lawyer Natalia Veselnitskaya, who happened to show up last year in Donald Trump Jr.’s office.

FBI bombshells are also yet to come. The bureau has stonewalled congressional subpoenas for documents related to the dossier, but that became harder with the DNC-Clinton news. On Thursday Speaker Paul Ryan announced the FBI had finally pledged to turn over its dossier file next week.

Assuming the FBI is comprehensive in its disclosure, expect to learn that the dossier was indeed a major basis of investigating the Trump team—despite reading like “the National Enquirer,” as Rep. Trey Gowdy aptly put it. We may learn the FBI knew the dossier was a bought-and-paid-for product of Candidate Clinton, but used it anyway. Or that it didn’t know, which would be equally disturbing.",The Coming Russia Bombshells,http://nation.foxnews.com/2017/10/27/coming-russia-bombshells#commenting
172,"['los', 'heaton', 'charlie', 'entry', 'stranger', 'denied', 'official', 'netflix', 'things', 'cocaine', 'star', 'arrived', 'associated', 'press', 'luggage', 'baggage']","Charlie Heaton, a star of the hit Netflix show “Stranger Things,” was denied entry into the U.S. last week after trace amounts of cocaine were found in his luggage when he arrived in Los Angeles.
A law enforcement official told the Associated Press that a customs canine sniffed Heaton’s luggage when he arrived at Los Angeles International Airport last Saturday and a small amount of cocaine was found.
The official, who spoke to the AP on condition of anonymity, said Heaton, a British citizen, was refused entry into the U.S. at the airport and returned to London.
According to TMZ, Heaton does not have a criminal history and was able to avoid being arrested.
The Associated Press contributed to this report.","Charlie Heaton, a star of the hit Netflix show “Stranger Things,” was denied entry into the U.S. last week after trace amounts of cocaine were found in his luggage when he arrived in Los Angeles.

A law enforcement official told the Associated Press that a customs canine sniffed Heaton’s luggage when he arrived at Los Angeles International Airport last Saturday and a small amount of cocaine was found.

The official, who spoke to the AP on condition of anonymity, said Heaton, a British citizen, was refused entry into the U.S. at the airport and returned to London. He wasn't arrested and no charges were filed.

According to TMZ, Heaton does not have a criminal history and was able to avoid being arrested.

Heaton stars as Jonathan Byers in the Netflix supernatural drama.

The Associated Press contributed to this report.",'Stranger Things' star Charlie Heaton denied entry into US after cocaine found in baggage,https://www.foxnews.com/entertainment/2017/10/28/stranger-things-star-charlie-heaton-denied-entry-into-us-after-cocaine-found-in-baggage.html
173,"['premium', 'kurtz', 'podcast', 'howard', 'mediabuzz']",,,#mediabuzz with Howard Kurtz Premium Podcast,https://radio.foxnews.com/mediabuzz-with-howard-kurtz-premium-podcast/
174,"['house', 'guests', 'unexpected', 'microfiber', 'tricks', 'dont', 'hide', 'sink', 'dirty', 'kitchen', 'start', 'wipe', 'clean', 'arrive', 'speedclean']","nextprev nextprevHave you ever noticed that when your friends unexpectedly pop by is also when your house is looking its worst?
It’s not a big deal to run the clean ones through another cycle after your guests leave.
RELATED: Get a New Dish Rack to Hold and Hide Dirty DishesWipe, wipe, wipe.
If your family uses a bar soap, hide it inside the shower and get out a pump soap for your guests.
If you don’t have time to go through your home and clean, create ways to distract your guests with pretty diversions.","next

prev next

prev

Have you ever noticed that when your friends unexpectedly pop by is also when your house is looking its worst? Or how about that last-minute call from your extended family telling you they are in the area and are going to be at your place shortly. I’m an expert in procrastination, and both of these situations have happened to me too many times. But I’ve learned how to quick-clean my home’s public spaces in 10 minutes or less. These tips are by no means ways to actually clean your home, but they will give the appearance of a respectable home when you’re short on time.

Hide the dirty dishes. Nothing makes a kitchen look worse than a sink full of dirty dishes. Put those used items in the dishwasher. If your dishwasher is full of clean dishes, put away just enough to make room for the dirty ones. It’s not a big deal to run the clean ones through another cycle after your guests leave. Don’t have a dishwasher? Fill a plastic tub with the dirty dishes and hide it in the cabinet under the sink. Just don’t forget that you put it there.

RELATED: Get a New Dish Rack to Hold and Hide Dirty Dishes

Wipe, wipe, wipe. Use a clean, damp microfiber cloth and wipe over everything in your kitchen. Microfiber is a great tool, and all it takes is a little water and elbow grease. You don’t have to spray your counters or wipe them dry. Start at one end of your kitchen and wipe down all your appliances, countertops and the sink. The microfiber will remove food, fingerprints and dust all in one motion.

Bedrooms to the rescue. After you’ve got the kitchen looking presentable, move on to the entryway. This will be the first area your guests will see. Pick up shoes, coats and backpacks and put them in a closet or bedroom. Your bedrooms are your secret weapon for hiding clutter.

By a nose. A quick way to make a great first impression is to place a fragrance over the doorway where your guests will enter. Just a light spritz of your favorite room spray on the door will give guests a lovely scent as they enter your home.

Don’t forget about the bathroom. It should be clean and ready for your guests. Undoubtedly, someone will need to use it. Start by closing the shower curtain and hide any clutter behind it. Give the toilet bowl a quick swish with a toilet brush. Then use a damp, fine woven microfiber cloth and start wiping the mirror, the top of the vanity, the sink and finally the outside of the toilet. If your family uses a bar soap, hide it inside the shower and get out a pump soap for your guests. And make sure to put out a clean hand towel.

RELATED: Budget-Friendly Bathroom Sets for Guests

Last-minute vacuum. Now that you have the kitchen and baths ready for your guests, take a few minutes to run the vacuum quickly over all the floors in your public rooms. You don’t have to be meticulous, just pick up the obvious dirt and pet hair. Remember, you are just cleaning for appearances. Your guests aren’t going to be looking that closely at your cleaning skills.

Flower power. If you don’t have time to go through your home and clean, create ways to distract your guests with pretty diversions. Simple cut flowers popped into a Mason jar make your kitchen look bright and clean. Also, a classic white plate filled with colorful fruit will attract attention to what you want and away from what you don’t.

RELATED: Start With These Gorgeous Low-Maintenance Indoor Plants

Turn the lights down. If you’ve got absolutely no time to get ready for guests, you can try this last-ditch technique: Turn the lights down low, or close the blinds. The darker the room, the less dirt your guests will see. The darkness will hide many of your sins.",8 tricks to speed-clean your house before unexpected guests arrive,https://www.foxnews.com/real-estate/2017/10/19/8-tricks-to-speed-clean-your-house-before-unexpected-guests-arrive.html
175,"['youtube', 'dr', 'peterson', 'prolific', 'topics', 'worlds', 'public', 'life', 'psychologist', 'discuss', 'meaning', 'turned', 'greg', 'universityclass', 'session', 'jordan']","Dr. Jordan Peterson is a Canadian clinical psychologist, cultural critic, and author of ... Prolific on Youtube discussing topics such as anxiety, depression, marriage, atheism and more.
Greg says he has ""turned YouTube into the world's greatest free public university"".
Class is in session.
Let's discuss the meaning of life.","Dr. Jordan Peterson is a Canadian clinical psychologist, cultural critic, and author of ... Prolific on Youtube discussing topics such as anxiety, depression, marriage, atheism and more. Greg says he has ""turned YouTube into the world's greatest free public university"".

Class is in session. Let's discuss the meaning of life.",Greg and Dr. Jordan Peterson Discuss the Meaning of Life,https://radio.foxnews.com/2017/10/25/greg-and-dr-jordan-peterson-discuss-the-meaning-of-life/
176,"['mark', 'abc', 'hbo', 'mistreated', 'book', 'nbc', 'halperin', 'sincerely', 'sexual', 'wrote', 'apologize', 'women', 'woman', 'allegations']","Political journalist Mark Halperin released a letter of apology Friday evening from his Twitter account following the bombshell sexual harassment allegations against him while he was employed with ABC News.
Halperin, 52, who left his positions at MSNBC and NBC following the allegations this week, wrote that he felt “profound guilt and responsibility” for his conduct.
“I am profoundly sorry for the pain and anguish I have caused by my past actions,” Halperin wrote.
But I didn’t need a call from HR (human resources) to know that I was a selfish, immature person, who was behaving in a manner that had to stop,” Halperin wrote.
Halperin joins the list of powerful men who have been accused of sexual misconduct in various industries in recent weeks.","Political journalist Mark Halperin released a letter of apology Friday evening from his Twitter account following the bombshell sexual harassment allegations against him while he was employed with ABC News.

Halperin, 52, who left his positions at MSNBC and NBC following the allegations this week, wrote that he felt “profound guilt and responsibility” for his conduct.

“I am profoundly sorry for the pain and anguish I have caused by my past actions,” Halperin wrote. “I apologize sincerely to the women I mistreated.”

MARK HALPERIN OUT AT NBC, MSNBC AND HBO AMID SEX ASSAULT ACCUSATIONS

Halperin continued that he was aware he was “part of the problem” at ABC News and recognized that he “had a problem.”

“No one had sued me, no one had filed a human resources complaint against me, no colleague had confronted me. But I didn’t need a call from HR (human resources) to know that I was a selfish, immature person, who was behaving in a manner that had to stop,” Halperin wrote.

Halperin said he went to counseling to work on his issues and he did not engage in the same behavior while he was employed at Time, Bloomberg, NBC News and Showtime.

MARK HALPERIN ACCUSED OF SEXUAL ASSAULT BY TWO MORE WOMEN

Halperin’s apology was released near the time CNN, which first published a report Wednesday detailing the sexual harassment allegations, came out with another article of four more women coming forward with new accusations, The Washington Post reported.

CNN reported one woman claimed Halperin masturbated in front of her while another woman said the “Game Change” co-author threw her against a restaurant window and threatened to derail her career after she rebuffed him.

Some of the allegations against him claim that, while working at ABC News, he grabbed a woman’s breasts without consent and pressed his clothed and erect penis against three of his co-workers.

Several employees suggested that his behavior was common knowledge, including former ABC correspondent Clarissa Ward who described it as “an open secret.”

Following the allegations, Penguin Press canceled a planned book by Halperin and John Heilemann about the 2016 election and HBO called off a miniseries that would have been based on the book. Halperin and Heilemann had collaborated on two previous books, including ""Game Change,"" a best-seller about the 2008 race that almost single-handedly revived the campaign book genre and was the basis for an award-winning HBO adaptation.

Halperin joins the list of powerful men who have been accused of sexual misconduct in various industries in recent weeks.

The Associated Press contributed to this report.",Mark Halperin: 'I apologize sincerely to the women I mistreated',https://www.foxnews.com/entertainment/2017/10/28/mark-halperin-apologize-sincerely-to-women-mistreated.html
177,"['museum', 'rare', 'pettibone', 'display', 'revolutionary', 'sword', 'battle', 'pettibones', 'war', 'american']","An extremely rare silver-hilted sword used by an American officer during the Revolutionary War is set to go on display for the first time.
500-YEAR-OLD NATIVE AMERICAN CANOE TO BE UNVEILED TO THE PUBLIC AT MISSISSIPPI MUSEUMExperts note that it is unusual for Revolutionary War swords to have the name of the original owner inscribed on the weapon.
The elder Pettibone’s tricorn hat is already on display at the Smithsonian’s National Museum of American History.
The discovery of Revolutionary War era artifacts offers a fascinating glimpse into the events that shaped America.
A storied Revolutionary War musket ball that was melted from a famously toppled statue of King George III, for example, went on display earlier this year at the Museum of the American Revolution.","An extremely rare silver-hilted sword used by an American officer during the Revolutionary War is set to go on display for the first time.

The small sword was owned by Col. Jonathan Pettibone of the 18th (Connecticut) Regiment, who fought in the battles for New York in 1776. Pettibone, of Simsbury, Connecticut, died in Rye, New York, in September of that year, shortly after the Battle of Long Island.

The weapon, which is inscribed with Pettibone’s name, will go on display at the Museum of the American Revolution in Philadelphia beginning in 2018.

500-YEAR-OLD NATIVE AMERICAN CANOE TO BE UNVEILED TO THE PUBLIC AT MISSISSIPPI MUSEUM

Experts note that it is unusual for Revolutionary War swords to have the name of the original owner inscribed on the weapon. The sword also bears the mark of its maker, silversmith Joseph Copp of New London, Connecticut.

“With the rare maker's hallmark, and considering who owned it and the history it probably saw, this sword is truly one of the most fascinating Revolutionary War weapons I have ever seen,” said Dr. Philip Mead, chief historian and director of curatorial affairs at the Museum, in a statement.

The Museum received the sword Wednesday from donor B. Owen Williams of Maryland, a descendent of Pettibone.

FROM ROYAL STATUE TO REVOLUTIONARY WAR BATTLE: THE AMAZING JOURNEY OF 'MELTED MAJESTY' MUSKET BALL

“As a family, we are delighted that the Museum will provide a home for this article, where it should be, in an exhibit to be seen by the many visitors who come to the Museum from all over,” said Williams, in the statement. “I’m thrilled that it has survived in remarkably good condition despite my youthful exuberance and blissful ignorance to play with it surreptitiously as a boy.”

After Pettibone’s death the sword was passed on to his son Jonathan Pettibone Jr., who also served in the Revolutionary War.

The elder Pettibone’s tricorn hat is already on display at the Smithsonian’s National Museum of American History.

The discovery of Revolutionary War era artifacts offers a fascinating glimpse into the events that shaped America. A storied Revolutionary War musket ball that was melted from a famously toppled statue of King George III, for example, went on display earlier this year at the Museum of the American Revolution.

SOLDIER’S FAITH: RARE BIBLE CARRIED AT THE BATTLE OF BUNKER HILL HAS MOVING INSCRIPTIONS

In August, a Revolutionary War-era knife was unearthed during an archaeological dig at Colonial Michilimackinac in Mackinaw City, Michigan, the latest in a series of amazing finds at the site.

Last month, archaeologists in Boston unearthed a centuries-old outhouse that may be linked to the family of Patriot Paul Revere.

Follow James Rogers on Twitter @jamesjrogers",Rare Revolutionary War sword to go on display for the first time,http://www.foxnews.com/science/2017/10/26/rare-revolutionary-war-sword-to-go-on-display-for-first-time.html
178,"['shillue', 'jackie', 'owing', 'writer', 'joke', 'money', 'reflected', 'man', 'stern', 'standup', 'tom', 'howard', 'sternmartling', 'working', 'rodney', 'writing', 'martling']","On The Tom Shillue Show, Jackie Martling reflected on his time as the head writer for The Howard Stern Show and his new book 'The Joke Man: Bow To Stern.'
Martling looked back at his days as a standup, writing for Howard Stern on his iconic radio show and his ""confrontation"" with Rodney Dangerfield over $1,000.","On The Tom Shillue Show, Jackie Martling reflected on his time as the head writer for The Howard Stern Show and his new book 'The Joke Man: Bow To Stern.'

Martling looked back at his days as a standup, writing for Howard Stern on his iconic radio show and his ""confrontation"" with Rodney Dangerfield over $1,000.",Jackie “The Joke Man” Martling On Working With Howard Stern & Owing Money To Rodney Dangerfield,https://radio.foxnews.com/2017/10/25/jackie-the-joke-man-martling-on-working-with-howard-stern-owing-money-to-rodney-dangerfield/
179,"['men', 'proves', 'clinton', 'president', 'dossier', 'weapon', 'timesfor', 'rowan', 'pummeled', 'washington', 'campaign', 'scarborough', 'trump', 'collusion', 'democrats', 'russians', 'pundits', 'wielded']","By Rowan Scarborough - The Washington TimesFor over a year, the Hillary Clinton campaign, other Democrats and liberal pundits have pummeled President Trump and his men with one main weapon: a dossier.","By Rowan Scarborough - The Washington Times

For over a year, the Hillary Clinton campaign, other Democrats and liberal pundits have pummeled President Trump and his men with one main weapon: a dossier.",Dossier Wielded By Democrats Proves Only Clinton Campaign Collusion With Russians,http://nation.foxnews.com/2017/10/27/dossier-wielded-democrats-proves-only-clinton-campaign-collusion-russians#commenting
